1	0.000000	10.215.173.1	10.215.173.2	DNS	62	Standard query 0x11f3 A mtalk.google.com
2	0.011494	10.215.173.1	57.144.163.33	TCP	60	60850 → xmpp-client(5222) [SYN] Seq=0 Win=65535 Len=0 MSS=9960 SACK_PERM TSval=1593105126 TSecr=0 WS=1024
3	0.016031	10.215.173.1	10.215.173.2	DNS	60	Standard query 0xd29b A g.whatsapp.net
4	0.060384	10.215.173.2	10.215.173.1	DNS	107	Standard query response 0x11f3 A mtalk.google.com CNAME mobile-gtalk.l.google.com A 74.125.26.188
5	0.066579	57.144.163.33	10.215.173.1	TCP	48	xmpp-client(5222) → 60850 [SYN, ACK] Seq=0 Ack=1 Win=4096 Len=0 MSS=9960 WS=1024
6	0.066983	10.215.173.1	57.144.163.33	TCP	40	60850 → xmpp-client(5222) [ACK] Seq=1 Ack=1 Win=65536 Len=0
7	0.080695	10.215.173.1	mobile-gtalk.l.google.com	TCP	60	59156 → hpvroom(5228) [SYN] Seq=0 Win=65535 Len=0 MSS=9960 SACK_PERM TSval=2262023162 TSecr=0 WS=1024
8	0.102601	10.215.173.1	57.144.163.33	TCP	44	60850 → xmpp-client(5222) [PSH, ACK] Seq=1 Ack=1 Win=65536 Len=4 [TCP PDU reassembled in 69]
9	0.102804	10.215.173.1	57.144.163.33	TCP	43	60850 → xmpp-client(5222) [PSH, ACK] Seq=5 Ack=1 Win=65536 Len=3 [TCP PDU reassembled in 69]
10	0.102826	10.215.173.1	57.144.163.33	TCP	46	60850 → xmpp-client(5222) [PSH, ACK] Seq=8 Ack=1 Win=65536 Len=6 [TCP PDU reassembled in 69]
11	0.102841	10.215.173.1	57.144.163.33	TCP	44	60850 → xmpp-client(5222) [PSH, ACK] Seq=14 Ack=1 Win=65536 Len=4 [TCP PDU reassembled in 69]
12	0.102987	57.144.163.33	10.215.173.1	TCP	40	xmpp-client(5222) → 60850 [ACK] Seq=1 Ack=18 Win=4193280 Len=0
13	0.108325	10.215.173.1	57.144.163.33	TCP	43	60850 → xmpp-client(5222) [PSH, ACK] Seq=18 Ack=1 Win=65536 Len=3 [TCP PDU reassembled in 69]
14	0.108433	10.215.173.1	57.144.163.33	TCP	376	60850 → xmpp-client(5222) [PSH, ACK] Seq=21 Ack=1 Win=65536 Len=336 [TCP PDU reassembled in 69]
15	0.108887	57.144.163.33	10.215.173.1	TCP	40	xmpp-client(5222) → 60850 [ACK] Seq=1 Ack=357 Win=4193280 Len=0
16	0.111020	10.215.173.2	10.215.173.1	DNS	99	Standard query response 0xd29b A g.whatsapp.net CNAME chat.cdn.whatsapp.net A 57.144.23.33
17	0.163695	mobile-gtalk.l.google.com	10.215.173.1	TCP	48	hpvroom(5228) → 59156 [SYN, ACK] Seq=0 Ack=1 Win=4096 Len=0 MSS=9960 WS=1024
18	0.163921	10.215.173.1	mobile-gtalk.l.google.com	TCP	40	59156 → hpvroom(5228) [ACK] Seq=1 Ack=1 Win=65536 Len=0
19	0.168298	10.215.173.1	mobile-gtalk.l.google.com	TLSv1.3	572	Client Hello (SNI=mtalk.google.com)
20	0.168753	mobile-gtalk.l.google.com	10.215.173.1	TCP	40	hpvroom(5228) → 59156 [ACK] Seq=1 Ack=533 Win=4193280 Len=0
21	0.198784	57.144.163.33	10.215.173.1	TCP	97	xmpp-client(5222) → 60850 [PSH, ACK] Seq=1 Ack=357 Win=4194304 Len=57 [TCP PDU reassembled in 71]
22	0.199199	10.215.173.1	57.144.163.33	TCP	40	60850 → xmpp-client(5222) [ACK] Seq=357 Ack=58 Win=65536 Len=0
23	0.199592	57.144.163.33	10.215.173.1	TCP	103	xmpp-client(5222) → 60850 [PSH, ACK] Seq=58 Ack=357 Win=4194304 Len=63 [TCP PDU reassembled in 71]
24	0.199794	10.215.173.1	57.144.163.33	TCP	40	60850 → xmpp-client(5222) [ACK] Seq=357 Ack=121 Win=65536 Len=0
25	0.209076	10.215.173.1	57.144.163.33	TCP	43	60850 → xmpp-client(5222) [PSH, ACK] Seq=357 Ack=121 Win=65536 Len=3 [TCP PDU reassembled in 69]
26	0.209241	57.144.163.33	10.215.173.1	TCP	40	xmpp-client(5222) → 60850 [ACK] Seq=121 Ack=360 Win=4193280 Len=0
27	0.209396	10.215.173.1	57.144.163.33	TCP	221	60850 → xmpp-client(5222) [PSH, ACK] Seq=360 Ack=121 Win=65536 Len=181 [TCP PDU reassembled in 69]
28	0.209498	57.144.163.33	10.215.173.1	TCP	40	xmpp-client(5222) → 60850 [ACK] Seq=121 Ack=541 Win=4193280 Len=0
29	0.209720	10.215.173.1	57.144.163.33	TCP	43	60850 → xmpp-client(5222) [PSH, ACK] Seq=541 Ack=121 Win=65536 Len=3 [TCP PDU reassembled in 69]
30	0.209822	57.144.163.33	10.215.173.1	TCP	40	xmpp-client(5222) → 60850 [ACK] Seq=121 Ack=544 Win=4193280 Len=0
31	0.211242	10.215.173.1	57.144.163.33	TCP	77	60850 → xmpp-client(5222) [PSH, ACK] Seq=544 Ack=121 Win=65536 Len=37 [TCP PDU reassembled in 69]
32	0.211366	57.144.163.33	10.215.173.1	TCP	40	xmpp-client(5222) → 60850 [ACK] Seq=121 Ack=581 Win=4193280 Len=0
33	0.211488	10.215.173.1	57.144.163.33	TCP	43	60850 → xmpp-client(5222) [PSH, ACK] Seq=581 Ack=121 Win=65536 Len=3 [TCP PDU reassembled in 69]
34	0.211504	10.215.173.1	57.144.163.33	TCP	92	60850 → xmpp-client(5222) [PSH, ACK] Seq=584 Ack=121 Win=65536 Len=52 [TCP PDU reassembled in 69]
35	0.211600	57.144.163.33	10.215.173.1	TCP	40	xmpp-client(5222) → 60850 [ACK] Seq=121 Ack=636 Win=4193280 Len=0
36	0.217325	10.215.173.1	57.144.163.33	TCP	43	60850 → xmpp-client(5222) [PSH, ACK] Seq=636 Ack=121 Win=65536 Len=3 [TCP PDU reassembled in 69]
37	0.217493	57.144.163.33	10.215.173.1	TCP	40	xmpp-client(5222) → 60850 [ACK] Seq=121 Ack=639 Win=4193280 Len=0
38	0.218869	10.215.173.1	57.144.163.33	TCP	93	60850 → xmpp-client(5222) [PSH, ACK] Seq=639 Ack=121 Win=65536 Len=53 [TCP PDU reassembled in 69]
39	0.219052	57.144.163.33	10.215.173.1	TCP	40	xmpp-client(5222) → 60850 [ACK] Seq=121 Ack=692 Win=4193280 Len=0
40	0.221837	10.215.173.1	57.144.163.33	TCP	43	60850 → xmpp-client(5222) [PSH, ACK] Seq=692 Ack=121 Win=65536 Len=3 [TCP PDU reassembled in 69]
41	0.221859	10.215.173.1	57.144.163.33	TCP	77	60850 → xmpp-client(5222) [PSH, ACK] Seq=695 Ack=121 Win=65536 Len=37 [TCP PDU reassembled in 69]
42	0.222011	57.144.163.33	10.215.173.1	TCP	40	xmpp-client(5222) → 60850 [ACK] Seq=121 Ack=732 Win=4193280 Len=0
43	0.251711	mobile-gtalk.l.google.com	10.215.173.1	TLSv1.3	243	Server Hello, Change Cipher Spec, Application Data
44	0.252012	10.215.173.1	mobile-gtalk.l.google.com	TCP	40	59156 → hpvroom(5228) [ACK] Seq=533 Ack=204 Win=67584 Len=0
45	0.253361	10.215.173.1	mobile-gtalk.l.google.com	TLSv1.3	104	Change Cipher Spec, Application Data
46	0.253515	mobile-gtalk.l.google.com	10.215.173.1	TCP	40	hpvroom(5228) → 59156 [ACK] Seq=204 Ack=597 Win=4193280 Len=0
47	0.293866	10.215.173.1	mobile-gtalk.l.google.com	TLSv1.3	529	Application Data
48	0.294012	mobile-gtalk.l.google.com	10.215.173.1	TCP	40	hpvroom(5228) → 59156 [ACK] Seq=204 Ack=1086 Win=4193280 Len=0
49	0.354204	57.144.163.33	10.215.173.1	TCP	88	xmpp-client(5222) → 60850 [PSH, ACK] Seq=121 Ack=732 Win=4194304 Len=48 [TCP PDU reassembled in 71]
50	0.356512	57.144.163.33	10.215.173.1	TCP	1488	xmpp-client(5222) → 60850 [PSH, ACK] Seq=169 Ack=732 Win=4194304 Len=1448 [TCP PDU reassembled in 71]
51	0.357058	10.215.173.1	57.144.163.33	TCP	40	60850 → xmpp-client(5222) [ACK] Seq=732 Ack=1617 Win=86016 Len=0
52	0.367233	mobile-gtalk.l.google.com	10.215.173.1	TLSv1.3	575	Application Data, Application Data
53	0.388834	mobile-gtalk.l.google.com	10.215.173.1	TLSv1.3	128	Application Data
54	0.388971	10.215.173.1	mobile-gtalk.l.google.com	TCP	40	59156 → hpvroom(5228) [ACK] Seq=1086 Ack=827 Win=68608 Len=0
55	0.389626	mobile-gtalk.l.google.com	10.215.173.1	TLSv1.3	74	Application Data
56	0.395229	57.144.163.33	10.215.173.1	TCP	77	xmpp-client(5222) → 60850 [PSH, ACK] Seq=1617 Ack=732 Win=4194304 Len=37 [TCP PDU reassembled in 71]
57	0.411561	10.215.173.1	57.144.163.33	TCP	43	60850 → xmpp-client(5222) [PSH, ACK] Seq=732 Ack=1654 Win=86016 Len=3 [TCP PDU reassembled in 69]
58	0.411712	57.144.163.33	10.215.173.1	TCP	40	xmpp-client(5222) → 60850 [ACK] Seq=1654 Ack=735 Win=4193280 Len=0
59	0.411814	10.215.173.1	57.144.163.33	TCP	1137	60850 → xmpp-client(5222) [PSH, ACK] Seq=735 Ack=1654 Win=86016 Len=1097 [TCP PDU reassembled in 69]
60	0.411880	57.144.163.33	10.215.173.1	TCP	40	xmpp-client(5222) → 60850 [ACK] Seq=1654 Ack=1832 Win=4192256 Len=0
61	0.432728	10.215.173.1	mobile-gtalk.l.google.com	TCP	40	59156 → hpvroom(5228) [ACK] Seq=1086 Ack=861 Win=68608 Len=0
62	0.499839	57.144.163.33	10.215.173.1	TCP	73	xmpp-client(5222) → 60850 [PSH, ACK] Seq=1654 Ack=1832 Win=4194304 Len=33 [TCP PDU reassembled in 71]
63	0.544824	10.215.173.1	57.144.163.33	TCP	40	60850 → xmpp-client(5222) [ACK] Seq=1832 Ack=1687 Win=86016 Len=0
64	10.501029	10.215.173.1	57.144.163.33	TCP	40	[TCP Keep-Alive] 60850 → xmpp-client(5222) [ACK] Seq=1831 Ack=1687 Win=86016 Len=0
65	10.501285	57.144.163.33	10.215.173.1	TCP	40	[TCP Keep-Alive ACK] xmpp-client(5222) → 60850 [ACK] Seq=1687 Ack=1832 Win=4194304 Len=0
66	20.552904	10.215.173.1	57.144.163.33	TCP	40	[TCP Keep-Alive] 60850 → xmpp-client(5222) [ACK] Seq=1831 Ack=1687 Win=86016 Len=0
67	20.553155	57.144.163.33	10.215.173.1	TCP	40	[TCP Keep-Alive ACK] xmpp-client(5222) → 60850 [ACK] Seq=1687 Ack=1832 Win=4194304 Len=0
68	21.412112	10.215.173.1	57.144.163.33	TCP	43	60850 → xmpp-client(5222) [PSH, ACK] Seq=1832 Ack=1687 Win=86016 Len=3 [TCP PDU reassembled in 69]
69	21.412304	10.215.173.1	57.144.163.33	TCP	70	60850 → xmpp-client(5222) [PSH, ACK] Seq=1835 Ack=1687 Win=86016 Len=30 [TCP PDU reassembled in 69]
70	21.412682	57.144.163.33	10.215.173.1	TCP	40	xmpp-client(5222) → 60850 [ACK] Seq=1687 Ack=1865 Win=4193280 Len=0
71	21.508822	57.144.163.33	10.215.173.1	TCP	81	xmpp-client(5222) → 60850 [PSH, ACK] Seq=1687 Ack=1865 Win=4194304 Len=41 [TCP PDU reassembled in 71]
72	21.509258	10.215.173.1	57.144.163.33	TCP	40	60850 → xmpp-client(5222) [ACK] Seq=1865 Ack=1728 Win=86016 Len=0
73	31.529266	10.215.173.1	57.144.163.33	TCP	40	[TCP Keep-Alive] 60850 → xmpp-client(5222) [ACK] Seq=1864 Ack=1728 Win=86016 Len=0
74	31.529761	57.144.163.33	10.215.173.1	TCP	40	[TCP Keep-Alive ACK] xmpp-client(5222) → 60850 [ACK] Seq=1728 Ack=1865 Win=4194304 Len=0
75	41.549283	10.215.173.1	57.144.163.33	TCP	40	[TCP Keep-Alive] 60850 → xmpp-client(5222) [ACK] Seq=1864 Ack=1728 Win=86016 Len=0
76	41.549788	57.144.163.33	10.215.173.1	TCP	40	[TCP Keep-Alive ACK] xmpp-client(5222) → 60850 [ACK] Seq=1728 Ack=1865 Win=4194304 Len=0
77	151.576573	10.215.173.1	57.144.163.33	TCP	40	60850 → xmpp-client(5222) [RST, ACK] Seq=1865 Ack=1728 Win=86016 Len=0
78	151.579798	57.144.163.33	10.215.173.1	TCP	40	xmpp-client(5222) → 60850 [RST, ACK] Seq=1728 Ack=1865 Win=64512 Len=0
79	168.424302	mobile-gtalk.l.google.com	10.215.173.1	TLSv1.3	378	Application Data
80	168.425536	10.215.173.1	mobile-gtalk.l.google.com	TCP	40	59156 → hpvroom(5228) [ACK] Seq=1086 Ack=1199 Win=69632 Len=0
81	168.507817	10.215.173.1	mobile-gtalk.l.google.com	TLSv1.3	78	Application Data
82	168.508569	mobile-gtalk.l.google.com	10.215.173.1	TCP	40	hpvroom(5228) → 59156 [ACK] Seq=1199 Ack=1124 Win=4193280 Len=0
83	168.547866	10.215.173.1	chat.cdn.whatsapp.net	TCP	60	52692 → https(443) [SYN] Seq=0 Win=65535 Len=0 MSS=9960 SACK_PERM TSval=2390794150 TSecr=0 WS=1024
84	168.554253	10.215.173.1	10.215.173.2	DNS	60	Standard query 0x17be A g.whatsapp.net
85	168.577147	10.215.173.2	10.215.173.1	DNS	111	Standard query response 0x17be A g.whatsapp.net CNAME chat.cdn.whatsapp.net A 157.240.14.53
86	168.605007	chat.cdn.whatsapp.net	10.215.173.1	TCP	48	https(443) → 52692 [SYN, ACK] Seq=0 Ack=1 Win=4096 Len=0 MSS=9960 WS=1024
87	168.605729	10.215.173.1	chat.cdn.whatsapp.net	TCP	40	52692 → https(443) [ACK] Seq=1 Ack=1 Win=65536 Len=0
88	168.621846	10.215.173.1	chat.cdn.whatsapp.net	TCP	44	52692 → https(443) [PSH, ACK] Seq=1 Ack=1 Win=65536 Len=4 [TCP PDU reassembled in 89]
89	168.622182	10.215.173.1	chat.cdn.whatsapp.net	SSL	43	Continuation Data
90	168.622233	10.215.173.1	chat.cdn.whatsapp.net	SSL	46	Continuation Data
91	168.622279	10.215.173.1	chat.cdn.whatsapp.net	TCP	44	52692 → https(443) [PSH, ACK] Seq=14 Ack=1 Win=65536 Len=4 [TCP PDU reassembled in 93]
92	168.622597	chat.cdn.whatsapp.net	10.215.173.1	TCP	40	https(443) → 52692 [ACK] Seq=1 Ack=18 Win=4193280 Len=0
93	168.625970	10.215.173.1	chat.cdn.whatsapp.net	SSL	43	Continuation Data
94	168.626391	chat.cdn.whatsapp.net	10.215.173.1	TCP	40	https(443) → 52692 [ACK] Seq=1 Ack=21 Win=4193280 Len=0
95	168.626621	10.215.173.1	chat.cdn.whatsapp.net	SSL	376	Continuation Data
96	168.627002	chat.cdn.whatsapp.net	10.215.173.1	TCP	40	https(443) → 52692 [ACK] Seq=1 Ack=357 Win=4193280 Len=0
97	168.722488	chat.cdn.whatsapp.net	10.215.173.1	SSL	97	Continuation Data
98	168.722836	10.215.173.1	chat.cdn.whatsapp.net	TCP	40	52692 → https(443) [ACK] Seq=357 Ack=58 Win=65536 Len=0
99	168.722976	chat.cdn.whatsapp.net	10.215.173.1	SSL	103	Continuation Data
100	168.723297	10.215.173.1	chat.cdn.whatsapp.net	TCP	40	52692 → https(443) [ACK] Seq=357 Ack=121 Win=65536 Len=0
101	168.729914	10.215.173.1	chat.cdn.whatsapp.net	TCP	43	52692 → https(443) [PSH, ACK] Seq=357 Ack=121 Win=65536 Len=3 [TCP PDU reassembled in 102]
102	168.729963	10.215.173.1	chat.cdn.whatsapp.net	SSL	221	Continuation Data
103	168.730319	chat.cdn.whatsapp.net	10.215.173.1	TCP	40	https(443) → 52692 [ACK] Seq=121 Ack=541 Win=4193280 Len=0
104	168.730984	10.215.173.1	chat.cdn.whatsapp.net	TCP	43	52692 → https(443) [PSH, ACK] Seq=541 Ack=121 Win=65536 Len=3 [TCP PDU reassembled in 105]
105	168.731027	10.215.173.1	chat.cdn.whatsapp.net	SSL	77	Continuation Data
106	168.731277	chat.cdn.whatsapp.net	10.215.173.1	TCP	40	https(443) → 52692 [ACK] Seq=121 Ack=581 Win=4193280 Len=0
107	168.732974	10.215.173.1	chat.cdn.whatsapp.net	TCP	43	52692 → https(443) [PSH, ACK] Seq=581 Ack=121 Win=65536 Len=3 [TCP PDU reassembled in 108]
108	168.733013	10.215.173.1	chat.cdn.whatsapp.net	SSL	92	Continuation Data
109	168.733281	chat.cdn.whatsapp.net	10.215.173.1	TCP	40	https(443) → 52692 [ACK] Seq=121 Ack=636 Win=4193280 Len=0
110	168.740926	10.215.173.1	chat.cdn.whatsapp.net	TCP	43	52692 → https(443) [PSH, ACK] Seq=636 Ack=121 Win=65536 Len=3 [TCP PDU reassembled in 111]
111	168.740983	10.215.173.1	chat.cdn.whatsapp.net	SSL	146	Continuation Data
112	168.741475	chat.cdn.whatsapp.net	10.215.173.1	TCP	40	https(443) → 52692 [ACK] Seq=121 Ack=745 Win=4193280 Len=0
113	168.883956	chat.cdn.whatsapp.net	10.215.173.1	SSL	1530	Continuation Data
114	168.919117	chat.cdn.whatsapp.net	10.215.173.1	SSL	89	Continuation Data
115	168.919709	10.215.173.1	chat.cdn.whatsapp.net	TCP	40	52692 → https(443) [ACK] Seq=745 Ack=1660 Win=86016 Len=0
116	168.919926	chat.cdn.whatsapp.net	10.215.173.1	SSL	515	Continuation Data
117	168.920226	chat.cdn.whatsapp.net	10.215.173.1	SSL	77	Continuation Data
118	168.920718	10.215.173.1	chat.cdn.whatsapp.net	TCP	40	52692 → https(443) [ACK] Seq=745 Ack=2172 Win=89088 Len=0
119	168.949584	10.215.173.1	chat.cdn.whatsapp.net	TCP	43	52692 → https(443) [PSH, ACK] Seq=745 Ack=2172 Win=89088 Len=3 [TCP PDU reassembled in 120]
120	168.949638	10.215.173.1	chat.cdn.whatsapp.net	SSL	95	Continuation Data
121	168.952058	chat.cdn.whatsapp.net	10.215.173.1	TCP	40	https(443) → 52692 [ACK] Seq=2172 Ack=803 Win=4193280 Len=0
122	168.996931	10.215.173.1	chat.cdn.whatsapp.net	TCP	43	52692 → https(443) [PSH, ACK] Seq=803 Ack=2172 Win=89088 Len=3 [TCP PDU reassembled in 123]
123	168.996986	10.215.173.1	chat.cdn.whatsapp.net	SSL	92	Continuation Data
124	168.997290	chat.cdn.whatsapp.net	10.215.173.1	TCP	40	https(443) → 52692 [ACK] Seq=2172 Ack=858 Win=4193280 Len=0
125	169.018662	10.215.173.1	chat.cdn.whatsapp.net	TCP	43	52692 → https(443) [PSH, ACK] Seq=858 Ack=2172 Win=89088 Len=3 [TCP PDU reassembled in 126]
126	169.018714	10.215.173.1	chat.cdn.whatsapp.net	SSL	70	Continuation Data
127	169.019515	chat.cdn.whatsapp.net	10.215.173.1	TCP	40	https(443) → 52692 [ACK] Seq=2172 Ack=891 Win=4193280 Len=0
128	169.025489	10.215.173.1	chat.cdn.whatsapp.net	TCP	43	52692 → https(443) [PSH, ACK] Seq=891 Ack=2172 Win=89088 Len=3 [TCP PDU reassembled in 129]
129	169.025760	10.215.173.1	chat.cdn.whatsapp.net	SSL	536	Continuation Data
130	169.026129	chat.cdn.whatsapp.net	10.215.173.1	TCP	40	https(443) → 52692 [ACK] Seq=2172 Ack=1390 Win=4193280 Len=0
131	169.112171	chat.cdn.whatsapp.net	10.215.173.1	SSL	81	Continuation Data
132	169.127083	chat.cdn.whatsapp.net	10.215.173.1	SSL	73	Continuation Data
133	169.127816	10.215.173.1	chat.cdn.whatsapp.net	TCP	40	52692 → https(443) [ACK] Seq=1390 Ack=2246 Win=89088 Len=0
134	178.193587	10.215.173.1	mobile-gtalk.l.google.com	TLSv1.3	133	Application Data
135	178.194365	mobile-gtalk.l.google.com	10.215.173.1	TCP	40	hpvroom(5228) → 59156 [ACK] Seq=1199 Ack=1217 Win=4193280 Len=0
136	179.135730	10.215.173.1	chat.cdn.whatsapp.net	TCP	40	[TCP Keep-Alive] 52692 → https(443) [ACK] Seq=1389 Ack=2246 Win=89088 Len=0
137	179.135951	chat.cdn.whatsapp.net	10.215.173.1	TCP	40	[TCP Keep-Alive ACK] https(443) → 52692 [ACK] Seq=2246 Ack=1390 Win=4194304 Len=0
138	181.214530	10.215.173.1	chat.cdn.whatsapp.net	TCP	43	52692 → https(443) [PSH, ACK] Seq=1390 Ack=2246 Win=89088 Len=3 [TCP PDU reassembled in 139]
139	181.214806	10.215.173.1	chat.cdn.whatsapp.net	SSL	92	Continuation Data
140	181.218179	chat.cdn.whatsapp.net	10.215.173.1	TCP	40	https(443) → 52692 [ACK] Seq=2246 Ack=1445 Win=4193280 Len=0
141	181.242365	10.215.173.1	chat.cdn.whatsapp.net	TCP	43	52692 → https(443) [PSH, ACK] Seq=1445 Ack=2246 Win=89088 Len=3 [TCP PDU reassembled in 143]
142	181.242489	chat.cdn.whatsapp.net	10.215.173.1	TCP	40	https(443) → 52692 [ACK] Seq=2246 Ack=1448 Win=4193280 Len=0
143	181.243528	10.215.173.1	chat.cdn.whatsapp.net	SSL	82	Continuation Data
144	181.244006	chat.cdn.whatsapp.net	10.215.173.1	TCP	40	https(443) → 52692 [ACK] Seq=2246 Ack=1490 Win=4193280 Len=0
145	181.333462	10.215.173.1	chat.cdn.whatsapp.net	TCP	43	52692 → https(443) [PSH, ACK] Seq=1490 Ack=2246 Win=89088 Len=3 [TCP PDU reassembled in 147]
146	181.333661	chat.cdn.whatsapp.net	10.215.173.1	TCP	40	https(443) → 52692 [ACK] Seq=2246 Ack=1493 Win=4193280 Len=0
147	181.334774	10.215.173.1	chat.cdn.whatsapp.net	SSL	92	Continuation Data
148	181.334898	chat.cdn.whatsapp.net	10.215.173.1	TCP	40	https(443) → 52692 [ACK] Seq=2246 Ack=1545 Win=4193280 Len=0
149	181.339019	chat.cdn.whatsapp.net	10.215.173.1	SSL	240	Continuation Data
150	181.383142	10.215.173.1	chat.cdn.whatsapp.net	TCP	40	52692 → https(443) [ACK] Seq=1545 Ack=2446 Win=92160 Len=0
151	181.394319	10.215.173.1	chat.cdn.whatsapp.net	TCP	43	52692 → https(443) [PSH, ACK] Seq=1545 Ack=2446 Win=92160 Len=3 [TCP PDU reassembled in 152]
152	181.394351	10.215.173.1	chat.cdn.whatsapp.net	SSL	93	Continuation Data
153	181.394675	chat.cdn.whatsapp.net	10.215.173.1	TCP	40	https(443) → 52692 [ACK] Seq=2446 Ack=1601 Win=4193280 Len=0
154	181.489967	chat.cdn.whatsapp.net	10.215.173.1	SSL	99	Continuation Data
155	181.490169	10.215.173.1	chat.cdn.whatsapp.net	TCP	40	52692 → https(443) [ACK] Seq=1601 Ack=2505 Win=92160 Len=0
156	183.080170	10.215.173.1	chat.cdn.whatsapp.net	TCP	43	52692 → https(443) [PSH, ACK] Seq=1601 Ack=2505 Win=92160 Len=3 [TCP PDU reassembled in 158]
157	183.080658	chat.cdn.whatsapp.net	10.215.173.1	TCP	40	https(443) → 52692 [ACK] Seq=2505 Ack=1604 Win=4193280 Len=0
158	183.082079	10.215.173.1	chat.cdn.whatsapp.net	SSL	77	Continuation Data
159	183.082334	chat.cdn.whatsapp.net	10.215.173.1	TCP	40	https(443) → 52692 [ACK] Seq=2505 Ack=1641 Win=4193280 Len=0
160	183.934496	10.215.173.1	chat.cdn.whatsapp.net	TCP	43	52692 → https(443) [PSH, ACK] Seq=1641 Ack=2505 Win=92160 Len=3 [TCP PDU reassembled in 161]
161	183.934659	10.215.173.1	chat.cdn.whatsapp.net	SSL	721	Continuation Data
162	183.935022	chat.cdn.whatsapp.net	10.215.173.1	TCP	40	https(443) → 52692 [ACK] Seq=2505 Ack=2325 Win=4193280 Len=0
163	184.042439	chat.cdn.whatsapp.net	10.215.173.1	SSL	110	Continuation Data
164	184.042758	10.215.173.1	chat.cdn.whatsapp.net	TCP	40	52692 → https(443) [ACK] Seq=2325 Ack=2575 Win=92160 Len=0
165	184.204938	chat.cdn.whatsapp.net	10.215.173.1	SSL	103	Continuation Data
166	184.205615	10.215.173.1	chat.cdn.whatsapp.net	TCP	40	52692 → https(443) [ACK] Seq=2325 Ack=2638 Win=92160 Len=0
167	184.228842	10.215.173.1	chat.cdn.whatsapp.net	TCP	43	52692 → https(443) [PSH, ACK] Seq=2325 Ack=2638 Win=92160 Len=3 [TCP PDU reassembled in 169]
168	184.229101	chat.cdn.whatsapp.net	10.215.173.1	TCP	40	https(443) → 52692 [ACK] Seq=2638 Ack=2328 Win=4193280 Len=0
169	184.229537	10.215.173.1	chat.cdn.whatsapp.net	SSL	93	Continuation Data
170	184.229735	chat.cdn.whatsapp.net	10.215.173.1	TCP	40	https(443) → 52692 [ACK] Seq=2638 Ack=2381 Win=4193280 Len=0
171	184.249437	10.215.173.1	chat.cdn.whatsapp.net	TCP	43	52692 → https(443) [PSH, ACK] Seq=2381 Ack=2638 Win=92160 Len=3 [TCP PDU reassembled in 172]
172	184.251578	10.215.173.1	chat.cdn.whatsapp.net	SSL	62	Continuation Data
173	184.252158	chat.cdn.whatsapp.net	10.215.173.1	TCP	40	https(443) → 52692 [ACK] Seq=2638 Ack=2406 Win=4193280 Len=0
174	184.258114	10.215.173.1	chat.cdn.whatsapp.net	TCP	43	52692 → https(443) [PSH, ACK] Seq=2406 Ack=2638 Win=92160 Len=3 [TCP PDU reassembled in 175]
175	184.258153	10.215.173.1	chat.cdn.whatsapp.net	SSL	71	Continuation Data
176	184.258372	chat.cdn.whatsapp.net	10.215.173.1	TCP	40	https(443) → 52692 [ACK] Seq=2638 Ack=2440 Win=4193280 Len=0
177	184.349795	chat.cdn.whatsapp.net	10.215.173.1	SSL	80	Continuation Data
178	184.350628	chat.cdn.whatsapp.net	10.215.173.1	SSL	78	Continuation Data
179	184.351300	10.215.173.1	chat.cdn.whatsapp.net	TCP	40	52692 → https(443) [ACK] Seq=2440 Ack=2716 Win=92160 Len=0
180	184.353209	chat.cdn.whatsapp.net	10.215.173.1	SSL	81	Continuation Data
181	184.395221	10.215.173.1	chat.cdn.whatsapp.net	TCP	40	52692 → https(443) [ACK] Seq=2440 Ack=2757 Win=92160 Len=0
182	194.559788	10.215.173.1	chat.cdn.whatsapp.net	TCP	40	[TCP Keep-Alive] 52692 → https(443) [ACK] Seq=2439 Ack=2757 Win=92160 Len=0
183	194.560028	chat.cdn.whatsapp.net	10.215.173.1	TCP	40	[TCP Keep-Alive ACK] https(443) → 52692 [ACK] Seq=2757 Ack=2440 Win=4194304 Len=0
184	198.620485	10.215.173.1	chat.cdn.whatsapp.net	TCP	43	52692 → https(443) [PSH, ACK] Seq=2440 Ack=2757 Win=92160 Len=3 [TCP PDU reassembled in 185]
185	198.620964	10.215.173.1	chat.cdn.whatsapp.net	SSL	71	Continuation Data
186	198.621702	chat.cdn.whatsapp.net	10.215.173.1	TCP	40	https(443) → 52692 [ACK] Seq=2757 Ack=2474 Win=4193280 Len=0
187	198.716526	chat.cdn.whatsapp.net	10.215.173.1	SSL	81	Continuation Data
188	198.716899	10.215.173.1	chat.cdn.whatsapp.net	TCP	40	52692 → https(443) [ACK] Seq=2474 Ack=2798 Win=92160 Len=0
189	208.896365	10.215.173.1	chat.cdn.whatsapp.net	TCP	40	[TCP Keep-Alive] 52692 → https(443) [ACK] Seq=2473 Ack=2798 Win=92160 Len=0
190	208.896852	chat.cdn.whatsapp.net	10.215.173.1	TCP	40	[TCP Keep-Alive ACK] https(443) → 52692 [ACK] Seq=2798 Ack=2474 Win=4194304 Len=0
191	208.947511	10.215.173.1	chat.cdn.whatsapp.net	TCP	43	52692 → https(443) [PSH, ACK] Seq=2474 Ack=2798 Win=92160 Len=3 [TCP PDU reassembled in 192]
192	208.947574	10.215.173.1	chat.cdn.whatsapp.net	SSL	62	Continuation Data
193	208.947982	chat.cdn.whatsapp.net	10.215.173.1	TCP	40	https(443) → 52692 [ACK] Seq=2798 Ack=2499 Win=4193280 Len=0
194	209.049045	chat.cdn.whatsapp.net	10.215.173.1	SSL	79	Continuation Data
195	209.049486	10.215.173.1	chat.cdn.whatsapp.net	TCP	40	52692 → https(443) [ACK] Seq=2499 Ack=2837 Win=92160 Len=0
