1	0.000000	10.215.173.1	142.251.218.33	TCP	60	52680 → https(443) [SYN] Seq=0 Win=65535 Len=0 MSS=9960 SACK_PERM TSval=3223809715 TSecr=0 WS=1024
2	0.070400	142.251.218.33	10.215.173.1	TCP	48	https(443) → 52680 [SYN, ACK] Seq=0 Ack=1 Win=512 Len=0 MSS=9960 WS=1024
3	0.070701	10.215.173.1	142.251.218.33	TCP	40	52680 → https(443) [ACK] Seq=1 Ack=1 Win=65536 Len=0
4	0.220843	10.215.173.1	57.144.163.33	TCP	60	47324 → https(443) [SYN] Seq=0 Win=65535 Len=0 MSS=9960 SACK_PERM TSval=1592472000 TSecr=0 WS=1024
5	0.229823	10.215.173.1	142.251.218.33	TCP	552	[TCP Window Full] 52680 → https(443) [PSH, ACK] Seq=1 Ack=1 Win=65536 Len=512 [TCP PDU reassembled in 12]
6	0.233125	10.215.173.1	10.215.173.2	DNS	60	Standard query 0x2a01 A g.whatsapp.net
7	0.273204	10.215.173.1	10.215.173.2	DNS	62	Standard query 0xc022 A mtalk.google.com
8	0.285902	142.251.218.33	10.215.173.1	TCP	40	https(443) → 52680 [ACK] Seq=1 Ack=513 Win=523264 Len=0
9	0.286332	10.215.173.1	142.251.218.33	TCP	552	52680 → https(443) [PSH, ACK] Seq=513 Ack=1 Win=65536 Len=512 [TCP PDU reassembled in 12]
10	0.286461	10.215.173.1	142.251.218.33	TCP	552	52680 → https(443) [PSH, ACK] Seq=1025 Ack=1 Win=65536 Len=512 [TCP PDU reassembled in 12]
11	0.286497	10.215.173.1	142.251.218.33	TCP	552	52680 → https(443) [PSH, ACK] Seq=1537 Ack=1 Win=65536 Len=512 [TCP PDU reassembled in 12]
12	0.286537	10.215.173.1	142.251.218.33	TLSv1.2	224	Client Hello (SNI=lh3.googleusercontent.com)
13	0.288062	142.251.218.33	10.215.173.1	TCP	40	https(443) → 52680 [ACK] Seq=1 Ack=698 Win=521216 Len=0
14	0.288526	142.251.218.33	10.215.173.1	TCP	40	https(443) → 52680 [RST, ACK] Seq=1 Ack=698 Win=63488 Len=0
15	0.289657	57.144.163.33	10.215.173.1	TCP	48	https(443) → 47324 [SYN, ACK] Seq=0 Ack=1 Win=512 Len=0 MSS=9960 WS=1024
16	0.290222	10.215.173.1	57.144.163.33	TCP	40	47324 → https(443) [ACK] Seq=1 Ack=1 Win=65536 Len=0
17	0.324377	10.215.173.1	57.144.163.33	TCP	44	47324 → https(443) [PSH, ACK] Seq=1 Ack=1 Win=65536 Len=4 [TCP PDU reassembled in 18]
18	0.324685	10.215.173.1	57.144.163.33	SSL	43	Continuation Data
19	0.324737	10.215.173.1	whatsapp-chatd-edge-shv-03-mia3.facebook.com	SSL	46	Continuation Data
20	0.325078	whatsapp-chatd-edge-shv-03-mia3.facebook.com	10.215.173.1	TCP	40	https(443) → 47324 [ACK] Seq=1 Ack=14 Win=523264 Len=0
21	0.325274	10.215.173.1	whatsapp-chatd-edge-shv-03-mia3.facebook.com	TCP	44	47324 → https(443) [PSH, ACK] Seq=14 Ack=1 Win=65536 Len=4 [TCP PDU reassembled in 24]
22	0.325374	whatsapp-chatd-edge-shv-03-mia3.facebook.com	10.215.173.1	TCP	40	https(443) → 47324 [ACK] Seq=1 Ack=18 Win=523264 Len=0
23	0.327300	10.215.173.2	10.215.173.1	DNS	99	Standard query response 0x2a01 A g.whatsapp.net CNAME chat.cdn.whatsapp.net A 57.144.253.33
24	0.336944	10.215.173.1	whatsapp-chatd-edge-shv-03-mia3.facebook.com	SSL	43	Continuation Data
25	0.337049	10.215.173.1	whatsapp-chatd-edge-shv-03-mia3.facebook.com	SSL	376	Continuation Data
26	0.337383	whatsapp-chatd-edge-shv-03-mia3.facebook.com	10.215.173.1	TCP	40	https(443) → 47324 [ACK] Seq=1 Ack=357 Win=523264 Len=0
27	0.344939	10.215.173.2	10.215.173.1	DNS	107	Standard query response 0xc022 A mtalk.google.com CNAME mobile-gtalk.l.google.com A 74.125.196.188
28	0.456906	whatsapp-chatd-edge-shv-03-mia3.facebook.com	10.215.173.1	SSL	160	Continuation Data
29	0.457256	10.215.173.1	whatsapp-chatd-edge-shv-03-mia3.facebook.com	TCP	40	47324 → https(443) [ACK] Seq=357 Ack=121 Win=65536 Len=0
30	0.515314	10.215.173.1	whatsapp-chatd-edge-shv-03-mia3.facebook.com	TCP	43	47324 → https(443) [PSH, ACK] Seq=357 Ack=121 Win=65536 Len=3 [TCP PDU reassembled in 31]
31	0.515359	10.215.173.1	whatsapp-chatd-edge-shv-03-mia3.facebook.com	SSL	221	Continuation Data
32	0.515373	10.215.173.1	whatsapp-chatd-edge-shv-03-mia3.facebook.com	TCP	43	47324 → https(443) [PSH, ACK] Seq=541 Ack=121 Win=65536 Len=3 [TCP PDU reassembled in 33]
33	0.515383	10.215.173.1	whatsapp-chatd-edge-shv-03-mia3.facebook.com	SSL	77	Continuation Data
34	0.515393	10.215.173.1	whatsapp-chatd-edge-shv-03-mia3.facebook.com	TCP	43	47324 → https(443) [PSH, ACK] Seq=581 Ack=121 Win=65536 Len=3 [TCP PDU reassembled in 35]
35	0.515403	10.215.173.1	whatsapp-chatd-edge-shv-03-mia3.facebook.com	SSL	92	Continuation Data
36	0.515828	whatsapp-chatd-edge-shv-03-mia3.facebook.com	10.215.173.1	TCP	40	https(443) → 47324 [ACK] Seq=121 Ack=636 Win=523264 Len=0
37	0.523613	10.215.173.1	whatsapp-chatd-edge-shv-03-mia3.facebook.com	TCP	43	47324 → https(443) [PSH, ACK] Seq=636 Ack=121 Win=65536 Len=3 [TCP PDU reassembled in 39]
38	0.523702	whatsapp-chatd-edge-shv-03-mia3.facebook.com	10.215.173.1	TCP	40	https(443) → 47324 [ACK] Seq=121 Ack=639 Win=523264 Len=0
39	0.527431	10.215.173.1	whatsapp-chatd-edge-shv-03-mia3.facebook.com	SSL	77	Continuation Data
40	0.527629	whatsapp-chatd-edge-shv-03-mia3.facebook.com	10.215.173.1	TCP	40	https(443) → 47324 [ACK] Seq=121 Ack=676 Win=523264 Len=0
41	0.530824	10.215.173.1	whatsapp-chatd-edge-shv-03-mia3.facebook.com	TCP	43	47324 → https(443) [PSH, ACK] Seq=676 Ack=121 Win=65536 Len=3 [TCP PDU reassembled in 43]
42	0.530975	whatsapp-chatd-edge-shv-03-mia3.facebook.com	10.215.173.1	TCP	40	https(443) → 47324 [ACK] Seq=121 Ack=679 Win=523264 Len=0
43	0.541612	10.215.173.1	whatsapp-chatd-edge-shv-03-mia3.facebook.com	SSL	94	Continuation Data
44	0.541869	whatsapp-chatd-edge-shv-03-mia3.facebook.com	10.215.173.1	TCP	40	https(443) → 47324 [ACK] Seq=121 Ack=733 Win=523264 Len=0
45	0.606480	10.215.173.1	mobile-gtalk.l.google.com	TCP	60	43418 → hpvroom(5228) [SYN] Seq=0 Win=65535 Len=0 MSS=9960 SACK_PERM TSval=3600386446 TSecr=0 WS=1024
46	0.610636	10.215.173.1	whatsapp-chatd-edge-shv-03-mia3.facebook.com	TCP	43	47324 → https(443) [PSH, ACK] Seq=733 Ack=121 Win=65536 Len=3 [TCP PDU reassembled in 47]
47	0.610776	10.215.173.1	whatsapp-chatd-edge-shv-03-mia3.facebook.com	SSL	95	Continuation Data
48	0.610791	10.215.173.1	whatsapp-chatd-edge-shv-03-mia3.facebook.com	TCP	43	47324 → https(443) [PSH, ACK] Seq=791 Ack=121 Win=65536 Len=3 [TCP PDU reassembled in 49]
49	0.610803	10.215.173.1	whatsapp-chatd-edge-shv-03-mia3.facebook.com	SSL	77	Continuation Data
50	0.610863	whatsapp-chatd-edge-shv-03-mia3.facebook.com	10.215.173.1	SSL	1055	Continuation Data
51	0.616971	10.215.173.1	whatsapp-chatd-edge-shv-03-mia3.facebook.com	TCP	40	47324 → https(443) [ACK] Seq=831 Ack=1136 Win=86016 Len=0
52	0.617292	whatsapp-chatd-edge-shv-03-mia3.facebook.com	10.215.173.1	TCP	40	https(443) → 47324 [ACK] Seq=1136 Ack=831 Win=523264 Len=0
53	0.631795	whatsapp-chatd-edge-shv-03-mia3.facebook.com	10.215.173.1	SSL	521	Continuation Data
54	0.632170	10.215.173.1	whatsapp-chatd-edge-shv-03-mia3.facebook.com	TCP	40	47324 → https(443) [ACK] Seq=831 Ack=1617 Win=88064 Len=0
55	0.670522	whatsapp-chatd-edge-shv-03-mia3.facebook.com	10.215.173.1	SSL	1099	Continuation Data
56	0.671961	10.215.173.1	whatsapp-chatd-edge-shv-03-mia3.facebook.com	TCP	40	47324 → https(443) [ACK] Seq=831 Ack=2676 Win=108544 Len=0
57	0.686646	mobile-gtalk.l.google.com	10.215.173.1	TCP	48	hpvroom(5228) → 43418 [SYN, ACK] Seq=0 Ack=1 Win=512 Len=0 MSS=9960 WS=1024
58	0.687303	10.215.173.1	mobile-gtalk.l.google.com	TCP	40	43418 → hpvroom(5228) [ACK] Seq=1 Ack=1 Win=65536 Len=0
59	0.716770	whatsapp-chatd-edge-shv-03-mia3.facebook.com	10.215.173.1	SSL	79	Continuation Data
60	0.719087	10.215.173.1	whatsapp-chatd-edge-shv-03-mia3.facebook.com	TCP	40	47324 → https(443) [ACK] Seq=831 Ack=2715 Win=108544 Len=0
61	0.815584	10.215.173.1	mobile-gtalk.l.google.com	TCP	552	[TCP Window Full] 43418 → hpvroom(5228) [PSH, ACK] Seq=1 Ack=1 Win=65536 Len=512 [TCP PDU reassembled in 63]
62	0.816305	mobile-gtalk.l.google.com	10.215.173.1	TCP	40	hpvroom(5228) → 43418 [ACK] Seq=1 Ack=513 Win=523264 Len=0
63	0.816684	10.215.173.1	mobile-gtalk.l.google.com	TLSv1.3	60	Client Hello (SNI=mtalk.google.com)
64	0.817042	mobile-gtalk.l.google.com	10.215.173.1	TCP	40	hpvroom(5228) → 43418 [ACK] Seq=1 Ack=533 Win=523264 Len=0
65	0.922432	mobile-gtalk.l.google.com	10.215.173.1	TLSv1.3	243	Server Hello, Change Cipher Spec, Application Data
66	0.924214	10.215.173.1	mobile-gtalk.l.google.com	TCP	40	43418 → hpvroom(5228) [ACK] Seq=533 Ack=204 Win=66560 Len=0
67	0.925347	10.215.173.1	mobile-gtalk.l.google.com	TLSv1.3	104	Change Cipher Spec, Application Data
68	0.925669	mobile-gtalk.l.google.com	10.215.173.1	TCP	40	hpvroom(5228) → 43418 [ACK] Seq=204 Ack=597 Win=523264 Len=0
69	1.014132	10.215.173.1	mobile-gtalk.l.google.com	TLSv1.3	519	Application Data
70	1.014548	mobile-gtalk.l.google.com	10.215.173.1	TCP	40	hpvroom(5228) → 43418 [ACK] Seq=204 Ack=1076 Win=523264 Len=0
71	1.097537	mobile-gtalk.l.google.com	10.215.173.1	TLSv1.3	575	Application Data, Application Data
72	1.109768	mobile-gtalk.l.google.com	10.215.173.1	TLSv1.3	162	Application Data, Application Data
73	1.111261	10.215.173.1	mobile-gtalk.l.google.com	TCP	40	43418 → hpvroom(5228) [ACK] Seq=1076 Ack=861 Win=87040 Len=0
74	1.424618	10.215.173.1	whatsapp-chatd-edge-shv-03-mia3.facebook.com	TCP	43	47324 → https(443) [PSH, ACK] Seq=831 Ack=2715 Win=108544 Len=3 [TCP PDU reassembled in 76]
75	1.425546	whatsapp-chatd-edge-shv-03-mia3.facebook.com	10.215.173.1	TCP	40	https(443) → 47324 [ACK] Seq=2715 Ack=834 Win=523264 Len=0
76	1.426824	10.215.173.1	whatsapp-chatd-edge-shv-03-mia3.facebook.com	SSL	92	Continuation Data
77	1.427024	whatsapp-chatd-edge-shv-03-mia3.facebook.com	10.215.173.1	TCP	40	https(443) → 47324 [ACK] Seq=2715 Ack=886 Win=523264 Len=0
78	1.470626	10.215.173.1	whatsapp-chatd-edge-shv-03-mia3.facebook.com	TCP	43	47324 → https(443) [PSH, ACK] Seq=886 Ack=2715 Win=108544 Len=3 [TCP PDU reassembled in 80]
79	1.470797	whatsapp-chatd-edge-shv-03-mia3.facebook.com	10.215.173.1	TCP	40	https(443) → 47324 [ACK] Seq=2715 Ack=889 Win=523264 Len=0
80	1.470987	10.215.173.1	whatsapp-chatd-edge-shv-03-mia3.facebook.com	SSL	70	Continuation Data
81	1.471219	whatsapp-chatd-edge-shv-03-mia3.facebook.com	10.215.173.1	TCP	40	https(443) → 47324 [ACK] Seq=2715 Ack=919 Win=523264 Len=0
82	1.507137	10.215.173.1	whatsapp-chatd-edge-shv-03-mia3.facebook.com	TCP	43	47324 → https(443) [PSH, ACK] Seq=919 Ack=2715 Win=108544 Len=3 [TCP PDU reassembled in 84]
83	1.507392	whatsapp-chatd-edge-shv-03-mia3.facebook.com	10.215.173.1	TCP	40	https(443) → 47324 [ACK] Seq=2715 Ack=922 Win=523264 Len=0
84	1.509776	10.215.173.1	whatsapp-chatd-edge-shv-03-mia3.facebook.com	SSL	1679	Continuation Data
85	1.510376	whatsapp-chatd-edge-shv-03-mia3.facebook.com	10.215.173.1	TCP	40	https(443) → 47324 [ACK] Seq=2715 Ack=2561 Win=522240 Len=0
86	1.569726	whatsapp-chatd-edge-shv-03-mia3.facebook.com	10.215.173.1	SSL	81	Continuation Data
87	1.570008	10.215.173.1	whatsapp-chatd-edge-shv-03-mia3.facebook.com	TCP	40	47324 → https(443) [ACK] Seq=2561 Ack=2756 Win=108544 Len=0
88	1.620301	whatsapp-chatd-edge-shv-03-mia3.facebook.com	10.215.173.1	SSL	73	Continuation Data
89	1.620960	10.215.173.1	whatsapp-chatd-edge-shv-03-mia3.facebook.com	TCP	40	47324 → https(443) [ACK] Seq=2561 Ack=2789 Win=108544 Len=0
90	1.630519	10.215.173.1	whatsapp-cdn-shv-01-mia3.fbcdn.net	TCP	60	38440 → https(443) [SYN] Seq=0 Win=65535 Len=0 MSS=9960 SACK_PERM TSval=1684079648 TSecr=0 WS=1024
91	1.676177	10.215.173.1	whatsapp-cdn-shv-01-mia3.fbcdn.net	TCP	60	38448 → https(443) [SYN] Seq=0 Win=65535 Len=0 MSS=9960 SACK_PERM TSval=1684079693 TSecr=0 WS=1024
92	1.690578	whatsapp-cdn-shv-01-mia3.fbcdn.net	10.215.173.1	TCP	48	https(443) → 38440 [SYN, ACK] Seq=0 Ack=1 Win=512 Len=0 MSS=9960 WS=1024
93	1.690962	10.215.173.1	whatsapp-cdn-shv-01-mia3.fbcdn.net	TCP	40	38440 → https(443) [ACK] Seq=1 Ack=1 Win=65536 Len=0
94	1.695902	10.215.173.1	whatsapp-cdn-shv-01-mia3.fbcdn.net	TCP	552	[TCP Window Full] 38440 → https(443) [PSH, ACK] Seq=1 Ack=1 Win=65536 Len=512 [TCP PDU reassembled in 96]
95	1.696457	whatsapp-cdn-shv-01-mia3.fbcdn.net	10.215.173.1	TCP	40	https(443) → 38440 [ACK] Seq=1 Ack=513 Win=523264 Len=0
96	1.696757	10.215.173.1	whatsapp-cdn-shv-01-mia3.fbcdn.net	TLSv1.3	45	Client Hello
97	1.697023	whatsapp-cdn-shv-01-mia3.fbcdn.net	10.215.173.1	TCP	40	https(443) → 38440 [ACK] Seq=1 Ack=518 Win=523264 Len=0
98	1.740388	whatsapp-cdn-shv-01-mia3.fbcdn.net	10.215.173.1	TCP	48	https(443) → 38448 [SYN, ACK] Seq=0 Ack=1 Win=512 Len=0 MSS=9960 WS=1024
99	1.740806	10.215.173.1	whatsapp-cdn-shv-01-mia3.fbcdn.net	TCP	40	38448 → https(443) [ACK] Seq=1 Ack=1 Win=65536 Len=0
100	1.759805	whatsapp-cdn-shv-01-mia3.fbcdn.net	10.215.173.1	TLSv1.3	258	Server Hello, Change Cipher Spec, Application Data
101	1.760582	10.215.173.1	whatsapp-cdn-shv-01-mia3.fbcdn.net	TCP	40	38440 → https(443) [ACK] Seq=518 Ack=219 Win=66560 Len=0
102	1.763424	10.215.173.1	whatsapp-cdn-shv-01-mia3.fbcdn.net	TLSv1.3	104	Change Cipher Spec, Application Data
103	1.763987	whatsapp-cdn-shv-01-mia3.fbcdn.net	10.215.173.1	TCP	40	https(443) → 38440 [ACK] Seq=219 Ack=582 Win=523264 Len=0
104	1.766231	10.215.173.1	whatsapp-cdn-shv-01-mia3.fbcdn.net	TLSv1.3	2218	Application Data
105	1.766489	whatsapp-cdn-shv-01-mia3.fbcdn.net	10.215.173.1	TCP	40	https(443) → 38440 [ACK] Seq=219 Ack=2760 Win=521216 Len=0
106	1.772299	10.215.173.1	whatsapp-cdn-shv-01-mia3.fbcdn.net	TLSv1.3	447	Client Hello (SNI=media-mia3-1.cdn.whatsapp.net)
107	1.772775	whatsapp-cdn-shv-01-mia3.fbcdn.net	10.215.173.1	TCP	40	https(443) → 38448 [ACK] Seq=1 Ack=408 Win=523264 Len=0
108	1.773019	10.215.173.1	whatsapp-cdn-shv-01-mia3.fbcdn.net	TLSv1.3	46	Change Cipher Spec
109	1.773100	whatsapp-cdn-shv-01-mia3.fbcdn.net	10.215.173.1	TCP	40	https(443) → 38448 [ACK] Seq=1 Ack=414 Win=523264 Len=0
110	1.774766	10.215.173.1	whatsapp-cdn-shv-01-mia3.fbcdn.net	TLSv1.3	814	Application Data
111	1.774988	whatsapp-cdn-shv-01-mia3.fbcdn.net	10.215.173.1	TCP	40	https(443) → 38448 [ACK] Seq=1 Ack=1188 Win=522240 Len=0
112	1.824668	whatsapp-cdn-shv-01-mia3.fbcdn.net	10.215.173.1	TLSv1.3	225	Application Data
113	1.854515	whatsapp-cdn-shv-01-mia3.fbcdn.net	10.215.173.1	TLSv1.3	262	Server Hello, Change Cipher Spec, Application Data
114	1.855057	10.215.173.1	whatsapp-cdn-shv-01-mia3.fbcdn.net	TCP	40	38448 → https(443) [ACK] Seq=1188 Ack=223 Win=66560 Len=0
115	1.863468	10.215.173.1	whatsapp-cdn-shv-01-mia3.fbcdn.net	TLSv1.3	66	Application Data
116	1.863721	whatsapp-cdn-shv-01-mia3.fbcdn.net	10.215.173.1	TCP	40	https(443) → 38448 [ACK] Seq=223 Ack=1214 Win=523264 Len=0
117	1.864198	10.215.173.1	whatsapp-cdn-shv-01-mia3.fbcdn.net	TLSv1.3	98	Application Data
118	1.864398	whatsapp-cdn-shv-01-mia3.fbcdn.net	10.215.173.1	TCP	40	https(443) → 38448 [ACK] Seq=223 Ack=1272 Win=523264 Len=0
119	1.867466	10.215.173.1	whatsapp-cdn-shv-01-mia3.fbcdn.net	TCP	40	38440 → https(443) [ACK] Seq=2760 Ack=404 Win=67584 Len=0
120	1.914710	whatsapp-cdn-shv-01-mia3.fbcdn.net	10.215.173.1	TCP	1268	https(443) → 38448 [PSH, ACK] Seq=223 Ack=1272 Win=523264 Len=1228 [TCP PDU reassembled in 121]
121	1.916867	whatsapp-cdn-shv-01-mia3.fbcdn.net	10.215.173.1	TLSv1.3	3724	Application Data, Application Data, Application Data
122	1.917240	10.215.173.1	whatsapp-cdn-shv-01-mia3.fbcdn.net	TCP	40	38448 → https(443) [ACK] Seq=1272 Ack=5135 Win=106496 Len=0
123	1.917320	whatsapp-cdn-shv-01-mia3.fbcdn.net	10.215.173.1	TLSv1.3	2496	Application Data
124	1.917631	whatsapp-cdn-shv-01-mia3.fbcdn.net	10.215.173.1	TLSv1.3	2496	Application Data
125	1.917850	10.215.173.1	whatsapp-cdn-shv-01-mia3.fbcdn.net	TCP	40	38448 → https(443) [ACK] Seq=1272 Ack=10047 Win=146432 Len=0
126	1.917918	whatsapp-cdn-shv-01-mia3.fbcdn.net	10.215.173.1	TLSv1.3	2496	Application Data
127	1.919727	whatsapp-cdn-shv-01-mia3.fbcdn.net	10.215.173.1	TLSv1.3	1268	Application Data
128	1.920068	10.215.173.1	whatsapp-cdn-shv-01-mia3.fbcdn.net	TCP	40	38448 → https(443) [ACK] Seq=1272 Ack=13731 Win=186368 Len=0
129	1.969077	whatsapp-cdn-shv-01-mia3.fbcdn.net	10.215.173.1	TLSv1.3	2496	Application Data
130	1.970765	whatsapp-cdn-shv-01-mia3.fbcdn.net	10.215.173.1	TLSv1.3	2483	Application Data, Application Data, Application Data
131	1.971114	10.215.173.1	whatsapp-cdn-shv-01-mia3.fbcdn.net	TCP	40	38448 → https(443) [ACK] Seq=1272 Ack=18630 Win=226304 Len=0
132	2.012686	whatsapp-cdn-shv-01-mia3.fbcdn.net	10.215.173.1	TLSv1.3	796	Application Data
133	2.013392	10.215.173.1	whatsapp-cdn-shv-01-mia3.fbcdn.net	TCP	40	38440 → https(443) [ACK] Seq=2760 Ack=1160 Win=88064 Len=0
134	2.461450	10.215.173.1	qro02s25-in-f10.1e100.net	TCP	60	52402 → https(443) [SYN] Seq=0 Win=65535 Len=0 MSS=9960 SACK_PERM TSval=3017466065 TSecr=0 WS=1024
135	2.465718	10.215.173.1	10.215.173.2	DNS	74	Standard query 0x456d A photosdata-pa.googleapis.com
136	2.530377	qro02s25-in-f10.1e100.net	10.215.173.1	TCP	48	https(443) → 52402 [SYN, ACK] Seq=0 Ack=1 Win=512 Len=0 MSS=9960 WS=1024
137	2.530555	10.215.173.2	10.215.173.1	DNS	282	Standard query response 0x456d A photosdata-pa.googleapis.com A 142.251.210.74 A 142.251.211.234 A 192.178.50.42 A 142.251.214.234 A 142.251.35.234 A 172.217.165.202 A 142.251.215.106 A 142.251.214.170 A 142.251.34.138 A 142.250.176.74 A 142.251.35.106 A 142.251.215.42 A 192.178.50.74
138	2.531136	10.215.173.1	qro02s25-in-f10.1e100.net	TCP	40	52402 → https(443) [ACK] Seq=1 Ack=1 Win=65536 Len=0
139	2.532466	10.215.173.1	qro02s25-in-f10.1e100.net	TCP	552	[TCP Window Full] 52402 → https(443) [PSH, ACK] Seq=1 Ack=1 Win=65536 Len=512 [TCP PDU reassembled in 144]
140	2.532725	qro02s25-in-f10.1e100.net	10.215.173.1	TCP	40	https(443) → 52402 [ACK] Seq=1 Ack=513 Win=523264 Len=0
141	2.532861	10.215.173.1	qro02s25-in-f10.1e100.net	TCP	552	52402 → https(443) [PSH, ACK] Seq=513 Ack=1 Win=65536 Len=512 [TCP PDU reassembled in 144]
142	2.533174	10.215.173.1	qro02s25-in-f10.1e100.net	TCP	552	52402 → https(443) [PSH, ACK] Seq=1025 Ack=1 Win=65536 Len=512 [TCP PDU reassembled in 144]
143	2.533190	10.215.173.1	qro02s25-in-f10.1e100.net	TCP	552	52402 → https(443) [PSH, ACK] Seq=1537 Ack=1 Win=65536 Len=512 [TCP PDU reassembled in 144]
144	2.533205	10.215.173.1	qro02s25-in-f10.1e100.net	TLSv1.3	230	Client Hello (SNI=photosdata-pa.googleapis.com)
145	2.533424	qro02s25-in-f10.1e100.net	10.215.173.1	TCP	40	https(443) → 52402 [ACK] Seq=1 Ack=2239 Win=521216 Len=0
146	2.625317	qro02s25-in-f10.1e100.net	10.215.173.1	TLSv1.3	1533	Server Hello, Change Cipher Spec, Application Data
147	2.625644	10.215.173.1	qro02s25-in-f10.1e100.net	TCP	40	52402 → https(443) [ACK] Seq=2239 Ack=1494 Win=86016 Len=0
148	2.626926	10.215.173.1	qro02s25-in-f10.1e100.net	TLSv1.3	130	Change Cipher Spec, Application Data
149	2.627026	qro02s25-in-f10.1e100.net	10.215.173.1	TCP	40	https(443) → 52402 [ACK] Seq=1494 Ack=2329 Win=523264 Len=0
150	2.627667	10.215.173.1	qro02s25-in-f10.1e100.net	TLSv1.3	132	Application Data
151	2.627750	qro02s25-in-f10.1e100.net	10.215.173.1	TCP	40	https(443) → 52402 [ACK] Seq=1494 Ack=2421 Win=523264 Len=0
152	2.628194	10.215.173.1	qro02s25-in-f10.1e100.net	TLSv1.3	830	Application Data
153	2.628279	qro02s25-in-f10.1e100.net	10.215.173.1	TCP	40	https(443) → 52402 [ACK] Seq=1494 Ack=3211 Win=523264 Len=0
154	2.628594	10.215.173.1	qro02s25-in-f10.1e100.net	TLSv1.3	371	Application Data
155	2.628636	qro02s25-in-f10.1e100.net	10.215.173.1	TCP	40	https(443) → 52402 [ACK] Seq=1494 Ack=3542 Win=522240 Len=0
156	2.690362	qro02s25-in-f10.1e100.net	10.215.173.1	TLSv1.3	1058	Application Data, Application Data
157	2.691209	10.215.173.1	qro02s25-in-f10.1e100.net	TLSv1.3	71	Application Data
158	2.691324	qro02s25-in-f10.1e100.net	10.215.173.1	TCP	40	https(443) → 52402 [ACK] Seq=2512 Ack=3573 Win=522240 Len=0
159	2.705419	qro02s25-in-f10.1e100.net	10.215.173.1	TLSv1.3	71	Application Data
160	2.747402	10.215.173.1	qro02s25-in-f10.1e100.net	TCP	40	52402 → https(443) [ACK] Seq=3573 Ack=2543 Win=89088 Len=0
161	2.942454	qro02s25-in-f10.1e100.net	10.215.173.1	TLSv1.3	272	Application Data
162	2.942938	10.215.173.1	qro02s25-in-f10.1e100.net	TCP	40	52402 → https(443) [ACK] Seq=3573 Ack=2775 Win=92160 Len=0
163	2.944591	qro02s25-in-f10.1e100.net	10.215.173.1	TLSv1.3	1450	Application Data, Application Data, Application Data, Application Data
164	2.944695	10.215.173.1	qro02s25-in-f10.1e100.net	TCP	40	52402 → https(443) [ACK] Seq=3573 Ack=4185 Win=95232 Len=0
165	2.945750	10.215.173.1	qro02s25-in-f10.1e100.net	TLSv1.3	79	Application Data
166	2.945852	qro02s25-in-f10.1e100.net	10.215.173.1	TCP	40	https(443) → 52402 [ACK] Seq=4185 Ack=3612 Win=523264 Len=0
167	3.046232	10.215.173.1	qro02s25-in-f10.1e100.net	TLSv1.3	165	Application Data
168	3.046552	qro02s25-in-f10.1e100.net	10.215.173.1	TCP	40	https(443) → 52402 [ACK] Seq=4185 Ack=3737 Win=523264 Len=0
169	3.046722	10.215.173.1	qro02s25-in-f10.1e100.net	TLSv1.3	455	Application Data
170	3.046838	qro02s25-in-f10.1e100.net	10.215.173.1	TCP	40	https(443) → 52402 [ACK] Seq=4185 Ack=4152 Win=523264 Len=0
171	3.215251	qro02s25-in-f10.1e100.net	10.215.173.1	TLSv1.3	1341	Application Data, Application Data
172	3.215581	qro02s25-in-f10.1e100.net	10.215.173.1	TLSv1.3	256	Application Data, Application Data, Application Data
173	3.215767	10.215.173.1	qro02s25-in-f10.1e100.net	TCP	40	52402 → https(443) [ACK] Seq=4152 Ack=5702 Win=101376 Len=0
174	3.217551	10.215.173.1	qro02s25-in-f10.1e100.net	TLSv1.3	79	Application Data
175	3.217813	qro02s25-in-f10.1e100.net	10.215.173.1	TCP	40	https(443) → 52402 [ACK] Seq=5702 Ack=4191 Win=523264 Len=0
176	3.985682	10.215.173.1	qro02s25-in-f10.1e100.net	TLSv1.3	124	Application Data
177	3.985983	qro02s25-in-f10.1e100.net	10.215.173.1	TCP	40	https(443) → 52402 [ACK] Seq=5702 Ack=4275 Win=523264 Len=0
178	3.986091	10.215.173.1	qro02s25-in-f10.1e100.net	TLSv1.3	81	Application Data
179	3.986118	qro02s25-in-f10.1e100.net	10.215.173.1	TCP	40	https(443) → 52402 [ACK] Seq=5702 Ack=4316 Win=523264 Len=0
180	4.176195	qro02s25-in-f10.1e100.net	10.215.173.1	TLSv1.3	331	Application Data, Application Data
181	4.184952	qro02s25-in-f10.1e100.net	10.215.173.1	TLSv1.3	110	Application Data, Application Data
182	4.185414	10.215.173.1	qro02s25-in-f10.1e100.net	TCP	40	52402 → https(443) [ACK] Seq=4316 Ack=6063 Win=103424 Len=0
183	4.187854	10.215.173.1	qro02s25-in-f10.1e100.net	TLSv1.3	79	Application Data
184	4.188111	qro02s25-in-f10.1e100.net	10.215.173.1	TCP	40	https(443) → 52402 [ACK] Seq=6063 Ack=4355 Win=523264 Len=0
185	11.631441	10.215.173.1	whatsapp-chatd-edge-shv-03-mia3.facebook.com	TCP	40	[TCP Keep-Alive] 47324 → https(443) [ACK] Seq=2560 Ack=2789 Win=108544 Len=0
186	11.631722	whatsapp-chatd-edge-shv-03-mia3.facebook.com	10.215.173.1	TCP	40	[TCP Keep-Alive ACK] https(443) → 47324 [ACK] Seq=2789 Ack=2561 Win=524288 Len=0
187	15.799855	10.215.173.1	dns.google	DNS	63	Standard query 0x05a2 A beacons2.gvt2.com
188	15.982500	dns.google	10.215.173.1	DNS	79	Standard query response 0x05a2 A beacons2.gvt2.com A 216.58.198.163
189	16.044606	10.215.173.1	10.215.173.2	DNS	72	Standard query 0x4f29 A test-gateway.instagram.com
190	16.050916	10.215.173.1	edge-ig-dgw-shv-01-mia3.facebook.com	SKYPE	1280	Unknown_0
191	16.137610	10.215.173.1	edge-ig-dgw-shv-01-mia3.facebook.com	SKYPE	1280	Unknown_0
192	16.151019	10.215.173.2	10.215.173.1	DNS	123	Standard query response 0x4f29 A test-gateway.instagram.com CNAME dgw-ig.c10r.facebook.com A 57.144.162.196
193	16.155410	edge-ig-dgw-shv-01-mia3.facebook.com	10.215.173.1	SKYPE	1260	Unknown_0
194	16.155706	edge-ig-dgw-shv-01-mia3.facebook.com	10.215.173.1	SKYPE	1260	Unknown_0
195	16.155827	edge-ig-dgw-shv-01-mia3.facebook.com	10.215.173.1	SKYPE	818	Unknown_0
196	16.155907	edge-ig-dgw-shv-01-mia3.facebook.com	10.215.173.1	SKYPE	1260	Unknown_0
197	16.157343	edge-ig-dgw-shv-01-mia3.facebook.com	10.215.173.1	UDP	108	Session 5348/1, Cancel ack segment
198	16.199698	edge-ig-dgw-shv-01-mia3.facebook.com	10.215.173.1	SKYPE	1260	Unknown_0
199	16.211381	10.215.173.1	edge-ig-dgw-shv-01-mia3.facebook.com	SKYPE	113	Unknown_0
200	16.211838	10.215.173.1	edge-ig-dgw-shv-01-mia3.facebook.com	SKYPE	96	Unknown_0
201	16.213680	10.215.173.1	edge-ig-dgw-shv-01-mia3.facebook.com	SKYPE	928	Unknown_0
202	16.213822	10.215.173.1	edge-ig-dgw-shv-01-mia3.facebook.com	SKYPE	192	Unknown_0
203	16.274801	edge-ig-dgw-shv-01-mia3.facebook.com	10.215.173.1	SKYPE	1260	Unknown_0
204	16.275064	edge-ig-dgw-shv-01-mia3.facebook.com	10.215.173.1	SKYPE	1260	Unknown_0
205	16.275209	edge-ig-dgw-shv-01-mia3.facebook.com	10.215.173.1	SKYPE	1260	Unknown_0
206	16.275309	edge-ig-dgw-shv-01-mia3.facebook.com	10.215.173.1	UDP	94	Session 9478/11, Green data
207	16.276132	10.215.173.1	edge-ig-dgw-shv-01-mia3.facebook.com	SKYPE	74	Unknown_0
208	16.276245	10.215.173.1	edge-ig-dgw-shv-01-mia3.facebook.com	SKYPE	96	Unknown_0
209	16.285729	edge-ig-dgw-shv-01-mia3.facebook.com	10.215.173.1	UDP, HiPerConTracer	140	https(443) → 53463 Len=112 (SendTTL=64, Round=55)
210	16.286371	edge-ig-dgw-shv-01-mia3.facebook.com	10.215.173.1	SKYPE	71	Unknown_0
211	16.286583	edge-ig-dgw-shv-01-mia3.facebook.com	10.215.173.1	UDP	300	Session 106/3704, Cancel segment
212	16.287325	10.215.173.1	edge-ig-dgw-shv-01-mia3.facebook.com	SKYPE	96	Unknown_0
213	16.311519	edge-ig-dgw-shv-01-mia3.facebook.com	10.215.173.1	SKYPE	76	NAT repeat Unk: d
214	16.311784	edge-ig-dgw-shv-01-mia3.facebook.com	10.215.173.1	UDP	76	Protocol Error
215	16.315481	edge-ig-dgw-shv-01-mia3.facebook.com	10.215.173.1	UDP, HiPerConTracer	236	https(443) → 53463 Len=208 (SendTTL=205, Round=26)
216	16.320113	10.215.173.1	edge-ig-dgw-shv-01-mia3.facebook.com	SKYPE	96	Unknown_0
217	16.349505	edge-ig-dgw-shv-01-mia3.facebook.com	10.215.173.1	UDP	76	Session 11620/33300385, Red data
218	16.430584	edge-ig-dgw-shv-01-mia3.facebook.com	10.215.173.1	SKYPE	76	Fragment/Forward/Resend Unk: 8
219	16.916160	10.215.173.1	edge-ig-dgw-shv-01-mia3.facebook.com	SKYPE	224	Unknown_0
220	16.923091	10.215.173.1	edge-ig-dgw-shv-01-mia3.facebook.com	SKYPE	800	Unknown_0
221	16.990324	edge-ig-dgw-shv-01-mia3.facebook.com	10.215.173.1	SKYPE	76	Audio Unk: 1
222	17.016986	10.215.173.1	edge-ig-dgw-shv-01-mia3.facebook.com	SKYPE	64	Unknown_0
223	17.022292	edge-ig-dgw-shv-01-mia3.facebook.com	10.215.173.1	UDP	108	Session 209/3978, Cancel ack segment
224	17.023914	10.215.173.1	edge-ig-dgw-shv-01-mia3.facebook.com	SKYPE	96	Unknown_0
225	17.029418	edge-ig-dgw-shv-01-mia3.facebook.com	10.215.173.1	SKYPE	108	Unknown_0
226	17.048335	edge-ig-dgw-shv-01-mia3.facebook.com	10.215.173.1	SKYPE	172	Unknown_F Unk: 9
227	17.053290	10.215.173.1	edge-ig-dgw-shv-01-mia3.facebook.com	SKYPE	128	Unknown_0
228	17.065395	10.215.173.1	edge-ig-dgw-shv-01-mia3.facebook.com	SKYPE	96	Unknown_0
229	17.112370	edge-ig-dgw-shv-01-mia3.facebook.com	10.215.173.1	UDP, HiPerConTracer	76	https(443) → 53463 Len=48 (SendTTL=154, Round=89)
230	17.154870	edge-ig-dgw-shv-01-mia3.facebook.com	10.215.173.1	SKYPE	76	Fragment/Forward/Resend Unk: 2
231	17.155213	edge-ig-dgw-shv-01-mia3.facebook.com	10.215.173.1	UDP	76	Session 957029/63, Cancel ack segment
232	17.168680	10.215.173.1	qro02s25-in-f10.1e100.net	TCP	40	52402 → https(443) [FIN, ACK] Seq=4355 Ack=6063 Win=103424 Len=0
233	17.169185	qro02s25-in-f10.1e100.net	10.215.173.1	TCP	40	https(443) → 52402 [ACK] Seq=6063 Ack=4356 Win=523264 Len=0
234	17.184501	10.215.173.1	edge-ig-dgw-shv-01-mia3.facebook.com	SKYPE	64	Unknown_0
235	17.234625	qro02s25-in-f10.1e100.net	10.215.173.1	TCP	40	https(443) → 52402 [FIN, ACK] Seq=6063 Ack=4356 Win=524288 Len=0
236	17.404896	10.215.173.1	10.215.173.2	DNS	88	Standard query 0xc4d1 A epdg.epc.mnc004.mcc712.pub.3gppnetwork.org
237	17.411365	10.215.173.1	10.215.173.2	DNS	88	Standard query 0x4116 AAAA epdg.epc.mnc004.mcc712.pub.3gppnetwork.org
238	17.468634	10.215.173.2	10.215.173.1	DNS	206	Standard query response 0x4116 AAAA epdg.epc.mnc004.mcc712.pub.3gppnetwork.org CNAME epdg2.mobilecore.llagroup.com SOA prmilb01.llagroup.com
239	17.472851	10.215.173.2	10.215.173.1	DNS	147	Standard query response 0xc4d1 A epdg.epc.mnc004.mcc712.pub.3gppnetwork.org CNAME epdg2.mobilecore.llagroup.com A 201.224.137.32
240	17.841903	10.215.173.1	edge-star-shv-01-mia3.facebook.com	TCP	60	59060 → https(443) [SYN] Seq=0 Win=65535 Len=0 MSS=9960 SACK_PERM TSval=3296887835 TSecr=0 WS=1024
241	17.892685	edge-star-shv-01-mia3.facebook.com	10.215.173.1	TCP	48	https(443) → 59060 [SYN, ACK] Seq=0 Ack=1 Win=4096 Len=0 MSS=9960 WS=1024
242	17.893008	10.215.173.1	edge-star-shv-01-mia3.facebook.com	TCP	40	59060 → https(443) [ACK] Seq=1 Ack=1 Win=65536 Len=0
243	17.896619	10.215.173.1	edge-star-shv-01-mia3.facebook.com	TLSv1.3	237	Client Hello (SNI=graph.facebook.com)
244	17.897027	edge-star-shv-01-mia3.facebook.com	10.215.173.1	TCP	40	https(443) → 59060 [ACK] Seq=1 Ack=198 Win=4193280 Len=0
245	17.946528	edge-star-shv-01-mia3.facebook.com	10.215.173.1	TLSv1.3	1420	Server Hello, Change Cipher Spec, Application Data
246	17.947396	10.215.173.1	edge-star-shv-01-mia3.facebook.com	TCP	40	59060 → https(443) [ACK] Seq=198 Ack=1381 Win=86016 Len=0
247	17.947460	edge-star-shv-01-mia3.facebook.com	10.215.173.1	TLSv1.3	1942	Application Data, Application Data
248	17.947622	10.215.173.1	edge-star-shv-01-mia3.facebook.com	TCP	40	59060 → https(443) [ACK] Seq=198 Ack=3283 Win=105472 Len=0
249	17.970815	10.215.173.1	edge-star-shv-01-mia3.facebook.com	TLSv1.3	46	Change Cipher Spec
250	17.970845	10.215.173.1	edge-star-shv-01-mia3.facebook.com	TLSv1.3	109	Application Data
251	17.971022	edge-star-shv-01-mia3.facebook.com	10.215.173.1	TCP	40	https(443) → 59060 [ACK] Seq=3283 Ack=273 Win=4193280 Len=0
252	17.978683	10.215.173.1	edge-star-shv-01-mia3.facebook.com	TLSv1.3	93	Application Data
253	17.978718	10.215.173.1	edge-star-shv-01-mia3.facebook.com	TLSv1.3	93	Application Data
254	17.978730	10.215.173.1	edge-star-shv-01-mia3.facebook.com	TLSv1.3	77	Application Data
255	17.978936	edge-star-shv-01-mia3.facebook.com	10.215.173.1	TCP	40	https(443) → 59060 [ACK] Seq=3283 Ack=416 Win=4193280 Len=0
256	17.979103	10.215.173.1	edge-star-shv-01-mia3.facebook.com	TLSv1.3	1309	Application Data
257	17.979208	10.215.173.1	edge-star-shv-01-mia3.facebook.com	TLSv1.3	1453	Application Data
258	17.979380	edge-star-shv-01-mia3.facebook.com	10.215.173.1	TCP	40	https(443) → 59060 [ACK] Seq=3283 Ack=3098 Win=4191232 Len=0
259	18.032417	edge-star-shv-01-mia3.facebook.com	10.215.173.1	TLSv1.3	293	Application Data, Application Data
260	18.032787	edge-star-shv-01-mia3.facebook.com	10.215.173.1	TLSv1.3	106	Application Data, Application Data
261	18.033592	10.215.173.1	edge-star-shv-01-mia3.facebook.com	TCP	40	59060 → https(443) [ACK] Seq=3098 Ack=3602 Win=109568 Len=0
262	18.033618	10.215.173.1	edge-star-shv-01-mia3.facebook.com	TLSv1.3	77	Application Data
263	18.033754	edge-star-shv-01-mia3.facebook.com	10.215.173.1	TCP	40	https(443) → 59060 [ACK] Seq=3602 Ack=3135 Win=4193280 Len=0
264	18.074661	edge-star-shv-01-mia3.facebook.com	10.215.173.1	TLSv1.3	675	Application Data
265	18.115336	10.215.173.1	edge-star-shv-01-mia3.facebook.com	TCP	40	59060 → https(443) [ACK] Seq=3135 Ack=4237 Win=113664 Len=0
266	19.181979	whatsapp-chatd-edge-shv-03-mia3.facebook.com	10.215.173.1	TCP	40	https(443) → 47324 [RST, ACK] Seq=2789 Ack=2561 Win=64512 Len=0
267	19.182560	mobile-gtalk.l.google.com	10.215.173.1	TCP	40	hpvroom(5228) → 43418 [RST, ACK] Seq=861 Ack=1076 Win=64512 Len=0
268	19.182889	whatsapp-cdn-shv-01-mia3.fbcdn.net	10.215.173.1	TCP	40	https(443) → 38440 [RST, ACK] Seq=1160 Ack=2760 Win=64512 Len=0
269	19.183098	whatsapp-cdn-shv-01-mia3.fbcdn.net	10.215.173.1	TCP	40	https(443) → 38448 [RST, ACK] Seq=18630 Ack=1272 Win=64512 Len=0
270	19.211890	10.215.173.1	chat.cdn.whatsapp.net	TCP	60	40440 → https(443) [SYN] Seq=0 Win=65535 Len=0 MSS=9960 SACK_PERM TSval=910834892 TSecr=0 WS=1024
271	19.282173	chat.cdn.whatsapp.net	10.215.173.1	TCP	48	https(443) → 40440 [SYN, ACK] Seq=0 Ack=1 Win=4096 Len=0 MSS=9960 WS=1024
272	19.282915	10.215.173.1	chat.cdn.whatsapp.net	TCP	40	40440 → https(443) [ACK] Seq=1 Ack=1 Win=65536 Len=0
273	19.292036	10.215.173.1	chat.cdn.whatsapp.net	TCP	44	40440 → https(443) [PSH, ACK] Seq=1 Ack=1 Win=65536 Len=4 [TCP PDU reassembled in 274]
274	19.292519	10.215.173.1	chat.cdn.whatsapp.net	SSL	43	Continuation Data
275	19.292575	10.215.173.1	chat.cdn.whatsapp.net	SSL	46	Continuation Data
276	19.292621	10.215.173.1	chat.cdn.whatsapp.net	TCP	44	40440 → https(443) [PSH, ACK] Seq=14 Ack=1 Win=65536 Len=4 [TCP PDU reassembled in 278]
277	19.292913	chat.cdn.whatsapp.net	10.215.173.1	TCP	40	https(443) → 40440 [ACK] Seq=1 Ack=18 Win=4193280 Len=0
278	19.299297	10.215.173.1	chat.cdn.whatsapp.net	SSL	43	Continuation Data
279	19.299404	10.215.173.1	chat.cdn.whatsapp.net	SSL	376	Continuation Data
280	19.299862	chat.cdn.whatsapp.net	10.215.173.1	TCP	40	https(443) → 40440 [ACK] Seq=1 Ack=357 Win=4193280 Len=0
281	19.393089	chat.cdn.whatsapp.net	10.215.173.1	SSL	97	Continuation Data
282	19.393711	10.215.173.1	chat.cdn.whatsapp.net	TCP	40	40440 → https(443) [ACK] Seq=357 Ack=58 Win=65536 Len=0
283	19.394047	chat.cdn.whatsapp.net	10.215.173.1	SSL	103	Continuation Data
284	19.394320	10.215.173.1	chat.cdn.whatsapp.net	TCP	40	40440 → https(443) [ACK] Seq=357 Ack=121 Win=65536 Len=0
285	19.403881	10.215.173.1	chat.cdn.whatsapp.net	TCP	43	40440 → https(443) [PSH, ACK] Seq=357 Ack=121 Win=65536 Len=3 [TCP PDU reassembled in 286]
286	19.403934	10.215.173.1	chat.cdn.whatsapp.net	SSL	221	Continuation Data
287	19.404250	chat.cdn.whatsapp.net	10.215.173.1	TCP	40	https(443) → 40440 [ACK] Seq=121 Ack=541 Win=4193280 Len=0
288	19.404444	10.215.173.1	chat.cdn.whatsapp.net	TCP	43	40440 → https(443) [PSH, ACK] Seq=541 Ack=121 Win=65536 Len=3 [TCP PDU reassembled in 289]
289	19.404471	10.215.173.1	chat.cdn.whatsapp.net	SSL	77	Continuation Data
290	19.404693	chat.cdn.whatsapp.net	10.215.173.1	TCP	40	https(443) → 40440 [ACK] Seq=121 Ack=581 Win=4193280 Len=0
291	19.405162	10.215.173.1	chat.cdn.whatsapp.net	TCP	43	40440 → https(443) [PSH, ACK] Seq=581 Ack=121 Win=65536 Len=3 [TCP PDU reassembled in 292]
292	19.405197	10.215.173.1	chat.cdn.whatsapp.net	SSL	92	Continuation Data
293	19.405413	chat.cdn.whatsapp.net	10.215.173.1	TCP	40	https(443) → 40440 [ACK] Seq=121 Ack=636 Win=4193280 Len=0
294	19.551590	chat.cdn.whatsapp.net	10.215.173.1	SSL	1055	Continuation Data
295	19.552234	chat.cdn.whatsapp.net	10.215.173.1	SSL	482	Continuation Data
296	19.552557	10.215.173.1	chat.cdn.whatsapp.net	TCP	40	40440 → https(443) [ACK] Seq=636 Ack=1578 Win=88064 Len=0
297	19.586193	chat.cdn.whatsapp.net	10.215.173.1	SSL	77	Continuation Data
298	19.627388	10.215.173.1	chat.cdn.whatsapp.net	TCP	40	40440 → https(443) [ACK] Seq=636 Ack=1615 Win=88064 Len=0
299	20.226398	10.215.173.1	edge-star-shv-01-mia3.facebook.com	TCP	40	59060 → https(443) [RST, ACK] Seq=3135 Ack=4237 Win=113664 Len=0
300	20.226780	edge-star-shv-01-mia3.facebook.com	10.215.173.1	TCP	40	https(443) → 59060 [RST, ACK] Seq=4237 Ack=3135 Win=64512 Len=0
301	24.766740	10.215.173.1	chat.cdn.whatsapp.net	TCP	43	40440 → https(443) [PSH, ACK] Seq=636 Ack=1615 Win=88064 Len=3 [TCP PDU reassembled in 302]
302	24.766944	10.215.173.1	chat.cdn.whatsapp.net	SSL	92	Continuation Data
303	24.768324	chat.cdn.whatsapp.net	10.215.173.1	TCP	40	https(443) → 40440 [ACK] Seq=1615 Ack=691 Win=4193280 Len=0
304	25.014365	10.215.173.1	chat.cdn.whatsapp.net	TCP	43	40440 → https(443) [PSH, ACK] Seq=691 Ack=1615 Win=88064 Len=3 [TCP PDU reassembled in 306]
305	25.017844	chat.cdn.whatsapp.net	10.215.173.1	TCP	40	https(443) → 40440 [ACK] Seq=1615 Ack=694 Win=4193280 Len=0
306	25.018028	10.215.173.1	chat.cdn.whatsapp.net	SSL	93	Continuation Data
307	25.018748	chat.cdn.whatsapp.net	10.215.173.1	TCP	40	https(443) → 40440 [ACK] Seq=1615 Ack=747 Win=4193280 Len=0
308	27.867360	10.215.173.1	chat.cdn.whatsapp.net	TCP	43	40440 → https(443) [PSH, ACK] Seq=747 Ack=1615 Win=88064 Len=3 [TCP PDU reassembled in 309]
309	27.867684	10.215.173.1	chat.cdn.whatsapp.net	SSL	92	Continuation Data
310	27.867996	chat.cdn.whatsapp.net	10.215.173.1	TCP	40	https(443) → 40440 [ACK] Seq=1615 Ack=802 Win=4193280 Len=0
311	27.961426	10.215.173.1	chat.cdn.whatsapp.net	TCP	43	40440 → https(443) [PSH, ACK] Seq=802 Ack=1615 Win=88064 Len=3 [TCP PDU reassembled in 313]
312	27.961639	chat.cdn.whatsapp.net	10.215.173.1	TCP	40	https(443) → 40440 [ACK] Seq=1615 Ack=805 Win=4193280 Len=0
313	27.962160	10.215.173.1	chat.cdn.whatsapp.net	SSL	93	Continuation Data
314	27.962639	chat.cdn.whatsapp.net	10.215.173.1	TCP	40	https(443) → 40440 [ACK] Seq=1615 Ack=858 Win=4193280 Len=0
315	28.062315	chat.cdn.whatsapp.net	10.215.173.1	SSL	99	Continuation Data
316	28.062500	10.215.173.1	chat.cdn.whatsapp.net	TCP	40	40440 → https(443) [ACK] Seq=858 Ack=1674 Win=88064 Len=0
317	28.251893	10.215.173.1	mobile-gtalk.l.google.com	TCP	60	34150 → hpvroom(5228) [SYN] Seq=0 Win=65535 Len=0 MSS=9960 SACK_PERM TSval=3600414148 TSecr=0 WS=1024
318	28.337968	mobile-gtalk.l.google.com	10.215.173.1	TCP	48	hpvroom(5228) → 34150 [SYN, ACK] Seq=0 Ack=1 Win=4096 Len=0 MSS=9960 WS=1024
319	28.338316	10.215.173.1	mobile-gtalk.l.google.com	TCP	40	34150 → hpvroom(5228) [ACK] Seq=1 Ack=1 Win=65536 Len=0
320	28.342313	10.215.173.1	mobile-gtalk.l.google.com	TLSv1.3	572	Client Hello (SNI=mtalk.google.com)
321	28.342887	mobile-gtalk.l.google.com	10.215.173.1	TCP	40	hpvroom(5228) → 34150 [ACK] Seq=1 Ack=533 Win=4193280 Len=0
322	28.438698	mobile-gtalk.l.google.com	10.215.173.1	TLSv1.3	243	Server Hello, Change Cipher Spec, Application Data
323	28.439076	10.215.173.1	mobile-gtalk.l.google.com	TCP	40	34150 → hpvroom(5228) [ACK] Seq=533 Ack=204 Win=67584 Len=0
324	28.440268	10.215.173.1	mobile-gtalk.l.google.com	TLSv1.3	104	Change Cipher Spec, Application Data
325	28.440460	mobile-gtalk.l.google.com	10.215.173.1	TCP	40	hpvroom(5228) → 34150 [ACK] Seq=204 Ack=597 Win=4193280 Len=0
326	28.495514	10.215.173.1	mobile-gtalk.l.google.com	TLSv1.3	489	Application Data
327	28.495752	mobile-gtalk.l.google.com	10.215.173.1	TCP	40	hpvroom(5228) → 34150 [ACK] Seq=204 Ack=1046 Win=4193280 Len=0
328	28.574083	mobile-gtalk.l.google.com	10.215.173.1	TLSv1.3	575	Application Data, Application Data
329	28.581227	mobile-gtalk.l.google.com	10.215.173.1	TLSv1.3	128	Application Data
330	28.581666	10.215.173.1	mobile-gtalk.l.google.com	TCP	40	34150 → hpvroom(5228) [ACK] Seq=1046 Ack=827 Win=68608 Len=0
331	28.581795	mobile-gtalk.l.google.com	10.215.173.1	TLSv1.3	74	Application Data
332	28.623416	10.215.173.1	mobile-gtalk.l.google.com	TCP	40	34150 → hpvroom(5228) [ACK] Seq=1046 Ack=861 Win=68608 Len=0
333	30.689081	10.215.173.1	chat.cdn.whatsapp.net	TCP	43	40440 → https(443) [PSH, ACK] Seq=858 Ack=1674 Win=88064 Len=3 [TCP PDU reassembled in 335]
334	30.689706	chat.cdn.whatsapp.net	10.215.173.1	TCP	40	https(443) → 40440 [ACK] Seq=1674 Ack=861 Win=4193280 Len=0
335	30.690379	10.215.173.1	chat.cdn.whatsapp.net	SSL	62	Continuation Data
336	30.690566	chat.cdn.whatsapp.net	10.215.173.1	TCP	40	https(443) → 40440 [ACK] Seq=1674 Ack=883 Win=4193280 Len=0
337	30.698550	10.215.173.1	chat.cdn.whatsapp.net	TCP	43	40440 → https(443) [PSH, ACK] Seq=883 Ack=1674 Win=88064 Len=3 [TCP PDU reassembled in 339]
338	30.698776	chat.cdn.whatsapp.net	10.215.173.1	TCP	40	https(443) → 40440 [ACK] Seq=1674 Ack=886 Win=4193280 Len=0
339	30.699476	10.215.173.1	chat.cdn.whatsapp.net	SSL	70	Continuation Data
340	30.699650	chat.cdn.whatsapp.net	10.215.173.1	TCP	40	https(443) → 40440 [ACK] Seq=1674 Ack=916 Win=4193280 Len=0
341	30.781022	chat.cdn.whatsapp.net	10.215.173.1	SSL	81	Continuation Data
342	30.781237	10.215.173.1	chat.cdn.whatsapp.net	TCP	40	40440 → https(443) [ACK] Seq=916 Ack=1715 Win=88064 Len=0
343	30.781751	chat.cdn.whatsapp.net	10.215.173.1	SSL	118	Continuation Data
344	30.781912	10.215.173.1	chat.cdn.whatsapp.net	TCP	40	40440 → https(443) [ACK] Seq=916 Ack=1793 Win=88064 Len=0
345	30.807639	chat.cdn.whatsapp.net	10.215.173.1	SSL	81	Continuation Data
346	30.807939	10.215.173.1	chat.cdn.whatsapp.net	TCP	40	40440 → https(443) [ACK] Seq=916 Ack=1834 Win=88064 Len=0
347	33.373848	10.215.173.1	chat.cdn.whatsapp.net	TCP	43	40440 → https(443) [PSH, ACK] Seq=916 Ack=1834 Win=88064 Len=3 [TCP PDU reassembled in 348]
348	33.374108	10.215.173.1	chat.cdn.whatsapp.net	SSL	93	Continuation Data
349	33.374446	chat.cdn.whatsapp.net	10.215.173.1	TCP	40	https(443) → 40440 [ACK] Seq=1834 Ack=972 Win=4193280 Len=0
350	33.484394	chat.cdn.whatsapp.net	10.215.173.1	SSL	99	Continuation Data
351	33.484685	10.215.173.1	chat.cdn.whatsapp.net	TCP	40	40440 → https(443) [ACK] Seq=972 Ack=1893 Win=88064 Len=0
352	36.781582	10.215.173.1	chat.cdn.whatsapp.net	TCP	43	40440 → https(443) [PSH, ACK] Seq=972 Ack=1893 Win=88064 Len=3 [TCP PDU reassembled in 353]
353	36.781877	10.215.173.1	chat.cdn.whatsapp.net	SSL	77	Continuation Data
354	36.782505	chat.cdn.whatsapp.net	10.215.173.1	TCP	40	https(443) → 40440 [ACK] Seq=1893 Ack=1012 Win=4193280 Len=0
355	38.715373	10.215.173.1	chat.cdn.whatsapp.net	TCP	43	40440 → https(443) [PSH, ACK] Seq=1012 Ack=1893 Win=88064 Len=3 [TCP PDU reassembled in 356]
356	38.715585	10.215.173.1	chat.cdn.whatsapp.net	SSL	737	Continuation Data
357	38.716053	chat.cdn.whatsapp.net	10.215.173.1	TCP	40	https(443) → 40440 [ACK] Seq=1893 Ack=1712 Win=4193280 Len=0
358	38.810220	chat.cdn.whatsapp.net	10.215.173.1	SSL	110	Continuation Data
359	38.810518	10.215.173.1	chat.cdn.whatsapp.net	TCP	40	40440 → https(443) [ACK] Seq=1712 Ack=1963 Win=88064 Len=0
360	39.017587	chat.cdn.whatsapp.net	10.215.173.1	SSL	103	Continuation Data
361	39.018001	10.215.173.1	chat.cdn.whatsapp.net	TCP	40	40440 → https(443) [ACK] Seq=1712 Ack=2026 Win=88064 Len=0
362	39.046232	10.215.173.1	chat.cdn.whatsapp.net	TCP	43	40440 → https(443) [PSH, ACK] Seq=1712 Ack=2026 Win=88064 Len=3 [TCP PDU reassembled in 364]
363	39.046595	chat.cdn.whatsapp.net	10.215.173.1	TCP	40	https(443) → 40440 [ACK] Seq=2026 Ack=1715 Win=4193280 Len=0
364	39.047005	10.215.173.1	chat.cdn.whatsapp.net	SSL	93	Continuation Data
365	39.047285	chat.cdn.whatsapp.net	10.215.173.1	TCP	40	https(443) → 40440 [ACK] Seq=2026 Ack=1768 Win=4193280 Len=0
366	43.424499	chat.cdn.whatsapp.net	10.215.173.1	SSL	104	Continuation Data
367	43.425576	chat.cdn.whatsapp.net	10.215.173.1	SSL	77	Continuation Data
368	43.425965	10.215.173.1	chat.cdn.whatsapp.net	TCP	40	40440 → https(443) [ACK] Seq=1768 Ack=2127 Win=88064 Len=0
369	43.433557	10.215.173.1	chat.cdn.whatsapp.net	TCP	43	40440 → https(443) [PSH, ACK] Seq=1768 Ack=2127 Win=88064 Len=3 [TCP PDU reassembled in 371]
370	43.433772	chat.cdn.whatsapp.net	10.215.173.1	TCP	40	https(443) → 40440 [ACK] Seq=2127 Ack=1771 Win=4193280 Len=0
371	43.434246	10.215.173.1	chat.cdn.whatsapp.net	SSL	94	Continuation Data
372	43.434380	chat.cdn.whatsapp.net	10.215.173.1	TCP	40	https(443) → 40440 [ACK] Seq=2127 Ack=1825 Win=4193280 Len=0
