1	0.000000	69.48.218.1	DESKTOP-7HDTRP6	TLSv1.2	93	Application Data
2	0.001680	DESKTOP-7HDTRP6	69.48.218.1	TLSv1.2	89	Application Data
3	0.003132	DESKTOP-7HDTRP6	235.109.160.34.bc.googleusercontent.com	TCP	1466	28184 → https(443) [ACK] Seq=1 Ack=1 Win=2047 Len=1412 [TCP PDU reassembled in 14]
4	0.003132	DESKTOP-7HDTRP6	235.109.160.34.bc.googleusercontent.com	TCP	1466	28184 → https(443) [ACK] Seq=1413 Ack=1 Win=2047 Len=1412 [TCP PDU reassembled in 14]
5	0.003132	DESKTOP-7HDTRP6	235.109.160.34.bc.googleusercontent.com	TCP	1466	28184 → https(443) [ACK] Seq=2825 Ack=1 Win=2047 Len=1412 [TCP PDU reassembled in 14]
6	0.003132	DESKTOP-7HDTRP6	235.109.160.34.bc.googleusercontent.com	TCP	1466	28184 → https(443) [ACK] Seq=4237 Ack=1 Win=2047 Len=1412 [TCP PDU reassembled in 14]
7	0.003132	DESKTOP-7HDTRP6	235.109.160.34.bc.googleusercontent.com	TCP	1466	28184 → https(443) [ACK] Seq=5649 Ack=1 Win=2047 Len=1412 [TCP PDU reassembled in 14]
8	0.003132	DESKTOP-7HDTRP6	235.109.160.34.bc.googleusercontent.com	TCP	1466	28184 → https(443) [ACK] Seq=7061 Ack=1 Win=2047 Len=1412 [TCP PDU reassembled in 14]
9	0.003132	DESKTOP-7HDTRP6	235.109.160.34.bc.googleusercontent.com	TCP	1466	28184 → https(443) [ACK] Seq=8473 Ack=1 Win=2047 Len=1412 [TCP PDU reassembled in 14]
10	0.003132	DESKTOP-7HDTRP6	235.109.160.34.bc.googleusercontent.com	TCP	1466	28184 → https(443) [ACK] Seq=9885 Ack=1 Win=2047 Len=1412 [TCP PDU reassembled in 14]
11	0.003132	DESKTOP-7HDTRP6	235.109.160.34.bc.googleusercontent.com	TCP	1466	28184 → https(443) [ACK] Seq=11297 Ack=1 Win=2047 Len=1412 [TCP PDU reassembled in 14]
12	0.003132	DESKTOP-7HDTRP6	235.109.160.34.bc.googleusercontent.com	TCP	1466	28184 → https(443) [ACK] Seq=12709 Ack=1 Win=2047 Len=1412 [TCP PDU reassembled in 14]
13	0.003132	DESKTOP-7HDTRP6	235.109.160.34.bc.googleusercontent.com	TCP	1466	28184 → https(443) [ACK] Seq=14121 Ack=1 Win=2047 Len=1412 [TCP PDU reassembled in 14]
14	0.003132	DESKTOP-7HDTRP6	235.109.160.34.bc.googleusercontent.com	TLSv1.2	928	Application Data
15	0.003465	DESKTOP-7HDTRP6	235.109.160.34.bc.googleusercontent.com	TCP	1466	28184 → https(443) [ACK] Seq=16407 Ack=1 Win=2047 Len=1412 [TCP PDU reassembled in 26]
16	0.003465	DESKTOP-7HDTRP6	235.109.160.34.bc.googleusercontent.com	TCP	1466	28184 → https(443) [ACK] Seq=17819 Ack=1 Win=2047 Len=1412 [TCP PDU reassembled in 26]
17	0.003465	DESKTOP-7HDTRP6	235.109.160.34.bc.googleusercontent.com	TCP	1466	28184 → https(443) [ACK] Seq=19231 Ack=1 Win=2047 Len=1412 [TCP PDU reassembled in 26]
18	0.003465	DESKTOP-7HDTRP6	235.109.160.34.bc.googleusercontent.com	TCP	1466	28184 → https(443) [ACK] Seq=20643 Ack=1 Win=2047 Len=1412 [TCP PDU reassembled in 26]
19	0.003465	DESKTOP-7HDTRP6	235.109.160.34.bc.googleusercontent.com	TCP	1466	28184 → https(443) [ACK] Seq=22055 Ack=1 Win=2047 Len=1412 [TCP PDU reassembled in 26]
20	0.003465	DESKTOP-7HDTRP6	235.109.160.34.bc.googleusercontent.com	TCP	1466	28184 → https(443) [ACK] Seq=23467 Ack=1 Win=2047 Len=1412 [TCP PDU reassembled in 26]
21	0.003465	DESKTOP-7HDTRP6	235.109.160.34.bc.googleusercontent.com	TCP	1466	28184 → https(443) [ACK] Seq=24879 Ack=1 Win=2047 Len=1412 [TCP PDU reassembled in 26]
22	0.003465	DESKTOP-7HDTRP6	235.109.160.34.bc.googleusercontent.com	TCP	1466	28184 → https(443) [ACK] Seq=26291 Ack=1 Win=2047 Len=1412 [TCP PDU reassembled in 26]
23	0.003465	DESKTOP-7HDTRP6	235.109.160.34.bc.googleusercontent.com	TCP	1466	28184 → https(443) [ACK] Seq=27703 Ack=1 Win=2047 Len=1412 [TCP PDU reassembled in 26]
24	0.003465	DESKTOP-7HDTRP6	235.109.160.34.bc.googleusercontent.com	TCP	1466	28184 → https(443) [ACK] Seq=29115 Ack=1 Win=2047 Len=1412 [TCP PDU reassembled in 26]
25	0.003465	DESKTOP-7HDTRP6	235.109.160.34.bc.googleusercontent.com	TCP	1466	28184 → https(443) [ACK] Seq=30527 Ack=1 Win=2047 Len=1412 [TCP PDU reassembled in 26]
26	0.003465	DESKTOP-7HDTRP6	235.109.160.34.bc.googleusercontent.com	TLSv1.2	928	Application Data
27	0.003733	DESKTOP-7HDTRP6	235.109.160.34.bc.googleusercontent.com	TCP	1466	28184 → https(443) [ACK] Seq=32813 Ack=1 Win=2047 Len=1412 [TCP PDU reassembled in 37]
28	0.003733	DESKTOP-7HDTRP6	235.109.160.34.bc.googleusercontent.com	TCP	1466	28184 → https(443) [ACK] Seq=34225 Ack=1 Win=2047 Len=1412 [TCP PDU reassembled in 37]
29	0.003733	DESKTOP-7HDTRP6	235.109.160.34.bc.googleusercontent.com	TCP	1466	28184 → https(443) [ACK] Seq=35637 Ack=1 Win=2047 Len=1412 [TCP PDU reassembled in 37]
30	0.003733	DESKTOP-7HDTRP6	235.109.160.34.bc.googleusercontent.com	TCP	1466	28184 → https(443) [ACK] Seq=37049 Ack=1 Win=2047 Len=1412 [TCP PDU reassembled in 37]
31	0.003733	DESKTOP-7HDTRP6	235.109.160.34.bc.googleusercontent.com	TCP	1466	28184 → https(443) [ACK] Seq=38461 Ack=1 Win=2047 Len=1412 [TCP PDU reassembled in 37]
32	0.003733	DESKTOP-7HDTRP6	235.109.160.34.bc.googleusercontent.com	TCP	1466	28184 → https(443) [ACK] Seq=39873 Ack=1 Win=2047 Len=1412 [TCP PDU reassembled in 37]
33	0.003733	DESKTOP-7HDTRP6	235.109.160.34.bc.googleusercontent.com	TCP	1466	28184 → https(443) [ACK] Seq=41285 Ack=1 Win=2047 Len=1412 [TCP PDU reassembled in 37]
34	0.003733	DESKTOP-7HDTRP6	235.109.160.34.bc.googleusercontent.com	TCP	1466	28184 → https(443) [ACK] Seq=42697 Ack=1 Win=2047 Len=1412 [TCP PDU reassembled in 37]
35	0.003733	DESKTOP-7HDTRP6	235.109.160.34.bc.googleusercontent.com	TCP	1466	28184 → https(443) [ACK] Seq=44109 Ack=1 Win=2047 Len=1412 [TCP PDU reassembled in 37]
36	0.003733	DESKTOP-7HDTRP6	235.109.160.34.bc.googleusercontent.com	TCP	1466	28184 → https(443) [ACK] Seq=45521 Ack=1 Win=2047 Len=1412 [TCP PDU reassembled in 37]
37	0.003733	DESKTOP-7HDTRP6	235.109.160.34.bc.googleusercontent.com	TLSv1.2	1300	Application Data
38	0.004145	DESKTOP-7HDTRP6	235.109.160.34.bc.googleusercontent.com	TCP	1466	28184 → https(443) [ACK] Seq=48179 Ack=1 Win=2047 Len=1412 [TCP PDU reassembled in 49]
39	0.004145	DESKTOP-7HDTRP6	235.109.160.34.bc.googleusercontent.com	TCP	1466	28184 → https(443) [ACK] Seq=49591 Ack=1 Win=2047 Len=1412 [TCP PDU reassembled in 49]
40	0.004145	DESKTOP-7HDTRP6	235.109.160.34.bc.googleusercontent.com	TCP	1466	28184 → https(443) [ACK] Seq=51003 Ack=1 Win=2047 Len=1412 [TCP PDU reassembled in 49]
41	0.004145	DESKTOP-7HDTRP6	235.109.160.34.bc.googleusercontent.com	TCP	1466	28184 → https(443) [ACK] Seq=52415 Ack=1 Win=2047 Len=1412 [TCP PDU reassembled in 49]
42	0.004145	DESKTOP-7HDTRP6	235.109.160.34.bc.googleusercontent.com	TCP	1466	28184 → https(443) [ACK] Seq=53827 Ack=1 Win=2047 Len=1412 [TCP PDU reassembled in 49]
43	0.004145	DESKTOP-7HDTRP6	235.109.160.34.bc.googleusercontent.com	TCP	1466	28184 → https(443) [ACK] Seq=55239 Ack=1 Win=2047 Len=1412 [TCP PDU reassembled in 49]
44	0.004145	DESKTOP-7HDTRP6	235.109.160.34.bc.googleusercontent.com	TCP	1466	28184 → https(443) [ACK] Seq=56651 Ack=1 Win=2047 Len=1412 [TCP PDU reassembled in 49]
45	0.004145	DESKTOP-7HDTRP6	235.109.160.34.bc.googleusercontent.com	TCP	1466	28184 → https(443) [ACK] Seq=58063 Ack=1 Win=2047 Len=1412 [TCP PDU reassembled in 49]
46	0.004145	DESKTOP-7HDTRP6	235.109.160.34.bc.googleusercontent.com	TCP	1466	28184 → https(443) [ACK] Seq=59475 Ack=1 Win=2047 Len=1412 [TCP PDU reassembled in 49]
47	0.004145	DESKTOP-7HDTRP6	235.109.160.34.bc.googleusercontent.com	TCP	1466	28184 → https(443) [ACK] Seq=60887 Ack=1 Win=2047 Len=1412 [TCP PDU reassembled in 49]
48	0.004145	DESKTOP-7HDTRP6	235.109.160.34.bc.googleusercontent.com	TCP	1466	28184 → https(443) [ACK] Seq=62299 Ack=1 Win=2047 Len=1412 [TCP PDU reassembled in 49]
49	0.004145	DESKTOP-7HDTRP6	235.109.160.34.bc.googleusercontent.com	TLSv1.2	928	Application Data
50	0.004400	DESKTOP-7HDTRP6	235.109.160.34.bc.googleusercontent.com	TCP	1466	28184 → https(443) [ACK] Seq=64585 Ack=1 Win=2047 Len=1412 [TCP PDU reassembled in 61]
51	0.004400	DESKTOP-7HDTRP6	235.109.160.34.bc.googleusercontent.com	TCP	1466	28184 → https(443) [ACK] Seq=65997 Ack=1 Win=2047 Len=1412 [TCP PDU reassembled in 61]
52	0.004400	DESKTOP-7HDTRP6	235.109.160.34.bc.googleusercontent.com	TCP	1466	28184 → https(443) [ACK] Seq=67409 Ack=1 Win=2047 Len=1412 [TCP PDU reassembled in 61]
53	0.004400	DESKTOP-7HDTRP6	235.109.160.34.bc.googleusercontent.com	TCP	1466	28184 → https(443) [ACK] Seq=68821 Ack=1 Win=2047 Len=1412 [TCP PDU reassembled in 61]
54	0.004400	DESKTOP-7HDTRP6	235.109.160.34.bc.googleusercontent.com	TCP	1466	28184 → https(443) [ACK] Seq=70233 Ack=1 Win=2047 Len=1412 [TCP PDU reassembled in 61]
55	0.004400	DESKTOP-7HDTRP6	235.109.160.34.bc.googleusercontent.com	TCP	1466	28184 → https(443) [ACK] Seq=71645 Ack=1 Win=2047 Len=1412 [TCP PDU reassembled in 61]
56	0.004400	DESKTOP-7HDTRP6	235.109.160.34.bc.googleusercontent.com	TCP	1466	28184 → https(443) [ACK] Seq=73057 Ack=1 Win=2047 Len=1412 [TCP PDU reassembled in 61]
57	0.004400	DESKTOP-7HDTRP6	235.109.160.34.bc.googleusercontent.com	TCP	1466	28184 → https(443) [ACK] Seq=74469 Ack=1 Win=2047 Len=1412 [TCP PDU reassembled in 61]
58	0.004400	DESKTOP-7HDTRP6	235.109.160.34.bc.googleusercontent.com	TCP	1466	28184 → https(443) [ACK] Seq=75881 Ack=1 Win=2047 Len=1412 [TCP PDU reassembled in 61]
59	0.004400	DESKTOP-7HDTRP6	235.109.160.34.bc.googleusercontent.com	TCP	1466	28184 → https(443) [ACK] Seq=77293 Ack=1 Win=2047 Len=1412 [TCP PDU reassembled in 61]
60	0.004400	DESKTOP-7HDTRP6	235.109.160.34.bc.googleusercontent.com	TCP	1466	28184 → https(443) [ACK] Seq=78705 Ack=1 Win=2047 Len=1412 [TCP PDU reassembled in 61]
61	0.004400	DESKTOP-7HDTRP6	235.109.160.34.bc.googleusercontent.com	TLSv1.2	928	Application Data
62	0.004637	DESKTOP-7HDTRP6	235.109.160.34.bc.googleusercontent.com	TCP	1466	28184 → https(443) [ACK] Seq=80991 Ack=1 Win=2047 Len=1412 [TCP PDU reassembled in 73]
63	0.004637	DESKTOP-7HDTRP6	235.109.160.34.bc.googleusercontent.com	TCP	1466	28184 → https(443) [ACK] Seq=82403 Ack=1 Win=2047 Len=1412 [TCP PDU reassembled in 73]
64	0.004637	DESKTOP-7HDTRP6	235.109.160.34.bc.googleusercontent.com	TCP	1466	28184 → https(443) [ACK] Seq=83815 Ack=1 Win=2047 Len=1412 [TCP PDU reassembled in 73]
65	0.004637	DESKTOP-7HDTRP6	235.109.160.34.bc.googleusercontent.com	TCP	1466	28184 → https(443) [ACK] Seq=85227 Ack=1 Win=2047 Len=1412 [TCP PDU reassembled in 73]
66	0.004637	DESKTOP-7HDTRP6	235.109.160.34.bc.googleusercontent.com	TCP	1466	28184 → https(443) [ACK] Seq=86639 Ack=1 Win=2047 Len=1412 [TCP PDU reassembled in 73]
67	0.004637	DESKTOP-7HDTRP6	235.109.160.34.bc.googleusercontent.com	TCP	1466	28184 → https(443) [ACK] Seq=88051 Ack=1 Win=2047 Len=1412 [TCP PDU reassembled in 73]
68	0.004637	DESKTOP-7HDTRP6	235.109.160.34.bc.googleusercontent.com	TCP	1466	28184 → https(443) [ACK] Seq=89463 Ack=1 Win=2047 Len=1412 [TCP PDU reassembled in 73]
69	0.004637	DESKTOP-7HDTRP6	235.109.160.34.bc.googleusercontent.com	TCP	1466	28184 → https(443) [ACK] Seq=90875 Ack=1 Win=2047 Len=1412 [TCP PDU reassembled in 73]
70	0.004637	DESKTOP-7HDTRP6	235.109.160.34.bc.googleusercontent.com	TCP	1466	28184 → https(443) [ACK] Seq=92287 Ack=1 Win=2047 Len=1412 [TCP PDU reassembled in 73]
71	0.004637	DESKTOP-7HDTRP6	235.109.160.34.bc.googleusercontent.com	TCP	1466	28184 → https(443) [ACK] Seq=93699 Ack=1 Win=2047 Len=1412 [TCP PDU reassembled in 73]
72	0.004637	DESKTOP-7HDTRP6	235.109.160.34.bc.googleusercontent.com	TCP	1466	28184 → https(443) [ACK] Seq=95111 Ack=1 Win=2047 Len=1412 [TCP PDU reassembled in 73]
73	0.004637	DESKTOP-7HDTRP6	235.109.160.34.bc.googleusercontent.com	TLSv1.2	928	Application Data
74	0.004813	DESKTOP-7HDTRP6	235.109.160.34.bc.googleusercontent.com	TCP	1466	28184 → https(443) [ACK] Seq=97397 Ack=1 Win=2047 Len=1412 [TCP PDU reassembled in 85]
75	0.004813	DESKTOP-7HDTRP6	235.109.160.34.bc.googleusercontent.com	TCP	1466	28184 → https(443) [ACK] Seq=98809 Ack=1 Win=2047 Len=1412 [TCP PDU reassembled in 85]
76	0.004813	DESKTOP-7HDTRP6	235.109.160.34.bc.googleusercontent.com	TCP	1466	28184 → https(443) [ACK] Seq=100221 Ack=1 Win=2047 Len=1412 [TCP PDU reassembled in 85]
77	0.004813	DESKTOP-7HDTRP6	235.109.160.34.bc.googleusercontent.com	TCP	1466	28184 → https(443) [ACK] Seq=101633 Ack=1 Win=2047 Len=1412 [TCP PDU reassembled in 85]
78	0.004813	DESKTOP-7HDTRP6	235.109.160.34.bc.googleusercontent.com	TCP	1466	28184 → https(443) [ACK] Seq=103045 Ack=1 Win=2047 Len=1412 [TCP PDU reassembled in 85]
79	0.004813	DESKTOP-7HDTRP6	235.109.160.34.bc.googleusercontent.com	TCP	1466	28184 → https(443) [ACK] Seq=104457 Ack=1 Win=2047 Len=1412 [TCP PDU reassembled in 85]
80	0.004813	DESKTOP-7HDTRP6	235.109.160.34.bc.googleusercontent.com	TCP	1466	28184 → https(443) [ACK] Seq=105869 Ack=1 Win=2047 Len=1412 [TCP PDU reassembled in 85]
81	0.004813	DESKTOP-7HDTRP6	235.109.160.34.bc.googleusercontent.com	TCP	1466	28184 → https(443) [ACK] Seq=107281 Ack=1 Win=2047 Len=1412 [TCP PDU reassembled in 85]
82	0.004813	DESKTOP-7HDTRP6	235.109.160.34.bc.googleusercontent.com	TCP	1466	28184 → https(443) [ACK] Seq=108693 Ack=1 Win=2047 Len=1412 [TCP PDU reassembled in 85]
83	0.004813	DESKTOP-7HDTRP6	235.109.160.34.bc.googleusercontent.com	TCP	1466	28184 → https(443) [ACK] Seq=110105 Ack=1 Win=2047 Len=1412 [TCP PDU reassembled in 85]
84	0.004813	DESKTOP-7HDTRP6	235.109.160.34.bc.googleusercontent.com	TCP	1466	28184 → https(443) [ACK] Seq=111517 Ack=1 Win=2047 Len=1412 [TCP PDU reassembled in 85]
85	0.004813	DESKTOP-7HDTRP6	235.109.160.34.bc.googleusercontent.com	TLSv1.2	928	Application Data
86	0.004973	DESKTOP-7HDTRP6	235.109.160.34.bc.googleusercontent.com	TCP	1466	28184 → https(443) [ACK] Seq=113803 Ack=1 Win=2047 Len=1412 [TCP PDU reassembled in 89]
87	0.004973	DESKTOP-7HDTRP6	235.109.160.34.bc.googleusercontent.com	TCP	1466	28184 → https(443) [ACK] Seq=115215 Ack=1 Win=2047 Len=1412 [TCP PDU reassembled in 89]
88	0.004973	DESKTOP-7HDTRP6	235.109.160.34.bc.googleusercontent.com	TCP	1466	28184 → https(443) [ACK] Seq=116627 Ack=1 Win=2047 Len=1412 [TCP PDU reassembled in 89]
89	0.004973	DESKTOP-7HDTRP6	235.109.160.34.bc.googleusercontent.com	TLSv1.2	58	Application Data
90	0.006213	DESKTOP-7HDTRP6	69.48.218.1	TCP	1514	60349 → https(443) [ACK] Seq=36 Ack=40 Win=254 Len=1460 [TCP PDU reassembled in 92]
91	0.006213	DESKTOP-7HDTRP6	69.48.218.1	TCP	1514	60349 → https(443) [ACK] Seq=1496 Ack=40 Win=254 Len=1460 [TCP PDU reassembled in 92]
92	0.006213	DESKTOP-7HDTRP6	69.48.218.1	TLSv1.2	910	Application Data
93	0.064849	69.48.218.1	DESKTOP-7HDTRP6	TCP	56	https(443) → 60349 [ACK] Seq=40 Ack=36 Win=50 Len=0
94	0.078273	69.48.218.1	DESKTOP-7HDTRP6	TCP	56	https(443) → 60349 [ACK] Seq=40 Ack=1496 Win=50 Len=0
95	0.078554	69.48.218.1	DESKTOP-7HDTRP6	TCP	56	https(443) → 60349 [ACK] Seq=40 Ack=3812 Win=51 Len=0
96	0.081522	235.109.160.34.bc.googleusercontent.com	DESKTOP-7HDTRP6	TCP	56	https(443) → 28184 [ACK] Seq=1 Ack=1413 Win=13341 Len=0
97	0.083272	235.109.160.34.bc.googleusercontent.com	DESKTOP-7HDTRP6	TCP	56	https(443) → 28184 [ACK] Seq=1 Ack=2825 Win=13352 Len=0
98	0.084955	235.109.160.34.bc.googleusercontent.com	DESKTOP-7HDTRP6	TCP	56	https(443) → 28184 [ACK] Seq=1 Ack=4237 Win=13363 Len=0
99	0.084955	235.109.160.34.bc.googleusercontent.com	DESKTOP-7HDTRP6	TCP	56	https(443) → 28184 [ACK] Seq=1 Ack=5649 Win=13374 Len=0
100	0.084955	235.109.160.34.bc.googleusercontent.com	DESKTOP-7HDTRP6	TCP	56	https(443) → 28184 [ACK] Seq=1 Ack=7061 Win=13385 Len=0
101	0.084955	235.109.160.34.bc.googleusercontent.com	DESKTOP-7HDTRP6	TCP	56	https(443) → 28184 [ACK] Seq=1 Ack=8473 Win=13396 Len=0
102	0.084955	235.109.160.34.bc.googleusercontent.com	DESKTOP-7HDTRP6	TCP	56	https(443) → 28184 [ACK] Seq=1 Ack=9885 Win=13407 Len=0
103	0.084955	235.109.160.34.bc.googleusercontent.com	DESKTOP-7HDTRP6	TCP	56	https(443) → 28184 [ACK] Seq=1 Ack=11297 Win=13418 Len=0
104	0.084955	235.109.160.34.bc.googleusercontent.com	DESKTOP-7HDTRP6	TCP	56	https(443) → 28184 [ACK] Seq=1 Ack=12709 Win=13429 Len=0
105	0.084955	235.109.160.34.bc.googleusercontent.com	DESKTOP-7HDTRP6	TCP	56	https(443) → 28184 [ACK] Seq=1 Ack=14121 Win=13440 Len=0
106	0.084955	235.109.160.34.bc.googleusercontent.com	DESKTOP-7HDTRP6	TCP	56	https(443) → 28184 [ACK] Seq=1 Ack=15533 Win=13451 Len=0
107	0.084955	235.109.160.34.bc.googleusercontent.com	DESKTOP-7HDTRP6	TCP	56	https(443) → 28184 [ACK] Seq=1 Ack=16407 Win=13451 Len=0
108	0.084955	235.109.160.34.bc.googleusercontent.com	DESKTOP-7HDTRP6	TCP	56	https(443) → 28184 [ACK] Seq=1 Ack=17819 Win=13462 Len=0
109	0.084955	235.109.160.34.bc.googleusercontent.com	DESKTOP-7HDTRP6	TCP	56	https(443) → 28184 [ACK] Seq=1 Ack=19231 Win=13473 Len=0
110	0.084955	235.109.160.34.bc.googleusercontent.com	DESKTOP-7HDTRP6	TCP	56	https(443) → 28184 [ACK] Seq=1 Ack=20643 Win=13484 Len=0
111	0.087489	235.109.160.34.bc.googleusercontent.com	DESKTOP-7HDTRP6	TCP	56	https(443) → 28184 [ACK] Seq=1 Ack=22055 Win=13495 Len=0
112	0.087489	235.109.160.34.bc.googleusercontent.com	DESKTOP-7HDTRP6	TCP	56	https(443) → 28184 [ACK] Seq=1 Ack=23467 Win=13506 Len=0
113	0.087489	235.109.160.34.bc.googleusercontent.com	DESKTOP-7HDTRP6	TCP	56	https(443) → 28184 [ACK] Seq=1 Ack=24879 Win=13517 Len=0
114	0.087489	235.109.160.34.bc.googleusercontent.com	DESKTOP-7HDTRP6	TCP	56	https(443) → 28184 [ACK] Seq=1 Ack=26291 Win=13528 Len=0
115	0.087489	235.109.160.34.bc.googleusercontent.com	DESKTOP-7HDTRP6	TCP	56	https(443) → 28184 [ACK] Seq=1 Ack=27703 Win=13539 Len=0
116	0.087489	235.109.160.34.bc.googleusercontent.com	DESKTOP-7HDTRP6	TCP	56	https(443) → 28184 [ACK] Seq=1 Ack=29115 Win=13550 Len=0
117	0.087489	235.109.160.34.bc.googleusercontent.com	DESKTOP-7HDTRP6	TCP	56	https(443) → 28184 [ACK] Seq=1 Ack=30527 Win=13561 Len=0
118	0.087489	235.109.160.34.bc.googleusercontent.com	DESKTOP-7HDTRP6	TCP	56	https(443) → 28184 [ACK] Seq=1 Ack=31939 Win=13572 Len=0
119	0.087489	235.109.160.34.bc.googleusercontent.com	DESKTOP-7HDTRP6	TCP	56	https(443) → 28184 [ACK] Seq=1 Ack=32813 Win=13572 Len=0
120	0.087489	235.109.160.34.bc.googleusercontent.com	DESKTOP-7HDTRP6	TCP	56	https(443) → 28184 [ACK] Seq=1 Ack=34225 Win=13583 Len=0
121	0.087489	235.109.160.34.bc.googleusercontent.com	DESKTOP-7HDTRP6	TCP	56	https(443) → 28184 [ACK] Seq=1 Ack=35637 Win=13594 Len=0
122	0.087489	235.109.160.34.bc.googleusercontent.com	DESKTOP-7HDTRP6	TCP	56	https(443) → 28184 [ACK] Seq=1 Ack=37049 Win=13605 Len=0
123	0.087489	235.109.160.34.bc.googleusercontent.com	DESKTOP-7HDTRP6	TCP	56	https(443) → 28184 [ACK] Seq=1 Ack=38461 Win=13616 Len=0
124	0.087489	235.109.160.34.bc.googleusercontent.com	DESKTOP-7HDTRP6	TCP	56	https(443) → 28184 [ACK] Seq=1 Ack=39873 Win=13627 Len=0
125	0.087489	235.109.160.34.bc.googleusercontent.com	DESKTOP-7HDTRP6	TCP	56	https(443) → 28184 [ACK] Seq=1 Ack=41285 Win=13638 Len=0
126	0.087489	235.109.160.34.bc.googleusercontent.com	DESKTOP-7HDTRP6	TCP	56	https(443) → 28184 [ACK] Seq=1 Ack=42697 Win=13649 Len=0
127	0.089982	235.109.160.34.bc.googleusercontent.com	DESKTOP-7HDTRP6	TCP	56	https(443) → 28184 [ACK] Seq=1 Ack=44109 Win=13660 Len=0
128	0.089982	235.109.160.34.bc.googleusercontent.com	DESKTOP-7HDTRP6	TCP	56	https(443) → 28184 [ACK] Seq=1 Ack=45521 Win=13672 Len=0
129	0.089982	235.109.160.34.bc.googleusercontent.com	DESKTOP-7HDTRP6	TCP	56	https(443) → 28184 [ACK] Seq=1 Ack=46933 Win=13683 Len=0
130	0.089982	235.109.160.34.bc.googleusercontent.com	DESKTOP-7HDTRP6	TCP	56	https(443) → 28184 [ACK] Seq=1 Ack=48179 Win=13694 Len=0
131	0.089982	235.109.160.34.bc.googleusercontent.com	DESKTOP-7HDTRP6	TCP	56	https(443) → 28184 [ACK] Seq=1 Ack=49591 Win=13705 Len=0
132	0.089982	235.109.160.34.bc.googleusercontent.com	DESKTOP-7HDTRP6	TCP	56	https(443) → 28184 [ACK] Seq=1 Ack=51003 Win=13716 Len=0
133	0.089982	235.109.160.34.bc.googleusercontent.com	DESKTOP-7HDTRP6	TCP	56	https(443) → 28184 [ACK] Seq=1 Ack=52415 Win=13727 Len=0
134	0.089982	235.109.160.34.bc.googleusercontent.com	DESKTOP-7HDTRP6	TCP	56	https(443) → 28184 [ACK] Seq=1 Ack=53827 Win=13738 Len=0
135	0.089982	235.109.160.34.bc.googleusercontent.com	DESKTOP-7HDTRP6	TCP	56	https(443) → 28184 [ACK] Seq=1 Ack=55239 Win=13749 Len=0
136	0.090640	235.109.160.34.bc.googleusercontent.com	DESKTOP-7HDTRP6	TCP	56	https(443) → 28184 [ACK] Seq=1 Ack=56651 Win=13760 Len=0
137	0.090640	235.109.160.34.bc.googleusercontent.com	DESKTOP-7HDTRP6	TCP	56	https(443) → 28184 [ACK] Seq=1 Ack=58063 Win=13771 Len=0
138	0.090640	235.109.160.34.bc.googleusercontent.com	DESKTOP-7HDTRP6	TCP	56	https(443) → 28184 [ACK] Seq=1 Ack=59475 Win=13782 Len=0
139	0.090640	235.109.160.34.bc.googleusercontent.com	DESKTOP-7HDTRP6	TCP	56	https(443) → 28184 [ACK] Seq=1 Ack=60887 Win=13793 Len=0
140	0.090640	235.109.160.34.bc.googleusercontent.com	DESKTOP-7HDTRP6	TCP	56	https(443) → 28184 [ACK] Seq=1 Ack=62299 Win=13804 Len=0
141	0.090640	235.109.160.34.bc.googleusercontent.com	DESKTOP-7HDTRP6	TCP	56	https(443) → 28184 [ACK] Seq=1 Ack=63711 Win=13815 Len=0
142	0.090640	235.109.160.34.bc.googleusercontent.com	DESKTOP-7HDTRP6	TCP	56	https(443) → 28184 [ACK] Seq=1 Ack=64585 Win=13815 Len=0
143	0.090640	235.109.160.34.bc.googleusercontent.com	DESKTOP-7HDTRP6	TCP	56	https(443) → 28184 [ACK] Seq=1 Ack=65997 Win=13826 Len=0
144	0.090640	235.109.160.34.bc.googleusercontent.com	DESKTOP-7HDTRP6	TCP	56	https(443) → 28184 [ACK] Seq=1 Ack=67409 Win=13837 Len=0
145	0.096111	235.109.160.34.bc.googleusercontent.com	DESKTOP-7HDTRP6	TCP	56	https(443) → 28184 [ACK] Seq=1 Ack=68821 Win=13848 Len=0
146	0.099260	235.109.160.34.bc.googleusercontent.com	DESKTOP-7HDTRP6	TCP	56	https(443) → 28184 [ACK] Seq=1 Ack=70233 Win=13859 Len=0
147	0.099260	235.109.160.34.bc.googleusercontent.com	DESKTOP-7HDTRP6	TCP	56	https(443) → 28184 [ACK] Seq=1 Ack=71645 Win=13870 Len=0
148	0.099260	235.109.160.34.bc.googleusercontent.com	DESKTOP-7HDTRP6	TCP	56	https(443) → 28184 [ACK] Seq=1 Ack=73057 Win=13881 Len=0
149	0.099260	235.109.160.34.bc.googleusercontent.com	DESKTOP-7HDTRP6	TCP	56	https(443) → 28184 [ACK] Seq=1 Ack=74469 Win=13892 Len=0
150	0.099260	235.109.160.34.bc.googleusercontent.com	DESKTOP-7HDTRP6	TCP	56	https(443) → 28184 [ACK] Seq=1 Ack=75881 Win=13903 Len=0
151	0.099260	235.109.160.34.bc.googleusercontent.com	DESKTOP-7HDTRP6	TCP	56	https(443) → 28184 [ACK] Seq=1 Ack=77293 Win=13914 Len=0
152	0.099260	235.109.160.34.bc.googleusercontent.com	DESKTOP-7HDTRP6	TCP	56	https(443) → 28184 [ACK] Seq=1 Ack=78705 Win=13925 Len=0
153	0.099260	235.109.160.34.bc.googleusercontent.com	DESKTOP-7HDTRP6	TCP	56	https(443) → 28184 [ACK] Seq=1 Ack=80117 Win=13936 Len=0
154	0.099260	235.109.160.34.bc.googleusercontent.com	DESKTOP-7HDTRP6	TCP	56	https(443) → 28184 [ACK] Seq=1 Ack=80991 Win=13936 Len=0
155	0.099260	235.109.160.34.bc.googleusercontent.com	DESKTOP-7HDTRP6	TCP	56	https(443) → 28184 [ACK] Seq=1 Ack=82403 Win=13947 Len=0
156	0.099260	235.109.160.34.bc.googleusercontent.com	DESKTOP-7HDTRP6	TCP	56	https(443) → 28184 [ACK] Seq=1 Ack=83815 Win=13958 Len=0
157	0.099260	235.109.160.34.bc.googleusercontent.com	DESKTOP-7HDTRP6	TCP	56	https(443) → 28184 [ACK] Seq=1 Ack=85227 Win=13969 Len=0
158	0.099260	235.109.160.34.bc.googleusercontent.com	DESKTOP-7HDTRP6	TCP	56	https(443) → 28184 [ACK] Seq=1 Ack=86639 Win=13980 Len=0
159	0.099260	235.109.160.34.bc.googleusercontent.com	DESKTOP-7HDTRP6	TCP	56	https(443) → 28184 [ACK] Seq=1 Ack=88051 Win=13991 Len=0
160	0.099260	235.109.160.34.bc.googleusercontent.com	DESKTOP-7HDTRP6	TCP	56	https(443) → 28184 [ACK] Seq=1 Ack=89463 Win=14002 Len=0
161	0.099260	235.109.160.34.bc.googleusercontent.com	DESKTOP-7HDTRP6	TCP	56	https(443) → 28184 [ACK] Seq=1 Ack=90875 Win=14013 Len=0
162	0.099260	235.109.160.34.bc.googleusercontent.com	DESKTOP-7HDTRP6	TCP	56	https(443) → 28184 [ACK] Seq=1 Ack=92287 Win=14025 Len=0
163	0.099260	235.109.160.34.bc.googleusercontent.com	DESKTOP-7HDTRP6	TCP	56	https(443) → 28184 [ACK] Seq=1 Ack=93699 Win=14036 Len=0
164	0.099260	235.109.160.34.bc.googleusercontent.com	DESKTOP-7HDTRP6	TCP	56	https(443) → 28184 [ACK] Seq=1 Ack=95111 Win=14047 Len=0
165	0.099260	235.109.160.34.bc.googleusercontent.com	DESKTOP-7HDTRP6	TCP	56	https(443) → 28184 [ACK] Seq=1 Ack=96523 Win=14058 Len=0
166	0.099260	235.109.160.34.bc.googleusercontent.com	DESKTOP-7HDTRP6	TCP	56	https(443) → 28184 [ACK] Seq=1 Ack=97397 Win=14058 Len=0
167	0.099260	235.109.160.34.bc.googleusercontent.com	DESKTOP-7HDTRP6	TCP	56	https(443) → 28184 [ACK] Seq=1 Ack=98809 Win=14069 Len=0
168	0.099260	235.109.160.34.bc.googleusercontent.com	DESKTOP-7HDTRP6	TCP	56	https(443) → 28184 [ACK] Seq=1 Ack=100221 Win=14080 Len=0
169	0.099260	235.109.160.34.bc.googleusercontent.com	DESKTOP-7HDTRP6	TCP	56	https(443) → 28184 [ACK] Seq=1 Ack=101633 Win=14091 Len=0
170	0.099260	235.109.160.34.bc.googleusercontent.com	DESKTOP-7HDTRP6	TCP	56	https(443) → 28184 [ACK] Seq=1 Ack=103045 Win=14102 Len=0
171	0.099260	235.109.160.34.bc.googleusercontent.com	DESKTOP-7HDTRP6	TCP	56	https(443) → 28184 [ACK] Seq=1 Ack=104457 Win=14113 Len=0
172	0.099260	235.109.160.34.bc.googleusercontent.com	DESKTOP-7HDTRP6	TCP	56	https(443) → 28184 [ACK] Seq=1 Ack=105869 Win=14124 Len=0
173	0.099260	235.109.160.34.bc.googleusercontent.com	DESKTOP-7HDTRP6	TCP	56	https(443) → 28184 [ACK] Seq=1 Ack=107281 Win=14135 Len=0
174	0.099260	235.109.160.34.bc.googleusercontent.com	DESKTOP-7HDTRP6	TCP	56	https(443) → 28184 [ACK] Seq=1 Ack=108693 Win=14146 Len=0
175	0.099260	235.109.160.34.bc.googleusercontent.com	DESKTOP-7HDTRP6	TCP	56	https(443) → 28184 [ACK] Seq=1 Ack=110105 Win=14157 Len=0
176	0.099260	235.109.160.34.bc.googleusercontent.com	DESKTOP-7HDTRP6	TCP	56	https(443) → 28184 [ACK] Seq=1 Ack=111517 Win=14168 Len=0
177	0.099260	235.109.160.34.bc.googleusercontent.com	DESKTOP-7HDTRP6	TCP	56	https(443) → 28184 [ACK] Seq=1 Ack=112929 Win=14179 Len=0
178	0.099804	235.109.160.34.bc.googleusercontent.com	DESKTOP-7HDTRP6	TCP	56	https(443) → 28184 [ACK] Seq=1 Ack=113803 Win=14179 Len=0
179	0.099804	235.109.160.34.bc.googleusercontent.com	DESKTOP-7HDTRP6	TCP	56	https(443) → 28184 [ACK] Seq=1 Ack=115215 Win=14190 Len=0
180	0.099804	235.109.160.34.bc.googleusercontent.com	DESKTOP-7HDTRP6	TCP	56	https(443) → 28184 [ACK] Seq=1 Ack=116627 Win=14201 Len=0
181	0.099804	235.109.160.34.bc.googleusercontent.com	DESKTOP-7HDTRP6	TCP	66	[TCP Dup ACK 180#1] https(443) → 28184 [ACK] Seq=1 Ack=116627 Win=14201 Len=0 SLE=118039 SRE=118043
182	0.099804	235.109.160.34.bc.googleusercontent.com	DESKTOP-7HDTRP6	TCP	56	https(443) → 28184 [ACK] Seq=1 Ack=118043 Win=14212 Len=0
183	0.153316	Android-75.local	mdns.mcast.net	MDNS	450	Standard query response 0x0000 TXT, cache flush PTR _androidtvremote2._tcp.local PTR Formuler Z10._androidtvremote2._tcp.local SRV, cache flush 0 0 6466 Android-75.local PTR, cache flush Android-75.local PTR, cache flush Android-75.local A, cache flush 10.0.0.170 AAAA, cache flush fe80::271e:f1d8:4a62:7c6a NSEC, cache flush Formuler Z10._androidtvremote2._tcp.local NSEC, cache flush 170.0.0.10.in-addr.arpa NSEC, cache flush A.6.C.7.2.6.A.4.8.D.1.F.E.1.7.2.0.0.0.0.0.0.0.0.0.0.0.0.0.8.E.F.ip6.arpa NSEC, cache flush Android-75.local
184	0.166584	Android-75.local	ff02::fb	MDNS	470	Standard query response 0x0000 TXT, cache flush PTR _androidtvremote2._tcp.local PTR Formuler Z10._androidtvremote2._tcp.local SRV, cache flush 0 0 6466 Android-75.local PTR, cache flush Android-75.local PTR, cache flush Android-75.local A, cache flush 10.0.0.170 AAAA, cache flush fe80::271e:f1d8:4a62:7c6a NSEC, cache flush Formuler Z10._androidtvremote2._tcp.local NSEC, cache flush 170.0.0.10.in-addr.arpa NSEC, cache flush A.6.C.7.2.6.A.4.8.D.1.F.E.1.7.2.0.0.0.0.0.0.0.0.0.0.0.0.0.8.E.F.ip6.arpa NSEC, cache flush Android-75.local
185	0.172991	235.109.160.34.bc.googleusercontent.com	DESKTOP-7HDTRP6	TLSv1.2	197	Application Data
186	0.196564	69.48.218.1	DESKTOP-7HDTRP6	TLSv1.2	250	Application Data
187	0.197132	69.48.218.1	DESKTOP-7HDTRP6	TLSv1.2	118	Application Data, Application Data
188	0.197169	DESKTOP-7HDTRP6	69.48.218.1	TCP	54	60349 → https(443) [ACK] Seq=3812 Ack=300 Win=253 Len=0
189	0.217311	DESKTOP-7HDTRP6	235.109.160.34.bc.googleusercontent.com	TCP	54	28184 → https(443) [ACK] Seq=118043 Ack=144 Win=2047 Len=0
190	0.255162	unifi.localdomain	mdns.mcast.net	MDNS	102	Standard query 0x0000 AAAA bcc191c5-51f8-58fa-c99a-4a0721745788.local, "QM" question
191	0.255861	fe80::6e63:f8ff:feeb:9c13	ff02::fb	MDNS	122	Standard query 0x0000 AAAA bcc191c5-51f8-58fa-c99a-4a0721745788.local, "QM" question
192	0.259530	qro02s25-in-f10.1e100.net	DESKTOP-7HDTRP6	UDP	200	Session 89/110, Report segment
193	0.268353	DESKTOP-7HDTRP6	unifi.localdomain	DNS	107	Standard query 0xfe6d PTR 1.218.48.69.in-addr.arpa OPT
194	0.268615	DESKTOP-7HDTRP6	unifi.localdomain	DNS	106	Standard query 0x8849 PTR 254.1.0.10.in-addr.arpa OPT
195	0.268868	DESKTOP-7HDTRP6	unifi.localdomain	DNS	110	Standard query 0x89ca PTR 235.109.160.34.in-addr.arpa OPT
196	0.271635	unifi.localdomain	DESKTOP-7HDTRP6	DNS	198	Standard query response 0xfe6d No such name PTR 1.218.48.69.in-addr.arpa SOA edns126.ultradns.com OPT
197	0.272606	unifi.localdomain	DESKTOP-7HDTRP6	DNS	123	Standard query response 0x8849 PTR 254.1.0.10.in-addr.arpa PTR DESKTOP-7HDTRP6 OPT
198	0.272606	unifi.localdomain	DESKTOP-7HDTRP6	DNS	151	Standard query response 0x89ca PTR 235.109.160.34.in-addr.arpa PTR 235.109.160.34.bc.googleusercontent.com OPT
199	0.284256	DESKTOP-7HDTRP6	qro02s25-in-f10.1e100.net	SKYPE	75	NAT info Unk: f
200	0.374323	DESKTOP-7HDTRP6	235.109.160.34.bc.googleusercontent.com	TLSv1.2	100	Application Data
201	0.473260	235.109.160.34.bc.googleusercontent.com	DESKTOP-7HDTRP6	TCP	56	https(443) → 63024 [ACK] Seq=1 Ack=47 Win=2276 Len=0
202	0.487916	104.18.35.46	DESKTOP-7HDTRP6	TLSv1.2	224	Application Data
203	0.488818	DESKTOP-7HDTRP6	104.18.35.46	TLSv1.2	228	Application Data
204	0.506509	235.109.160.34.bc.googleusercontent.com	DESKTOP-7HDTRP6	TLSv1.2	406	Application Data
205	0.529221	DESKTOP-7HDTRP6	235.109.160.34.bc.googleusercontent.com	TLSv1.2	87	Application Data
206	0.573497	104.18.35.46	DESKTOP-7HDTRP6	TCP	56	https(443) → 64042 [ACK] Seq=171 Ack=175 Win=183 Len=0
207	0.598379	235.109.160.34.bc.googleusercontent.com	DESKTOP-7HDTRP6	TCP	56	https(443) → 63024 [ACK] Seq=353 Ack=80 Win=2276 Len=0
208	0.731268	104.18.35.46	DESKTOP-7HDTRP6	TLSv1.2	221	Application Data
209	0.731888	DESKTOP-7HDTRP6	104.18.35.46	TLSv1.2	225	Application Data
210	0.785142	104.18.35.46	DESKTOP-7HDTRP6	TCP	56	https(443) → 31502 [ACK] Seq=168 Ack=172 Win=257 Len=0
211	0.818307	DESKTOP-7HDTRP6	235.109.160.34.bc.googleusercontent.com	TLSv1.2	101	Application Data
212	0.869363	unifi.localdomain	mdns.mcast.net	MDNS	102	Standard query 0x0000 AAAA 4219e0a5-fe7a-8bee-d950-9371f9ba30f0.local, "QM" question
213	0.882925	fe80::6e63:f8ff:feeb:9c13	ff02::fb	MDNS	122	Standard query 0x0000 AAAA 4219e0a5-fe7a-8bee-d950-9371f9ba30f0.local, "QM" question
214	0.882925	unifi.localdomain	mdns.mcast.net	MDNS	102	Standard query 0x0000 AAAA dcc79fa5-383e-c6e9-fb12-bfd7ce74e061.local, "QM" question
215	0.882925	fe80::6e63:f8ff:feeb:9c13	ff02::fb	MDNS	122	Standard query 0x0000 AAAA dcc79fa5-383e-c6e9-fb12-bfd7ce74e061.local, "QM" question
216	0.892817	235.109.160.34.bc.googleusercontent.com	DESKTOP-7HDTRP6	TCP	56	https(443) → 62444 [ACK] Seq=1 Ack=48 Win=968 Len=0
217	0.985632	235.109.160.34.bc.googleusercontent.com	DESKTOP-7HDTRP6	TLSv1.2	408	Application Data
218	0.985632	172.64.152.210	DESKTOP-7HDTRP6	TLSv1.2	224	Application Data
219	0.985632	235.109.160.34.bc.googleusercontent.com	DESKTOP-7HDTRP6	TLSv1.2	887	Application Data
220	0.985632	235.109.160.34.bc.googleusercontent.com	DESKTOP-7HDTRP6	TLSv1.2	1392	Application Data
221	0.985767	DESKTOP-7HDTRP6	235.109.160.34.bc.googleusercontent.com	TCP	54	cpscomm(5194) → https(443) [ACK] Seq=1 Ack=2172 Win=2047 Len=0
222	0.987581	DESKTOP-7HDTRP6	172.64.152.210	TLSv1.2	228	Application Data
223	0.992195	235.109.160.34.bc.googleusercontent.com	DESKTOP-7HDTRP6	TLSv1.2	1037	Application Data
224	1.000444	235.109.160.34.bc.googleusercontent.com	DESKTOP-7HDTRP6	TLSv1.2	659	Application Data
225	1.000444	235.109.160.34.bc.googleusercontent.com	DESKTOP-7HDTRP6	TLSv1.2	659	Application Data
226	1.000498	DESKTOP-7HDTRP6	235.109.160.34.bc.googleusercontent.com	TCP	54	28184 → https(443) [ACK] Seq=118043 Ack=2337 Win=2047 Len=0
227	1.000857	DESKTOP-7HDTRP6	3eaad90f-f0c7-0c3a-71c2-5aca062b62d3.local	TLSv1.2	164	Application Data
228	1.004479	235.109.160.34.bc.googleusercontent.com	DESKTOP-7HDTRP6	TLSv1.2	291	Application Data
229	1.010219	235.109.160.34.bc.googleusercontent.com	DESKTOP-7HDTRP6	TLSv1.2	291	Application Data
230	1.010278	DESKTOP-7HDTRP6	235.109.160.34.bc.googleusercontent.com	TCP	54	28184 → https(443) [ACK] Seq=118043 Ack=2574 Win=2047 Len=0
231	1.032520	DESKTOP-7HDTRP6	235.109.160.34.bc.googleusercontent.com	TCP	54	62444 → https(443) [ACK] Seq=48 Ack=355 Win=2043 Len=0
232	1.037654	172.64.152.210	DESKTOP-7HDTRP6	TCP	56	https(443) → 51071 [ACK] Seq=171 Ack=175 Win=220 Len=0
233	1.053470	DESKTOP-7HDTRP6	235.109.160.34.bc.googleusercontent.com	TCP	54	cpscomm(5194) → https(443) [ACK] Seq=1 Ack=2409 Win=2047 Len=0
234	1.140867	172.64.152.210	DESKTOP-7HDTRP6	TLSv1.2	220	Application Data
235	1.140867	172.64.152.210	DESKTOP-7HDTRP6	TLSv1.2	219	Application Data
236	1.142833	172.64.152.210	DESKTOP-7HDTRP6	TLSv1.2	220	Application Data
237	1.174501	DESKTOP-7HDTRP6	172.64.152.210	TLSv1.2	223	Application Data
238	1.175373	DESKTOP-7HDTRP6	172.64.152.210	TLSv1.2	224	Application Data
239	1.175679	DESKTOP-7HDTRP6	172.64.152.210	TLSv1.2	224	Application Data
240	1.181952	DESKTOP-7HDTRP6	172.64.152.210	TLSv1.2	97	Application Data
241	1.189412	235.109.160.34.bc.googleusercontent.com	DESKTOP-7HDTRP6	TLSv1.2	190	Application Data
242	1.190014	DESKTOP-7HDTRP6	235.109.160.34.bc.googleusercontent.com	TLSv1.2	194	Application Data
243	1.191096	235.109.160.34.bc.googleusercontent.com	DESKTOP-7HDTRP6	TLSv1.2	289	Application Data
244	1.191096	235.109.160.34.bc.googleusercontent.com	DESKTOP-7HDTRP6	TLSv1.2	289	Application Data
245	1.204709	3eaad90f-f0c7-0c3a-71c2-5aca062b62d3.local	DESKTOP-7HDTRP6	TLSv1.2	164	Application Data
246	1.222589	172.64.152.210	DESKTOP-7HDTRP6	TCP	56	https(443) → fly(4396) [ACK] Seq=166 Ack=170 Win=19 Len=0
247	1.223743	172.64.152.210	DESKTOP-7HDTRP6	TCP	56	https(443) → 29281 [ACK] Seq=167 Ack=171 Win=19 Len=0
248	1.229752	172.64.152.210	DESKTOP-7HDTRP6	TCP	56	https(443) → 10966 [ACK] Seq=167 Ack=171 Win=16 Len=0
249	1.235330	DESKTOP-7HDTRP6	235.109.160.34.bc.googleusercontent.com	TCP	54	cpscomm(5194) → https(443) [ACK] Seq=141 Ack=2780 Win=2045 Len=0
250	1.235582	DESKTOP-7HDTRP6	235.109.160.34.bc.googleusercontent.com	TCP	54	28184 → https(443) [ACK] Seq=118043 Ack=2809 Win=2046 Len=0
251	1.244763	DESKTOP-7HDTRP6	3eaad90f-f0c7-0c3a-71c2-5aca062b62d3.local	TCP	54	60343 → nvme-disc(8009) [ACK] Seq=111 Ack=111 Win=252 Len=0
252	1.267697	DESKTOP-7HDTRP6	unifi.localdomain	DNS	106	Standard query 0x3353 PTR 170.0.0.10.in-addr.arpa OPT
253	1.267956	DESKTOP-7HDTRP6	unifi.localdomain	DNS	107	Standard query 0x1632 PTR 251.0.0.224.in-addr.arpa OPT
254	1.268133	DESKTOP-7HDTRP6	unifi.localdomain	DNS	155	Standard query 0x9d49 PTR b.f.0.0.0.0.0.0.0.0.0.0.0.0.0.0.0.0.0.0.0.0.0.0.0.0.0.0.2.0.f.f.ip6.arpa OPT
255	1.268292	DESKTOP-7HDTRP6	unifi.localdomain	DNS	104	Standard query 0x6a70 PTR 1.0.0.10.in-addr.arpa OPT
256	1.268519	DESKTOP-7HDTRP6	unifi.localdomain	DNS	155	Standard query 0x83e1 PTR 3.1.c.9.b.e.e.f.f.f.8.f.3.6.e.6.0.0.0.0.0.0.0.0.0.0.0.0.0.8.e.f.ip6.arpa OPT
257	1.268756	DESKTOP-7HDTRP6	unifi.localdomain	DNS	110	Standard query 0x58f5 PTR 138.34.251.142.in-addr.arpa OPT
258	1.268928	DESKTOP-7HDTRP6	unifi.localdomain	DNS	108	Standard query 0xb5ca PTR 46.35.18.104.in-addr.arpa OPT
259	1.277552	235.109.160.34.bc.googleusercontent.com	DESKTOP-7HDTRP6	TCP	56	https(443) → cpscomm(5194) [ACK] Seq=2780 Ack=141 Win=15840 Len=0
260	1.278277	235.109.160.34.bc.googleusercontent.com	DESKTOP-7HDTRP6	TLSv1.2	295	Application Data
261	1.278277	235.109.160.34.bc.googleusercontent.com	DESKTOP-7HDTRP6	TLSv1.2	288	Application Data
262	1.278277	235.109.160.34.bc.googleusercontent.com	DESKTOP-7HDTRP6	TLSv1.2	295	Application Data
263	1.278277	172.64.152.210	DESKTOP-7HDTRP6	TLSv1.2	93	Application Data
264	1.278277	235.109.160.34.bc.googleusercontent.com	DESKTOP-7HDTRP6	TLSv1.2	288	Application Data
265	1.278348	DESKTOP-7HDTRP6	235.109.160.34.bc.googleusercontent.com	TCP	54	cpscomm(5194) → https(443) [ACK] Seq=141 Ack=3255 Win=2043 Len=0
266	1.278392	DESKTOP-7HDTRP6	235.109.160.34.bc.googleusercontent.com	TCP	54	28184 → https(443) [ACK] Seq=118043 Ack=3284 Win=2044 Len=0
267	1.294145	unifi.localdomain	DESKTOP-7HDTRP6	DNS	94	Standard query response 0x3353 No such name PTR 170.0.0.10.in-addr.arpa OPT
268	1.294635	unifi.localdomain	DESKTOP-7HDTRP6	DNS	123	Standard query response 0x1632 PTR 251.0.0.224.in-addr.arpa PTR mdns.mcast.net OPT
269	1.294635	unifi.localdomain	DESKTOP-7HDTRP6	DNS	219	Standard query response 0x9d49 No such name PTR b.f.0.0.0.0.0.0.0.0.0.0.0.0.0.0.0.0.0.0.0.0.0.0.0.0.0.0.2.0.f.f.ip6.arpa SOA b.ip6-servers.arpa OPT
270	1.294635	unifi.localdomain	DESKTOP-7HDTRP6	DNS	123	Standard query response 0x6a70 PTR 1.0.0.10.in-addr.arpa PTR unifi.localdomain OPT
271	1.294635	unifi.localdomain	DESKTOP-7HDTRP6	DNS	143	Standard query response 0x83e1 No such name PTR 3.1.c.9.b.e.e.f.f.f.8.f.3.6.e.6.0.0.0.0.0.0.0.0.0.0.0.0.0.8.e.f.ip6.arpa OPT
272	1.294635	unifi.localdomain	DESKTOP-7HDTRP6	DNS	137	Standard query response 0x58f5 PTR 138.34.251.142.in-addr.arpa PTR qro02s25-in-f10.1e100.net OPT
273	1.295692	unifi.localdomain	DESKTOP-7HDTRP6	DNS	191	Standard query response 0xb5ca No such name PTR 46.35.18.104.in-addr.arpa SOA cruz.ns.cloudflare.com OPT
274	1.334670	DESKTOP-7HDTRP6	172.64.152.210	TCP	54	43924 → https(443) [ACK] Seq=44 Ack=40 Win=255 Len=0
275	1.394875	235.109.160.34.bc.googleusercontent.com	DESKTOP-7HDTRP6	TLSv1.2	839	Application Data
276	1.394875	235.109.160.34.bc.googleusercontent.com	DESKTOP-7HDTRP6	TLSv1.2	839	Application Data
277	1.421728	104.18.35.46	DESKTOP-7HDTRP6	TLSv1.2	520	Application Data
278	1.421728	172.64.152.210	DESKTOP-7HDTRP6	TLSv1.2	520	Application Data
279	1.424282	104.18.35.46	DESKTOP-7HDTRP6	TLSv1.2	520	Application Data
280	1.450684	DESKTOP-7HDTRP6	235.109.160.34.bc.googleusercontent.com	TCP	54	cpscomm(5194) → https(443) [ACK] Seq=141 Ack=4040 Win=2047 Len=0
281	1.450684	DESKTOP-7HDTRP6	235.109.160.34.bc.googleusercontent.com	TCP	54	28184 → https(443) [ACK] Seq=118043 Ack=4069 Win=2047 Len=0
282	1.467523	DESKTOP-7HDTRP6	104.18.35.46	TCP	54	43494 → https(443) [ACK] Seq=1 Ack=467 Win=252 Len=0
283	1.467524	DESKTOP-7HDTRP6	104.18.35.46	TCP	54	24407 → https(443) [ACK] Seq=1 Ack=467 Win=252 Len=0
284	1.467523	DESKTOP-7HDTRP6	172.64.152.210	TCP	54	43924 → https(443) [ACK] Seq=44 Ack=506 Win=254 Len=0
285	1.469517	DESKTOP-7HDTRP6	13.58.82.34.bc.googleusercontent.com	TLSv1.2	808	Application Data
286	1.498261	235.109.160.34.bc.googleusercontent.com	DESKTOP-7HDTRP6	TLSv1.2	190	Application Data
287	1.498895	DESKTOP-7HDTRP6	235.109.160.34.bc.googleusercontent.com	TLSv1.2	194	Application Data
288	1.501868	DESKTOP-7HDTRP6	dcc79fa5-383e-c6e9-fb12-bfd7ce74e061.local	TCP	66	9721 → nvme-disc(8009) [SYN] Seq=0 Win=65535 Len=0 MSS=1460 WS=256 SACK_PERM
289	1.514189	DESKTOP-7HDTRP6	235.109.160.34.bc.googleusercontent.com	TLSv1.2	101	Application Data
290	1.585419	A56-de-Karina	Broadcast	ARP	56	Gratuitous ARP for 10.0.0.25 (Reply)
291	1.586879	235.109.160.34.bc.googleusercontent.com	DESKTOP-7HDTRP6	TCP	56	https(443) → 28184 [ACK] Seq=4205 Ack=118183 Win=14212 Len=0
292	1.586879	235.109.160.34.bc.googleusercontent.com	DESKTOP-7HDTRP6	TCP	56	https(443) → 63024 [ACK] Seq=353 Ack=127 Win=2276 Len=0
293	1.634208	DESKTOP-7HDTRP6	vz-in-f188.1e100.net	TCP	55	14832 → hpvroom(5228) [ACK] Seq=1 Ack=1 Win=252 Len=1
294	1.646552	235.109.160.34.bc.googleusercontent.com	DESKTOP-7HDTRP6	TLSv1.2	409	Application Data
295	1.651879	13.58.82.34.bc.googleusercontent.com	DESKTOP-7HDTRP6	TCP	56	https(443) → 5860 [ACK] Seq=1 Ack=755 Win=730 Len=0
296	1.657198	13.58.82.34.bc.googleusercontent.com	DESKTOP-7HDTRP6	TLSv1.2	460	Application Data
