1	0.000000	10.215.173.1	10.215.173.2	DNS	116	Standard query 0x03fd A z-m-gateway.facebook.com
2	0.012212	10.215.173.2	10.215.173.1	DNS	172	Standard query response 0x03fd A z-m-gateway.facebook.com CNAME dgw-mini.c10r.facebook.com A 57.144.162.3
3	0.021702	10.215.173.1	dgw-mini.c10r.facebook.com	TCP	108	39058 → https(443) [SYN] Seq=0 Win=65535 Len=0 MSS=9960 SACK_PERM TSval=485575075 TSecr=0 WS=1024
4	0.098140	dgw-mini.c10r.facebook.com	10.215.173.1	TCP	96	https(443) → 39058 [SYN, ACK] Seq=0 Ack=1 Win=1024 Len=0 MSS=9960 WS=1024
5	0.098505	10.215.173.1	dgw-mini.c10r.facebook.com	TCP	88	39058 → https(443) [ACK] Seq=1 Ack=1 Win=65536 Len=0
6	0.102862	10.215.173.1	dgw-mini.c10r.facebook.com	TLSv1.3	304	Client Hello (SNI=z-m-gateway.facebook.com)
7	0.103439	dgw-mini.c10r.facebook.com	10.215.173.1	TCP	88	https(443) → 39058 [ACK] Seq=1 Ack=216 Win=1047552 Len=0
8	0.177097	dgw-mini.c10r.facebook.com	10.215.173.1	TLSv1.3	3376	Server Hello, Change Cipher Spec, Application Data, Application Data, Application Data
9	0.177527	10.215.173.1	dgw-mini.c10r.facebook.com	TCP	88	39058 → https(443) [ACK] Seq=216 Ack=3290 Win=86016 Len=0
10	0.198259	10.215.173.1	dgw-mini.c10r.facebook.com	TLSv1.3	92	Change Cipher Spec
11	0.198464	dgw-mini.c10r.facebook.com	10.215.173.1	TCP	88	https(443) → 39058 [ACK] Seq=3290 Ack=222 Win=1047552 Len=0
12	0.199094	10.215.173.1	dgw-mini.c10r.facebook.com	TLSv1.3	156	Application Data
13	0.199254	dgw-mini.c10r.facebook.com	10.215.173.1	TCP	88	https(443) → 39058 [ACK] Seq=3290 Ack=291 Win=1047552 Len=0
14	0.216501	10.215.173.1	dgw-mini.c10r.facebook.com	TLSv1.3	140	Application Data
15	0.216709	dgw-mini.c10r.facebook.com	10.215.173.1	TCP	88	https(443) → 39058 [ACK] Seq=3290 Ack=344 Win=1047552 Len=0
16	0.217003	10.215.173.1	dgw-mini.c10r.facebook.com	TLSv1.3	140	Application Data
17	0.217131	dgw-mini.c10r.facebook.com	10.215.173.1	TCP	88	https(443) → 39058 [ACK] Seq=3290 Ack=397 Win=1047552 Len=0
18	0.217332	10.215.173.1	dgw-mini.c10r.facebook.com	TLSv1.3	124	Application Data
19	0.217437	dgw-mini.c10r.facebook.com	10.215.173.1	TCP	88	https(443) → 39058 [ACK] Seq=3290 Ack=434 Win=1047552 Len=0
20	0.217659	10.215.173.1	dgw-mini.c10r.facebook.com	TLSv1.3	876	Application Data
21	0.217785	dgw-mini.c10r.facebook.com	10.215.173.1	TCP	88	https(443) → 39058 [ACK] Seq=3290 Ack=1223 Win=1047552 Len=0
22	0.218012	10.215.173.1	dgw-mini.c10r.facebook.com	TLSv1.3	1260	Application Data
23	0.218110	dgw-mini.c10r.facebook.com	10.215.173.1	TCP	88	https(443) → 39058 [ACK] Seq=3290 Ack=2396 Win=1045504 Len=0
24	0.272268	dgw-mini.c10r.facebook.com	10.215.173.1	TLSv1.3	340	Application Data, Application Data
25	0.272838	10.215.173.1	dgw-mini.c10r.facebook.com	TLSv1.3	124	Application Data
26	0.273042	dgw-mini.c10r.facebook.com	10.215.173.1	TCP	88	https(443) → 39058 [ACK] Seq=3543 Ack=2433 Win=1045504 Len=0
27	0.289866	dgw-mini.c10r.facebook.com	10.215.173.1	TLSv1.3	120	Application Data
28	0.290570	dgw-mini.c10r.facebook.com	10.215.173.1	TLSv1.3	124	Application Data
29	0.290903	10.215.173.1	dgw-mini.c10r.facebook.com	TCP	88	39058 → https(443) [ACK] Seq=2433 Ack=3609 Win=92160 Len=0
30	0.365069	dgw-mini.c10r.facebook.com	10.215.173.1	TLSv1.3	200	Application Data
31	0.366532	dgw-mini.c10r.facebook.com	10.215.173.1	TLSv1.3	212	Application Data, Application Data
32	0.367051	10.215.173.1	dgw-mini.c10r.facebook.com	TCP	88	39058 → https(443) [ACK] Seq=2433 Ack=3846 Win=92160 Len=0
33	28.944166	10.215.173.1	10.215.173.2	DNS	112	Standard query 0xf753 A graph.facebook.com
34	28.984444	10.215.173.2	10.215.173.1	DNS	152	Standard query response 0xf753 A graph.facebook.com CNAME star.c10r.facebook.com A 57.144.162.141
35	28.990632	10.215.173.1	star.c10r.facebook.com	TCP	108	40026 → https(443) [SYN] Seq=0 Win=65535 Len=0 MSS=9960 SACK_PERM TSval=4187093469 TSecr=0 WS=1024
36	29.066558	star.c10r.facebook.com	10.215.173.1	TCP	96	https(443) → 40026 [SYN, ACK] Seq=0 Ack=1 Win=1024 Len=0 MSS=9960 WS=1024
37	29.066924	10.215.173.1	star.c10r.facebook.com	TCP	88	40026 → https(443) [ACK] Seq=1 Ack=1 Win=65536 Len=0
38	29.071667	10.215.173.1	star.c10r.facebook.com	TCP	600	40026 → https(443) [ACK] Seq=1 Ack=1 Win=65536 Len=512 [TCP PDU reassembled in 39]
39	29.071973	10.215.173.1	star.c10r.facebook.com	TLSv1.3	92	Client Hello (SNI=graph.facebook.com)
40	29.072406	star.c10r.facebook.com	10.215.173.1	TCP	88	https(443) → 40026 [ACK] Seq=1 Ack=518 Win=1047552 Len=0
41	29.146788	star.c10r.facebook.com	10.215.173.1	TLSv1.3	304	Server Hello, Change Cipher Spec, Application Data
42	29.147480	10.215.173.1	star.c10r.facebook.com	TCP	88	40026 → https(443) [ACK] Seq=518 Ack=219 Win=66560 Len=0
43	29.150272	10.215.173.1	star.c10r.facebook.com	TLSv1.3	152	Change Cipher Spec, Application Data
44	29.150524	star.c10r.facebook.com	10.215.173.1	TCP	88	https(443) → 40026 [ACK] Seq=219 Ack=582 Win=1047552 Len=0
45	29.152762	10.215.173.1	star.c10r.facebook.com	TLSv1.3	1052	Application Data
46	29.153279	star.c10r.facebook.com	10.215.173.1	TCP	88	https(443) → 40026 [ACK] Seq=219 Ack=1548 Win=1046528 Len=0
47	29.223294	star.c10r.facebook.com	10.215.173.1	TLSv1.3	272	Application Data
48	29.267152	10.215.173.1	star.c10r.facebook.com	TCP	88	40026 → https(443) [ACK] Seq=1548 Ack=404 Win=67584 Len=0
49	29.275540	star.c10r.facebook.com	10.215.173.1	TLSv1.3	1036	Application Data
50	29.276823	10.215.173.1	star.c10r.facebook.com	TCP	88	40026 → https(443) [ACK] Seq=1548 Ack=1354 Win=88064 Len=0
51	29.276838	10.215.173.1	star.c10r.facebook.com	TCP	88	40026 → https(443) [FIN, ACK] Seq=1548 Ack=1354 Win=88064 Len=0
52	29.277011	star.c10r.facebook.com	10.215.173.1	TCP	88	https(443) → 40026 [ACK] Seq=1354 Ack=1549 Win=1047552 Len=0
53	29.349706	star.c10r.facebook.com	10.215.173.1	TCP	88	https(443) → 40026 [FIN, ACK] Seq=1354 Ack=1549 Win=1048576 Len=0
54	40.133237	10.215.173.1	10.215.173.2	DNS	112	Standard query 0xc732 A api.onesignal.com
55	40.147885	10.215.173.2	10.215.173.1	DNS	144	Standard query response 0xc732 A api.onesignal.com A 104.16.160.145 A 104.17.111.223
56	40.157658	10.215.173.1	api.onesignal.com	TCP	108	50856 → https(443) [SYN] Seq=0 Win=65535 Len=0 MSS=9960 SACK_PERM TSval=804460445 TSecr=0 WS=1024
57	40.162241	10.215.173.1	10.215.173.2	DNS	108	Standard query 0x5cc7 A www.clarity.ms
58	40.175703	10.215.173.2	10.215.173.1	DNS	232	Standard query response 0x5cc7 A www.clarity.ms CNAME tm-clarity-tag.trafficmanager.net CNAME vmss-clarity-tag-eus2.eastus2.cloudapp.azure.com A 4.153.187.221
59	40.181883	10.215.173.1	vmss-clarity-tag-eus2.eastus2.cloudapp.azure.com	TCP	108	46076 → https(443) [SYN] Seq=0 Win=65535 Len=0 MSS=9960 SACK_PERM TSval=2849970749 TSecr=0 WS=1024
60	40.230291	api.onesignal.com	10.215.173.1	TCP	96	https(443) → 50856 [SYN, ACK] Seq=0 Ack=1 Win=1024 Len=0 MSS=9960 WS=1024
61	40.230739	10.215.173.1	api.onesignal.com	TCP	88	50856 → https(443) [ACK] Seq=1 Ack=1 Win=65536 Len=0
62	40.238650	10.215.173.1	api.onesignal.com	TCP	600	50856 → https(443) [ACK] Seq=1 Ack=1 Win=65536 Len=512 [TCP PDU reassembled in 64]
63	40.239103	api.onesignal.com	10.215.173.1	TCP	88	https(443) → 50856 [ACK] Seq=1 Ack=513 Win=1047552 Len=0
64	40.239265	10.215.173.1	api.onesignal.com	TLSv1.3	92	Client Hello (SNI=api.onesignal.com)
65	40.239875	api.onesignal.com	10.215.173.1	TCP	88	https(443) → 50856 [ACK] Seq=1 Ack=518 Win=1047552 Len=0
66	40.279380	vmss-clarity-tag-eus2.eastus2.cloudapp.azure.com	10.215.173.1	TCP	96	https(443) → 46076 [SYN, ACK] Seq=0 Ack=1 Win=1024 Len=0 MSS=9960 WS=1024
67	40.279753	10.215.173.1	vmss-clarity-tag-eus2.eastus2.cloudapp.azure.com	TCP	88	46076 → https(443) [ACK] Seq=1 Ack=1 Win=65536 Len=0
68	40.282074	10.215.173.1	vmss-clarity-tag-eus2.eastus2.cloudapp.azure.com	TCP	600	46076 → https(443) [ACK] Seq=1 Ack=1 Win=65536 Len=512 [TCP PDU reassembled in 69]
69	40.282405	10.215.173.1	vmss-clarity-tag-eus2.eastus2.cloudapp.azure.com	TLSv1.2	92	Client Hello (SNI=www.clarity.ms)
70	40.282874	vmss-clarity-tag-eus2.eastus2.cloudapp.azure.com	10.215.173.1	TCP	88	https(443) → 46076 [ACK] Seq=1 Ack=518 Win=1047552 Len=0
71	40.310731	api.onesignal.com	10.215.173.1	TLSv1.3	1488	Server Hello, Change Cipher Spec
72	40.311455	10.215.173.1	api.onesignal.com	TCP	88	50856 → https(443) [ACK] Seq=518 Ack=1401 Win=86016 Len=0
73	40.311517	api.onesignal.com	10.215.173.1	TLSv1.3	1792	Application Data
74	40.311814	10.215.173.1	api.onesignal.com	TCP	88	50856 → https(443) [ACK] Seq=518 Ack=3107 Win=105472 Len=0
75	40.342437	10.215.173.1	api.onesignal.com	TLSv1.3	152	Change Cipher Spec, Application Data
76	40.342600	api.onesignal.com	10.215.173.1	TCP	88	https(443) → 50856 [ACK] Seq=3107 Ack=582 Win=1047552 Len=0
77	40.344408	10.215.173.1	api.onesignal.com	TLSv1.3	648	Application Data
78	40.344591	api.onesignal.com	10.215.173.1	TCP	88	https(443) → 50856 [ACK] Seq=3107 Ack=1144 Win=1047552 Len=0
79	40.377223	vmss-clarity-tag-eus2.eastus2.cloudapp.azure.com	10.215.173.1	TLSv1.2	5160	Server Hello, Certificate, Server Key Exchange, Server Hello Done
80	40.384567	10.215.173.1	vmss-clarity-tag-eus2.eastus2.cloudapp.azure.com	TCP	88	46076 → https(443) [ACK] Seq=518 Ack=5073 Win=86016 Len=0
81	40.407767	10.215.173.1	vmss-clarity-tag-eus2.eastus2.cloudapp.azure.com	TLSv1.2	180	Client Key Exchange, Change Cipher Spec, Encrypted Handshake Message
82	40.407970	vmss-clarity-tag-eus2.eastus2.cloudapp.azure.com	10.215.173.1	TCP	88	https(443) → 46076 [ACK] Seq=5073 Ack=611 Win=1047552 Len=0
83	40.427908	api.onesignal.com	10.215.173.1	TLSv1.3	1664	Application Data, Application Data
84	40.471220	10.215.173.1	api.onesignal.com	TCP	88	50856 → https(443) [ACK] Seq=1144 Ack=4685 Win=109568 Len=0
85	40.502779	vmss-clarity-tag-eus2.eastus2.cloudapp.azure.com	10.215.173.1	TLSv1.2	376	New Session Ticket, Change Cipher Spec, Encrypted Handshake Message
86	40.504598	10.215.173.1	vmss-clarity-tag-eus2.eastus2.cloudapp.azure.com	TLSv1.2	352	Application Data
87	40.504824	vmss-clarity-tag-eus2.eastus2.cloudapp.azure.com	10.215.173.1	TCP	88	https(443) → 46076 [ACK] Seq=5363 Ack=876 Win=1047552 Len=0
88	40.600194	vmss-clarity-tag-eus2.eastus2.cloudapp.azure.com	10.215.173.1	TLSv1.2	800	Application Data
89	40.643352	10.215.173.1	vmss-clarity-tag-eus2.eastus2.cloudapp.azure.com	TCP	88	46076 → https(443) [ACK] Seq=876 Ack=6075 Win=106496 Len=0
90	41.205035	10.215.173.1	10.215.173.2	DNS	128	Standard query 0x8bdf A firebaseremoteconfig.googleapis.com
91	41.222091	10.215.173.2	10.215.173.1	DNS	336	Standard query response 0x8bdf A firebaseremoteconfig.googleapis.com A 192.178.50.74 A 142.251.34.138 A 142.251.35.234 A 142.250.64.202 A 142.250.64.234 A 142.250.217.170 A 142.250.217.202 A 142.250.217.234 A 192.178.50.42 A 172.217.15.202 A 142.250.64.138 A 142.250.64.170 A 172.217.165.202
92	41.247954	10.215.173.1	readaloud.googleapis.com	TCP	108	42140 → https(443) [SYN] Seq=0 Win=65535 Len=0 MSS=9960 SACK_PERM TSval=1709765033 TSecr=0 WS=1024
93	41.326544	readaloud.googleapis.com	10.215.173.1	TCP	96	https(443) → 42140 [SYN, ACK] Seq=0 Ack=1 Win=1024 Len=0 MSS=9960 WS=1024
94	41.327109	10.215.173.1	readaloud.googleapis.com	TCP	88	42140 → https(443) [ACK] Seq=1 Ack=1 Win=65536 Len=0
95	41.335251	10.215.173.1	readaloud.googleapis.com	TCP	600	42140 → https(443) [ACK] Seq=1 Ack=1 Win=65536 Len=512 [TCP PDU reassembled in 96]
96	41.335596	10.215.173.1	readaloud.googleapis.com	TLSv1.3	92	Client Hello (SNI=firebaseremoteconfig.googleapis.com)
97	41.336211	readaloud.googleapis.com	10.215.173.1	TCP	88	https(443) → 42140 [ACK] Seq=1 Ack=518 Win=1047552 Len=0
98	41.423237	readaloud.googleapis.com	10.215.173.1	TLSv1.3	1488	Server Hello, Change Cipher Spec
99	41.426761	10.215.173.1	readaloud.googleapis.com	TCP	88	42140 → https(443) [ACK] Seq=518 Ack=1401 Win=86016 Len=0
100	41.517470	readaloud.googleapis.com	10.215.173.1	TLSv1.3	3188	Application Data
101	41.518297	10.215.173.1	readaloud.googleapis.com	TCP	88	42140 → https(443) [ACK] Seq=518 Ack=4501 Win=105472 Len=0
102	41.596922	10.215.173.1	readaloud.googleapis.com	TLSv1.3	152	Change Cipher Spec, Application Data
103	41.597571	readaloud.googleapis.com	10.215.173.1	TCP	88	https(443) → 42140 [ACK] Seq=4501 Ack=582 Win=1047552 Len=0
104	41.600622	10.215.173.1	readaloud.googleapis.com	TLSv1.3	1760	Application Data
105	41.601473	readaloud.googleapis.com	10.215.173.1	TCP	88	https(443) → 42140 [ACK] Seq=4501 Ack=2253 Win=1046528 Len=0
106	41.710214	readaloud.googleapis.com	10.215.173.1	TLSv1.3	1388	Application Data, Application Data
107	41.710662	10.215.173.1	readaloud.googleapis.com	TCP	88	42140 → https(443) [ACK] Seq=2253 Ack=5803 Win=111616 Len=0
108	41.710719	readaloud.googleapis.com	10.215.173.1	TLSv1.3	116	Application Data
109	41.710957	10.215.173.1	readaloud.googleapis.com	TCP	88	42140 → https(443) [ACK] Seq=2253 Ack=5830 Win=111616 Len=0
110	41.753826	10.215.173.1	readaloud.googleapis.com	TLSv1.3	1760	Application Data
111	41.754362	readaloud.googleapis.com	10.215.173.1	TCP	88	https(443) → 42140 [ACK] Seq=5830 Ack=3924 Win=1046528 Len=0
112	41.860491	readaloud.googleapis.com	10.215.173.1	TLSv1.3	776	Application Data
113	41.861971	10.215.173.1	readaloud.googleapis.com	TCP	88	42140 → https(443) [ACK] Seq=3924 Ack=6519 Win=118784 Len=0
114	41.862059	readaloud.googleapis.com	10.215.173.1	TLSv1.3	116	Application Data
115	41.862425	10.215.173.1	readaloud.googleapis.com	TCP	88	42140 → https(443) [ACK] Seq=3924 Ack=6546 Win=118784 Len=0
116	41.940166	10.215.173.1	10.215.173.2	DNS	120	Standard query 0x2a4c A googleads.g.doubleclick.net
117	41.954576	10.215.173.2	10.215.173.1	DNS	136	Standard query response 0x2a4c A googleads.g.doubleclick.net A 172.217.2.194
118	41.962426	10.215.173.1	googleads.g.doubleclick.net	TCP	108	48876 → https(443) [SYN] Seq=0 Win=65535 Len=0 MSS=9960 SACK_PERM TSval=1844181909 TSecr=0 WS=1024
119	41.985818	10.215.173.1	10.215.173.2	DNS	116	Standard query 0xa5af A play-fe.googleapis.com
120	41.997730	10.215.173.2	10.215.173.1	DNS	132	Standard query response 0xa5af A play-fe.googleapis.com A 142.250.64.238
121	42.013404	10.215.173.1	android.l.google.com	SKYPE	1324	Unknown_0
122	42.015842	10.215.173.1	android.l.google.com	SKYPE	1324	Unknown_0
123	42.016008	10.215.173.1	android.l.google.com	SKYPE	1324	Unknown_0
124	42.016248	10.215.173.1	android.l.google.com	SKYPE	156	Unknown_0
125	42.038694	googleads.g.doubleclick.net	10.215.173.1	TCP	96	https(443) → 48876 [SYN, ACK] Seq=0 Ack=1 Win=1024 Len=0 MSS=9960 WS=1024
126	42.039116	10.215.173.1	googleads.g.doubleclick.net	TCP	88	48876 → https(443) [ACK] Seq=1 Ack=1 Win=65536 Len=0
127	42.042661	10.215.173.1	googleads.g.doubleclick.net	TCP	600	48876 → https(443) [ACK] Seq=1 Ack=1 Win=65536 Len=512 [TCP PDU reassembled in 131]
128	42.043086	10.215.173.1	googleads.g.doubleclick.net	TCP	600	[TCP Window Full] 48876 → https(443) [PSH, ACK] Seq=513 Ack=1 Win=65536 Len=512 [TCP PDU reassembled in 131]
129	42.043447	googleads.g.doubleclick.net	10.215.173.1	TCP	88	https(443) → 48876 [ACK] Seq=1 Ack=1025 Win=1047552 Len=0
130	42.043683	10.215.173.1	googleads.g.doubleclick.net	TCP	600	48876 → https(443) [ACK] Seq=1025 Ack=1 Win=65536 Len=512 [TCP PDU reassembled in 131]
131	42.043813	10.215.173.1	googleads.g.doubleclick.net	TLSv1.3	384	Client Hello (SNI=googleads.g.doubleclick.net)
132	42.044153	googleads.g.doubleclick.net	10.215.173.1	TCP	88	https(443) → 48876 [ACK] Seq=1 Ack=1834 Win=1046528 Len=0
133	42.088873	android.l.google.com	10.215.173.1	SKYPE	116	Unknown_0
134	42.089199	android.l.google.com	10.215.173.1	SKYPE	116	Unknown_0
135	42.089289	android.l.google.com	10.215.173.1	SKYPE	1324	Unknown_0
136	42.089385	android.l.google.com	10.215.173.1	SKYPE	1324	Unknown_0
137	42.099960	android.l.google.com	10.215.173.1	SKYPE	1324	Unknown_0
138	42.101409	android.l.google.com	10.215.173.1	SKYPE	384	Unknown_0
139	42.101598	android.l.google.com	10.215.173.1	SKYPE	1020	Unknown_0 Unk: f
140	42.101728	android.l.google.com	10.215.173.1	UDP	112	Session 16/780795184373, Control segment
141	42.102274	10.215.173.1	android.l.google.com	SKYPE	1324	Unknown_0
142	42.103352	10.215.173.1	android.l.google.com	SKYPE	156	Unknown_0
143	42.103703	10.215.173.1	android.l.google.com	UDP	108	Session 239287387/15988, Green data
144	42.106587	10.215.173.1	android.l.google.com	UDP	1320	Session 239287387/15988, Red data
145	42.106957	10.215.173.1	android.l.google.com	UDP	1324	Session 239287387/15988, Report ack segment
146	42.107187	10.215.173.1	android.l.google.com	UDP	348	Session 239287387/15988, Red data
147	42.107577	10.215.173.1	android.l.google.com	UDP	164	Session 239287387/15988, Green data
148	42.108024	10.215.173.1	android.l.google.com	UDP	104	Session 239287387/15988, Green data
149	42.108190	10.215.173.1	android.l.google.com	UDP	104	Session 239287387/15988, Red data
150	42.115529	android.l.google.com	10.215.173.1	UDP	100	Session 124/57, Green data
151	42.133305	googleads.g.doubleclick.net	10.215.173.1	TLSv1.3	4288	Server Hello, Change Cipher Spec
152	42.133851	10.215.173.1	googleads.g.doubleclick.net	TCP	88	48876 → https(443) [ACK] Seq=1834 Ack=4201 Win=86016 Len=0
153	42.133909	googleads.g.doubleclick.net	10.215.173.1	TLSv1.3	1536	Application Data
154	42.134103	10.215.173.1	googleads.g.doubleclick.net	TCP	88	48876 → https(443) [ACK] Seq=1834 Ack=5650 Win=105472 Len=0
155	42.156752	10.215.173.1	googleads.g.doubleclick.net	TLSv1.3	160	Change Cipher Spec, Application Data
156	42.157028	googleads.g.doubleclick.net	10.215.173.1	TCP	88	https(443) → 48876 [ACK] Seq=5650 Ack=1908 Win=1047552 Len=0
157	42.161808	10.215.173.1	googleads.g.doubleclick.net	TLSv1.3	180	Application Data
158	42.162188	googleads.g.doubleclick.net	10.215.173.1	TCP	88	https(443) → 48876 [ACK] Seq=5650 Ack=2000 Win=1047552 Len=0
159	42.164342	10.215.173.1	googleads.g.doubleclick.net	TLSv1.3	888	Application Data
160	42.164592	googleads.g.doubleclick.net	10.215.173.1	TCP	88	https(443) → 48876 [ACK] Seq=5650 Ack=2799 Win=1047552 Len=0
161	42.177011	android.l.google.com	10.215.173.1	UDP	196	Session 8571/44, Cancel segment
162	42.180106	android.l.google.com	10.215.173.1	UDP	100	Protocol Error
163	42.180230	android.l.google.com	10.215.173.1	SKYPE	100	NAT repeat Unk: 2
164	42.180267	android.l.google.com	10.215.173.1	SKYPE	104	NAT repeat Unk: 5
165	42.180973	10.215.173.1	android.l.google.com	UDP	108	Session 239287387/15988, Green data
166	42.181159	android.l.google.com	10.215.173.1	SKYPE	104	Fragment/Forward/Resend Unk: 7
167	42.205209	android.l.google.com	10.215.173.1	UDP	100	Session 296067568106835/17, Green data
168	42.207373	10.215.173.1	android.l.google.com	UDP	108	Session 239287387/15988, Cancel ack segment
169	42.228987	googleads.g.doubleclick.net	10.215.173.1	TLSv1.3	1072	Application Data, Application Data
170	42.230543	10.215.173.1	googleads.g.doubleclick.net	TLSv1.3	120	Application Data
171	42.230800	googleads.g.doubleclick.net	10.215.173.1	TCP	88	https(443) → 48876 [ACK] Seq=6634 Ack=2830 Win=1047552 Len=0
172	42.234642	googleads.g.doubleclick.net	10.215.173.1	TLSv1.3	120	Application Data
173	42.258461	googleads.g.doubleclick.net	10.215.173.1	TLSv1.3	876	Application Data, Application Data, Application Data, Application Data
174	42.259215	10.215.173.1	googleads.g.doubleclick.net	TCP	88	48876 → https(443) [ACK] Seq=2830 Ack=7454 Win=122880 Len=0
175	42.266305	10.215.173.1	googleads.g.doubleclick.net	TLSv1.3	128	Application Data
176	42.266680	googleads.g.doubleclick.net	10.215.173.1	TCP	88	https(443) → 48876 [ACK] Seq=7454 Ack=2869 Win=1047552 Len=0
177	42.301431	android.l.google.com	10.215.173.1	UDP, HiPerConTracer	320	https(443) → 33453 Len=246 (SendTTL=182, Round=181)
178	42.302955	android.l.google.com	10.215.173.1	UDP	252	Session 78/697304, Green data
179	42.303773	10.215.173.1	android.l.google.com	UDP	112	Session 239287387/15988, Green data
180	42.304891	android.l.google.com	10.215.173.1	SKYPE	180	Unknown_0 Unk: 9
181	42.305039	android.l.google.com	10.215.173.1	SKYPE	156	Payload Unk: 1
182	42.305752	10.215.173.1	android.l.google.com	UDP	112	Session 239287387/15988, Control segment
183	42.378769	android.l.google.com	10.215.173.1	UDP	100	Session 15211/1590044, Green data
184	43.902106	10.215.173.1	googleads.g.doubleclick.net	TCP	88	48876 → https(443) [FIN, ACK] Seq=2869 Ack=7454 Win=122880 Len=0
185	43.902278	googleads.g.doubleclick.net	10.215.173.1	TCP	88	https(443) → 48876 [ACK] Seq=7454 Ack=2870 Win=1047552 Len=0
186	43.902609	10.215.173.1	readaloud.googleapis.com	TCP	88	42140 → https(443) [FIN, ACK] Seq=3924 Ack=6546 Win=118784 Len=0
187	43.902743	readaloud.googleapis.com	10.215.173.1	TCP	88	https(443) → 42140 [ACK] Seq=6546 Ack=3925 Win=1047552 Len=0
188	43.907732	10.215.173.1	api.onesignal.com	TCP	88	50856 → https(443) [FIN, ACK] Seq=1144 Ack=4685 Win=109568 Len=0
189	43.907899	api.onesignal.com	10.215.173.1	TCP	88	https(443) → 50856 [ACK] Seq=4685 Ack=1145 Win=1047552 Len=0
190	43.908227	10.215.173.1	vmss-clarity-tag-eus2.eastus2.cloudapp.azure.com	TCP	88	46076 → https(443) [FIN, ACK] Seq=876 Ack=6075 Win=106496 Len=0
191	43.908301	vmss-clarity-tag-eus2.eastus2.cloudapp.azure.com	10.215.173.1	TCP	88	https(443) → 46076 [ACK] Seq=6075 Ack=877 Win=1047552 Len=0
192	43.999717	api.onesignal.com	10.215.173.1	TCP	88	https(443) → 50856 [FIN, ACK] Seq=4685 Ack=1145 Win=1048576 Len=0
193	44.000803	readaloud.googleapis.com	10.215.173.1	TCP	88	https(443) → 42140 [FIN, ACK] Seq=6546 Ack=3925 Win=1048576 Len=0
194	44.002002	googleads.g.doubleclick.net	10.215.173.1	TCP	88	https(443) → 48876 [FIN, ACK] Seq=7454 Ack=2870 Win=1048576 Len=0
195	44.022684	vmss-clarity-tag-eus2.eastus2.cloudapp.azure.com	10.215.173.1	TCP	88	https(443) → 46076 [FIN, ACK] Seq=6075 Ack=877 Win=1048576 Len=0
196	44.757104	10.215.173.1	10.215.173.2	DNS	108	Standard query 0x414b A inbox.google.com
197	44.774958	10.215.173.2	10.215.173.1	DNS	124	Standard query response 0x414b A inbox.google.com A 192.178.50.37
198	44.781905	10.215.173.1	inbox.google.com	TCP	108	57848 → https(443) [SYN] Seq=0 Win=65535 Len=0 MSS=9960 SACK_PERM TSval=3797702572 TSecr=0 WS=1024
199	44.856722	inbox.google.com	10.215.173.1	TCP	96	https(443) → 57848 [SYN, ACK] Seq=0 Ack=1 Win=1024 Len=0 MSS=9960 WS=1024
200	44.857080	10.215.173.1	inbox.google.com	TCP	88	57848 → https(443) [ACK] Seq=1 Ack=1 Win=65536 Len=0
201	44.858490	10.215.173.1	inbox.google.com	TCP	600	57848 → https(443) [ACK] Seq=1 Ack=1 Win=65536 Len=512 [TCP PDU reassembled in 206]
202	44.858684	inbox.google.com	10.215.173.1	TCP	88	https(443) → 57848 [ACK] Seq=1 Ack=513 Win=1047552 Len=0
203	44.858955	10.215.173.1	inbox.google.com	TCP	600	57848 → https(443) [PSH, ACK] Seq=513 Ack=1 Win=65536 Len=512 [TCP PDU reassembled in 206]
204	44.859079	10.215.173.1	inbox.google.com	TCP	600	57848 → https(443) [ACK] Seq=1025 Ack=1 Win=65536 Len=512 [TCP PDU reassembled in 206]
205	44.859103	10.215.173.1	inbox.google.com	TCP	600	57848 → https(443) [PSH, ACK] Seq=1537 Ack=1 Win=65536 Len=512 [TCP PDU reassembled in 206]
206	44.859121	10.215.173.1	inbox.google.com	TLSv1.3	316	Client Hello (SNI=inbox.google.com)
207	44.859423	inbox.google.com	10.215.173.1	TCP	88	https(443) → 57848 [ACK] Seq=1 Ack=2279 Win=1045504 Len=0
208	44.944369	inbox.google.com	10.215.173.1	TLSv1.3	1488	Server Hello, Change Cipher Spec
209	44.945084	10.215.173.1	inbox.google.com	TCP	88	57848 → https(443) [ACK] Seq=2279 Ack=1401 Win=86016 Len=0
210	44.945147	inbox.google.com	10.215.173.1	TLSv1.3	152	Application Data
211	44.945493	10.215.173.1	inbox.google.com	TCP	88	57848 → https(443) [ACK] Seq=2279 Ack=1466 Win=86016 Len=0
212	44.949061	10.215.173.1	inbox.google.com	TLSv1.3	160	Change Cipher Spec, Application Data
213	44.949123	10.215.173.1	inbox.google.com	TLSv1.3	180	Application Data
214	44.949139	10.215.173.1	inbox.google.com	TLSv1.3	2424	Application Data
215	44.949171	10.215.173.1	inbox.google.com	TLSv1.3	628	Application Data
216	44.949186	10.215.173.1	inbox.google.com	TLSv1.3	144	Application Data
217	44.949196	10.215.173.1	inbox.google.com	TLSv1.3	276	Application Data
218	44.949439	inbox.google.com	10.215.173.1	TCP	88	https(443) → 57848 [ACK] Seq=1466 Ack=5569 Win=1044480 Len=0
219	45.021242	inbox.google.com	10.215.173.1	TLSv1.3	1048	Application Data, Application Data
220	45.021902	10.215.173.1	inbox.google.com	TLSv1.3	120	Application Data
221	45.022030	inbox.google.com	10.215.173.1	TCP	88	https(443) → 57848 [ACK] Seq=2428 Ack=5600 Win=1047552 Len=0
222	45.022099	inbox.google.com	10.215.173.1	TLSv1.3	120	Application Data
223	45.064614	10.215.173.1	inbox.google.com	TCP	88	57848 → https(443) [ACK] Seq=5600 Ack=2459 Win=89088 Len=0
224	45.103785	inbox.google.com	10.215.173.1	TLSv1.3	1164	Application Data, Application Data, Application Data, Application Data
225	45.103984	10.215.173.1	inbox.google.com	TCP	88	57848 → https(443) [ACK] Seq=5600 Ack=3534 Win=91136 Len=0
226	45.105515	10.215.173.1	inbox.google.com	TLSv1.3	128	Application Data
227	45.105736	inbox.google.com	10.215.173.1	TCP	88	https(443) → 57848 [ACK] Seq=3534 Ack=5639 Win=1047552 Len=0
228	45.115564	inbox.google.com	10.215.173.1	TLSv1.3	1568	Application Data, Application Data
229	45.117804	inbox.google.com	10.215.173.1	TLSv1.3	1488	Application Data
230	45.118104	10.215.173.1	inbox.google.com	TCP	88	57848 → https(443) [ACK] Seq=5639 Ack=6414 Win=114688 Len=0
231	45.120245	inbox.google.com	10.215.173.1	TLSv1.3	2888	Application Data, Application Data
232	45.123230	inbox.google.com	10.215.173.1	TLSv1.3	1488	Application Data
233	45.123470	10.215.173.1	inbox.google.com	TCP	88	57848 → https(443) [ACK] Seq=5639 Ack=10614 Win=140288 Len=0
234	45.123515	inbox.google.com	10.215.173.1	TLSv1.3	1488	Application Data
235	45.127451	inbox.google.com	10.215.173.1	TLSv1.3	1268	Application Data
236	45.127733	10.215.173.1	inbox.google.com	TCP	88	57848 → https(443) [ACK] Seq=5639 Ack=13193 Win=145408 Len=0
237	46.702384	10.215.173.1	10.215.173.2	DNS	112	Standard query 0x0836 HTTPS accounts.google.com
238	46.707524	10.215.173.1	10.215.173.2	DNS	112	Standard query 0x0a44 A accounts.google.com
239	46.714413	10.215.173.2	10.215.173.1	DNS	164	Standard query response 0x0836 HTTPS accounts.google.com SOA ns1.google.com
240	46.720421	10.215.173.2	10.215.173.1	DNS	128	Standard query response 0x0a44 A accounts.google.com A 108.177.11.84
241	46.800267	10.215.173.1	accounts.google.com	SKYPE	1324	Unknown_0
242	46.805394	10.215.173.1	accounts.google.com	SKYPE	1324	Unknown_0
243	46.809086	10.215.173.1	10.215.173.2	DNS	108	Standard query 0x64fe HTTPS www.google.com
244	46.820592	10.215.173.1	10.215.173.2	DNS	108	Standard query 0xc1fe A www.google.com
245	46.824222	10.215.173.2	10.215.173.1	DNS	132	Standard query response 0x64fe HTTPS www.google.com HTTPS
246	46.828232	10.215.173.2	10.215.173.1	DNS	124	Standard query response 0xc1fe A www.google.com A 142.250.64.132
247	46.851879	10.215.173.1	www.google.com	SKYPE	1324	Unknown_0
248	46.856273	10.215.173.1	www.google.com	SKYPE	1324	Unknown_0
249	46.862371	10.215.173.1	www.google.com	TCP	108	55614 → https(443) [SYN] Seq=0 Win=65535 Len=0 MSS=9960 SACK_PERM TSval=3340965567 TSecr=0 WS=1024
250	46.890077	accounts.google.com	10.215.173.1	SKYPE	116	Unknown_0
251	46.890541	accounts.google.com	10.215.173.1	SKYPE	1324	Unknown_0
252	46.890695	accounts.google.com	10.215.173.1	SKYPE	1324	Unknown_0
253	46.890794	accounts.google.com	10.215.173.1	SKYPE	1324	Unknown_0
254	46.890860	accounts.google.com	10.215.173.1	SKYPE	1324	Unknown_0
255	46.890923	accounts.google.com	10.215.173.1	SKYPE	1324	Unknown_0
256	46.891055	accounts.google.com	10.215.173.1	SKYPE	860	Unknown_0
257	46.930139	www.google.com	10.215.173.1	SKYPE	116	Unknown_0
258	46.930657	www.google.com	10.215.173.1	SKYPE	1324	Unknown_0
259	46.930838	www.google.com	10.215.173.1	SKYPE	1324	Unknown_0
260	46.930967	www.google.com	10.215.173.1	SKYPE	1324	Unknown_0
261	46.938505	www.google.com	10.215.173.1	TCP	96	https(443) → 55614 [SYN, ACK] Seq=0 Ack=1 Win=1024 Len=0 MSS=9960 WS=1024
262	46.938754	10.215.173.1	www.google.com	TCP	88	55614 → https(443) [RST] Seq=1 Win=0 Len=0
263	46.938829	www.google.com	10.215.173.1	TCP	88	https(443) → 55614 [RST, ACK] Seq=1 Ack=1 Win=64512 Len=0
264	46.943749	www.google.com	10.215.173.1	SKYPE	1324	Unknown_0
265	46.944293	www.google.com	10.215.173.1	SKYPE	1324	Unknown_0
266	46.944753	www.google.com	10.215.173.1	SKYPE	1324	Unknown_0
267	47.243994	accounts.google.com	10.215.173.1	SKYPE	1324	Unknown_0
268	58.099601	10.215.173.1	inbox.google.com	TCP	88	57848 → https(443) [RST, ACK] Seq=5639 Ack=13193 Win=145408 Len=0
269	58.100126	inbox.google.com	10.215.173.1	TCP	88	https(443) → 57848 [RST, ACK] Seq=13193 Ack=5639 Win=64512 Len=0
270	59.911444	dgw-mini.c10r.facebook.com	10.215.173.1	TCP	88	https(443) → 39058 [RST, ACK] Seq=3846 Ack=2433 Win=64512 Len=0
271	61.458353	10.215.173.1	10.215.173.2	DNS	116	Standard query 0xcfc4 A z-m-gateway.facebook.com
272	61.476853	10.215.173.2	10.215.173.1	DNS	160	Standard query response 0xcfc4 A z-m-gateway.facebook.com CNAME dgw-mini.c10r.facebook.com A 57.144.162.3
273	61.487893	10.215.173.1	dgw-mini.c10r.facebook.com	TCP	108	41244 → https(443) [SYN] Seq=0 Win=65535 Len=0 MSS=9960 SACK_PERM TSval=485636539 TSecr=0 WS=1024
274	61.568827	dgw-mini.c10r.facebook.com	10.215.173.1	TCP	96	https(443) → 41244 [SYN, ACK] Seq=0 Ack=1 Win=1024 Len=0 MSS=9960 WS=1024
275	61.569718	10.215.173.1	dgw-mini.c10r.facebook.com	TCP	88	41244 → https(443) [ACK] Seq=1 Ack=1 Win=65536 Len=0
276	61.584133	10.215.173.1	dgw-mini.c10r.facebook.com	TLSv1.3	304	Client Hello (SNI=z-m-gateway.facebook.com)
277	61.585018	dgw-mini.c10r.facebook.com	10.215.173.1	TCP	88	https(443) → 41244 [ACK] Seq=1 Ack=216 Win=1047552 Len=0
278	61.659516	dgw-mini.c10r.facebook.com	10.215.173.1	TLSv1.3	1468	Server Hello, Change Cipher Spec, Application Data
279	61.660444	10.215.173.1	dgw-mini.c10r.facebook.com	TCP	88	41244 → https(443) [ACK] Seq=216 Ack=1381 Win=86016 Len=0
280	61.660552	dgw-mini.c10r.facebook.com	10.215.173.1	TLSv1.3	1996	Application Data, Application Data
281	61.660833	10.215.173.1	dgw-mini.c10r.facebook.com	TCP	88	41244 → https(443) [ACK] Seq=216 Ack=3290 Win=105472 Len=0
282	61.705403	10.215.173.1	dgw-mini.c10r.facebook.com	TLSv1.3	92	Change Cipher Spec
283	61.705600	10.215.173.1	dgw-mini.c10r.facebook.com	TLSv1.3	156	Application Data
284	61.705944	dgw-mini.c10r.facebook.com	10.215.173.1	TCP	88	https(443) → 41244 [ACK] Seq=3290 Ack=291 Win=1047552 Len=0
285	61.741003	10.215.173.1	dgw-mini.c10r.facebook.com	TLSv1.3	140	Application Data
286	61.741078	10.215.173.1	dgw-mini.c10r.facebook.com	TLSv1.3	140	Application Data
287	61.741100	10.215.173.1	dgw-mini.c10r.facebook.com	TLSv1.3	124	Application Data
288	61.741117	10.215.173.1	dgw-mini.c10r.facebook.com	TLSv1.3	876	Application Data
289	61.741147	10.215.173.1	dgw-mini.c10r.facebook.com	TLSv1.3	1260	Application Data
290	61.741411	dgw-mini.c10r.facebook.com	10.215.173.1	TCP	88	https(443) → 41244 [ACK] Seq=3290 Ack=2396 Win=1045504 Len=0
291	61.779346	dgw-mini.c10r.facebook.com	10.215.173.1	TLSv1.3	268	Application Data
292	61.779990	10.215.173.1	dgw-mini.c10r.facebook.com	TCP	88	41244 → https(443) [ACK] Seq=2396 Ack=3469 Win=109568 Len=0
293	61.780236	dgw-mini.c10r.facebook.com	10.215.173.1	TLSv1.3	160	Application Data
294	61.780628	10.215.173.1	dgw-mini.c10r.facebook.com	TCP	88	41244 → https(443) [ACK] Seq=2396 Ack=3543 Win=109568 Len=0
295	61.781118	10.215.173.1	dgw-mini.c10r.facebook.com	TLSv1.3	124	Application Data
296	61.781476	dgw-mini.c10r.facebook.com	10.215.173.1	TCP	88	https(443) → 41244 [ACK] Seq=3543 Ack=2433 Win=1045504 Len=0
297	61.814019	dgw-mini.c10r.facebook.com	10.215.173.1	TLSv1.3	120	Application Data
298	61.815389	dgw-mini.c10r.facebook.com	10.215.173.1	TLSv1.3	124	Application Data
299	61.816299	10.215.173.1	dgw-mini.c10r.facebook.com	TCP	88	41244 → https(443) [ACK] Seq=2433 Ack=3609 Win=109568 Len=0
300	61.892229	dgw-mini.c10r.facebook.com	10.215.173.1	TLSv1.3	304	Application Data, Application Data
301	61.939387	10.215.173.1	dgw-mini.c10r.facebook.com	TCP	88	41244 → https(443) [ACK] Seq=2433 Ack=3824 Win=113664 Len=0
302	79.943459	accounts.google.com	10.215.173.1	SKYPE	360	Unknown_0
303	102.664130	10.215.173.1	10.215.173.2	DNS	112	Standard query 0x56ee A play.googleapis.com
304	102.699894	10.215.173.2	10.215.173.1	DNS	176	Standard query response 0x56ee A play.googleapis.com A 216.239.36.223 A 216.239.32.223 A 216.239.38.223 A 216.239.34.223
305	102.708913	10.215.173.1	play.googleapis.com	TCP	108	36520 → https(443) [SYN] Seq=0 Win=65535 Len=0 MSS=9960 SACK_PERM TSval=1634846748 TSecr=0 WS=1024
306	102.788440	play.googleapis.com	10.215.173.1	TCP	96	https(443) → 36520 [SYN, ACK] Seq=0 Ack=1 Win=1024 Len=0 MSS=9960 WS=1024
307	102.789440	10.215.173.1	play.googleapis.com	TCP	88	36520 → https(443) [ACK] Seq=1 Ack=1 Win=65536 Len=0
308	102.800120	10.215.173.1	play.googleapis.com	TCP	600	36520 → https(443) [ACK] Seq=1 Ack=1 Win=65536 Len=512 [TCP PDU reassembled in 309]
309	102.800547	10.215.173.1	play.googleapis.com	TLSv1.3	92	Client Hello (SNI=play.googleapis.com)
310	102.801150	play.googleapis.com	10.215.173.1	TCP	88	https(443) → 36520 [ACK] Seq=1 Ack=518 Win=1047552 Len=0
311	102.887417	play.googleapis.com	10.215.173.1	TLSv1.3	1488	Server Hello, Change Cipher Spec
312	102.889930	10.215.173.1	play.googleapis.com	TCP	88	36520 → https(443) [ACK] Seq=518 Ack=1401 Win=86016 Len=0
313	102.889999	play.googleapis.com	10.215.173.1	TLSv1.3	3188	Application Data
314	102.890364	10.215.173.1	play.googleapis.com	TCP	88	36520 → https(443) [ACK] Seq=518 Ack=4500 Win=105472 Len=0
315	102.930776	10.215.173.1	play.googleapis.com	TLSv1.3	152	Change Cipher Spec, Application Data
316	102.931050	play.googleapis.com	10.215.173.1	TCP	88	https(443) → 36520 [ACK] Seq=4500 Ack=582 Win=1047552 Len=0
317	102.933202	10.215.173.1	play.googleapis.com	TLSv1.3	304	Application Data
318	102.933435	play.googleapis.com	10.215.173.1	TCP	88	https(443) → 36520 [ACK] Seq=4500 Ack=798 Win=1047552 Len=0
319	103.061643	play.googleapis.com	10.215.173.1	TLSv1.3	1912	Application Data, Application Data, Application Data, Application Data
320	103.062440	10.215.173.1	play.googleapis.com	TCP	88	36520 → https(443) [ACK] Seq=798 Ack=6324 Win=111616 Len=0
321	103.074441	10.215.173.1	play.googleapis.com	TLSv1.3	1412	Application Data
322	103.074797	play.googleapis.com	10.215.173.1	TCP	88	https(443) → 36520 [ACK] Seq=6324 Ack=2121 Win=1046528 Len=0
323	103.241953	play.googleapis.com	10.215.173.1	TLSv1.3	1088	Application Data
324	103.243788	play.googleapis.com	10.215.173.1	TLSv1.3	232	Application Data, Application Data
325	103.244619	10.215.173.1	play.googleapis.com	TCP	88	36520 → https(443) [ACK] Seq=2121 Ack=7469 Win=124928 Len=0
326	121.898296	10.215.173.1	dgw-mini.c10r.facebook.com	TLSv1.3	124	Application Data
327	121.899227	dgw-mini.c10r.facebook.com	10.215.173.1	TCP	88	https(443) → 41244 [ACK] Seq=3824 Ack=2470 Win=1047552 Len=0
328	122.078090	dgw-mini.c10r.facebook.com	10.215.173.1	TLSv1.3	128	Application Data
329	122.078717	10.215.173.1	dgw-mini.c10r.facebook.com	TCP	88	41244 → https(443) [ACK] Seq=2470 Ack=3865 Win=113664 Len=0
330	165.537132	play.googleapis.com	10.215.173.1	TCP	88	https(443) → 36520 [RST, ACK] Seq=7469 Ack=2121 Win=64512 Len=0
331	182.081324	10.215.173.1	dgw-mini.c10r.facebook.com	TLSv1.3	124	Application Data
332	182.082429	dgw-mini.c10r.facebook.com	10.215.173.1	TCP	88	https(443) → 41244 [ACK] Seq=3865 Ack=2507 Win=1047552 Len=0
333	182.234461	dgw-mini.c10r.facebook.com	10.215.173.1	TLSv1.3	128	Application Data
334	182.234924	10.215.173.1	dgw-mini.c10r.facebook.com	TCP	88	41244 → https(443) [ACK] Seq=2507 Ack=3906 Win=113664 Len=0
335	198.733441	10.215.173.1	10.215.173.2	DNS	112	Standard query 0xa503 A play.googleapis.com
336	198.751893	10.215.173.2	10.215.173.1	DNS	176	Standard query response 0xa503 A play.googleapis.com A 216.239.38.223 A 216.239.36.223 A 216.239.34.223 A 216.239.32.223
337	198.759394	10.215.173.1	play.googleapis.com	TCP	108	55284 → https(443) [SYN] Seq=0 Win=65535 Len=0 MSS=9960 SACK_PERM TSval=1354609168 TSecr=0 WS=1024
338	198.835223	play.googleapis.com	10.215.173.1	TCP	96	https(443) → 55284 [SYN, ACK] Seq=0 Ack=1 Win=1024 Len=0 MSS=9960 WS=1024
339	198.836158	10.215.173.1	play.googleapis.com	TCP	88	55284 → https(443) [ACK] Seq=1 Ack=1 Win=65536 Len=0
340	198.854761	10.215.173.1	play.googleapis.com	TCP	600	55284 → https(443) [ACK] Seq=1 Ack=1 Win=65536 Len=512 [TCP PDU reassembled in 341]
341	198.855277	10.215.173.1	play.googleapis.com	TLSv1.3	92	Client Hello (SNI=play.googleapis.com)
342	198.855902	play.googleapis.com	10.215.173.1	TCP	88	https(443) → 55284 [ACK] Seq=1 Ack=518 Win=1047552 Len=0
343	198.942234	play.googleapis.com	10.215.173.1	TLSv1.3	4588	Server Hello, Change Cipher Spec, Application Data
344	198.943347	10.215.173.1	play.googleapis.com	TCP	88	55284 → https(443) [ACK] Seq=518 Ack=4502 Win=86016 Len=0
345	198.968471	10.215.173.1	play.googleapis.com	TLSv1.3	152	Change Cipher Spec, Application Data
346	198.968771	play.googleapis.com	10.215.173.1	TCP	88	https(443) → 55284 [ACK] Seq=4502 Ack=582 Win=1047552 Len=0
347	198.974360	10.215.173.1	play.googleapis.com	TLSv1.3	304	Application Data
348	198.974747	play.googleapis.com	10.215.173.1	TCP	88	https(443) → 55284 [ACK] Seq=4502 Ack=798 Win=1047552 Len=0
349	199.102075	play.googleapis.com	10.215.173.1	TLSv1.3	1752	Application Data, Application Data, Application Data, Application Data
350	199.113219	10.215.173.1	play.googleapis.com	TLSv1.3	2436	Application Data
351	199.113625	play.googleapis.com	10.215.173.1	TCP	88	https(443) → 55284 [ACK] Seq=6165 Ack=3147 Win=1045504 Len=0
352	199.242962	play.googleapis.com	10.215.173.1	TLSv1.3	1140	Application Data, Application Data, Application Data
353	199.244464	play.googleapis.com	10.215.173.1	TCP	88	https(443) → 55284 [FIN, ACK] Seq=7219 Ack=3147 Win=1048576 Len=0
354	199.247515	10.215.173.1	play.googleapis.com	TLSv1.3	112	Application Data
355	199.247603	play.googleapis.com	10.215.173.1	TCP	88	https(443) → 55284 [ACK] Seq=7220 Ack=3171 Win=64512 Len=0
356	199.248449	10.215.173.1	play.googleapis.com	TCP	88	55284 → https(443) [FIN, ACK] Seq=3171 Ack=7220 Win=104448 Len=0
357	199.248478	play.googleapis.com	10.215.173.1	TCP	88	https(443) → 55284 [ACK] Seq=7220 Ack=3172 Win=64512 Len=0
358	242.237498	10.215.173.1	dgw-mini.c10r.facebook.com	TLSv1.3	124	Application Data
359	242.238243	dgw-mini.c10r.facebook.com	10.215.173.1	TCP	88	https(443) → 41244 [ACK] Seq=3906 Ack=2544 Win=1047552 Len=0
360	242.389885	dgw-mini.c10r.facebook.com	10.215.173.1	TLSv1.3	128	Application Data
361	242.390132	10.215.173.1	dgw-mini.c10r.facebook.com	TCP	88	41244 → https(443) [ACK] Seq=2544 Ack=3947 Win=113664 Len=0
362	302.392856	10.215.173.1	dgw-mini.c10r.facebook.com	TLSv1.3	124	Application Data
363	302.393581	dgw-mini.c10r.facebook.com	10.215.173.1	TCP	88	https(443) → 41244 [ACK] Seq=3947 Ack=2581 Win=1047552 Len=0
364	302.541511	dgw-mini.c10r.facebook.com	10.215.173.1	TLSv1.3	128	Application Data
365	302.541787	10.215.173.1	dgw-mini.c10r.facebook.com	TCP	88	41244 → https(443) [ACK] Seq=2581 Ack=3988 Win=113664 Len=0
366	362.545735	10.215.173.1	dgw-mini.c10r.facebook.com	TLSv1.3	124	Application Data
367	362.547567	dgw-mini.c10r.facebook.com	10.215.173.1	TCP	88	https(443) → 41244 [ACK] Seq=3988 Ack=2618 Win=1047552 Len=0
368	362.700644	dgw-mini.c10r.facebook.com	10.215.173.1	TLSv1.3	128	Application Data
369	362.701122	10.215.173.1	dgw-mini.c10r.facebook.com	TCP	88	41244 → https(443) [ACK] Seq=2618 Ack=4029 Win=113664 Len=0
370	451.229728	dgw-mini.c10r.facebook.com	10.215.173.1	TCP	88	https(443) → 41244 [RST, ACK] Seq=4029 Ack=2618 Win=64512 Len=0
371	452.773842	10.215.173.1	10.215.173.2	DNS	116	Standard query 0xed73 A z-m-gateway.facebook.com
372	452.802501	10.215.173.2	10.215.173.1	DNS	160	Standard query response 0xed73 A z-m-gateway.facebook.com CNAME dgw-mini.c10r.facebook.com A 57.144.162.3
